sentence,word,explanation,first_new_sentence,second_new_sentence
sentence, word, explanation, first new sentence, second new sentence
Nothing makes me happier to be single than meeting a couple who share an email address., couple, A couple refers to two people in an intimate relationship, The couple next door invited us over for dinner this weekend., The couple of apples on the table were ripe and ready to eat.
I asked an australian to greet me... he kept beating around the bush saying i might., bush," Bush can refer to a dense growth of shrubs or trees, and colloquially refers to rural or undeveloped areas", The dense bush was a perfect hiding place for the deer., The Australian countryside is often referred to as the bush.
Theres a fine line between cuddling and holding someone down so they cant get away., line," A line can refer to a boundary or limit, and also a line of text", The teacher drew a line on the board for the students to follow., The author wrote a beautiful line in her poem that resonated with many readers. 
I just found out a distant relative of mine has eaten three people. its a lot to digest., digest," To digest means to break down food in the body, and it can also mean to process information or thoughts", The body requires time to digest food after a large meal., It took her a while to digest the news about her promotion.
"A skeleton walks into a bar and says, gimme a beer and a mop.", bar," A bar refers to an establishment serving alcoholic drinks, and it can also mean a barrier or counter", We went to the local bar to celebrate my birthday., The lawyer walked up to the bar of justice to present her case.
Theres no such thing as negative energy, energy," Energy can refer to the strength and vitality required for physical or mental activity, and it can also refer to a feeling or atmosphere", The solar panels convert sunlight into renewable energy., She could feel the negative energy in the room during the argument.
"Please note that the jokes have been analyzed to find the words meeting your criteria of having dual meanings, being spelled the same way, single word entries, and fitting into the prescribed format.",,,,
