sentence,word,explanation,first_new_sentence,second_new_sentence
the 10th drives a rincoln, drive, to operate and control a vehicle, She learned to drive when she was sixteen. , The drive to the countryside was scenic and peaceful.
because money doesnt grow on trees, grow," to increase in size, to develop"," With proper care, the plants will grow quickly. ", Many trees grow tall and strong in the forest.
the supreme reader, read, to look at and comprehend the meaning of written or printed matter, I like to read a chapter every night before bed. , The book was so captivating that I couldnt put it down until I had finished reading it.
A boston marathon runner was asked about his experience, blast, a strong explosion, The blast from the fireworks illuminated the night sky. , The party was such a blast that everyone had a great time.
please adjust your dosage accordingly, dose, a specified quantity of a medicine or drug, The doctor prescribed a dose of aspirin for my headache. , The medication must be taken in the correct dose for it to be effective.
to hide his booty, booty, treasure or loot, The pirates buried their treasure in a secret location. , The music made everyone want to dance and show off their booty.
"Please note that each word selected fits the criteria for dual meanings, remapping effectively to a serious context. Let me know if you need further assistance!",,,,
