sentence,word,explanation,first_new_sentence,second_new_sentence
Why did the vegan avoid the confrontation? he didnt want any beef., beef, The word beef refers to the meat from cattle., The cow provided us with tender beef for dinner.," The two friends had a serious disagreement, but neither wanted to discuss their beef openly."
What do you call a fruit that procrastinates? ...a cramberry!, cram, The word cram refers to the act of studying intensively just before an exam., Students often have to cram for their finals at the end of the semester., He was forced to cram the whole series into one weekend due to his busy schedule.
I wish they made bar-stools with seat belts and dual side airbags., belt, The word belt refers to a flexible band worn around the waist., He wore a sturdy leather belt to secure his pants firmly., The belt of safety features in the car ensured everyones protection during the accident.
What does a german use to polish his trumpet? toot tonic, toot, The word toot refers to the sound made by a horn or trumpet., The child let out a loud toot as he honked his toy car., The speaker made a toot sound to signal the start of the event.
Where do you weigh pies? somewhere over a rainbow..., weigh, The word weigh refers to measuring the heaviness of an object., The factory workers had to weigh each package before shipping., You can weigh yourself on the scale after a long run.
Feel free to ask if you need any additional modifications or information!,,,,
