sentence,word,explanation,first_new_sentence,second_new_sentence
sentence, word, explanation, first new sentence, second new sentence
Whys prince george great at measuring out 6 inches? because hes a little ruler., ruler, A ruler is a tool used for measuring. / A ruler is the person in charge of a country or state., The teacher used a ruler to draw a straight line on the board., The ancient king was known as a just ruler who brought peace to his people.
"What has 6 letters, starts with p, and ends a sentence? parole.", parole, Parole is the release of a prisoner before the completion of their sentence. / Parole can also refer to a set of conditions a released prisoner must follow., The prisoner was granted parole after serving three years of his sentence., The court outlined strict parole conditions that he must adhere to.
What do you call a gorilla who magically smokes weed? hairy potter., potter, A potter is a person who makes pottery. / Potter can refer to someone who pots plants or grows them., The potter carefully shaped the clay to create a beautiful vase.," The gardener was known as a potter, cultivating various herbs and flowers."
What do you call the ghost of a native american accordion player? pocahontas., hontas," Hontas refers to a historical figure, Pocahontas, who was a Native American. / It can also suggest honest, especially in a phonetic pun context.", Pocahontas played a significant role in early American history as a mediator between her tribe and the settlers., The hontas in the story was known for her truthful nature and integrity.
Why did the arabic man ask for her hand in marriage? because she stole his heart., heart, The heart is an organ that pumps blood through the body. / The heart can also symbolize love or affection., The doctor explained how the heart functions to maintain blood circulation., Their shared passion for music was the heart of their relationship.
What is a creationists favorite button in Pokemon? b to cancel evolution., evolution," Evolution refers to the change in the inherited characteristics of biological populations over successive generations. / In the context of Pokemon, evolution is a game mechanic where a Pokémon changes into a different species.", The theory of evolution has been a significant topic in biology for over a century.," In the game, evolution is a key feature that allows players to improve their Pokémons abilities."
This format captures the essence of the jokes while illustrating the dual meanings of the selected words.,,,,
