sentence,word,explanation,first_new_sentence,second_new_sentence
My playstation got stolen... i have no one to console me.,console,to comfort someone in grief or sorrow,The therapist aims to console her patient after the loss of a loved one.,The console system was designed to manage and control various functions.
What did the fish say when he ran into a wall? dam.,dam,a barrier to hold back water,The engineers constructed a dam to manage the river flow.,The expressway had several concrete dams to prevent flooding.
What does a jewish pedophile say? want to buy a candy?,candy,type of sweet or confection,The child bought a piece of candy from the store.,Her mother insisted on checking the candy for safety before she let her eat it.
Why cant kylo ren get a date? because he has always ben solo.,solo,to be by oneself,"She performed a solo song at the concert, captivating the audience.","During the trip, he chose to travel solo to enjoy time alone."
How was i supposed to know she was ugly? she had big titties.,big,large or bulky,The elephant is known for its big size compared to other animals.,She wore a big smile when she won the award.
Feel free to ask if you need additional help or modifications!,,,,
