sentence,word,explanation,first_new_sentence,second_new_sentence
sentence, word, explanation, first new sentence, second new sentence
What did the kiwi say to the rabbi? hebrew., hebrew, Refers to the Hebrew language, She read passages from the Hebrew Bible during the ceremony., He felt proud of his Hebrew ancestry and background.
What kind of bar do fish go to? a sand bar., bar, Refers to a sandbar in a body of water, The town council decided to build a bar on the new waterfront., It is important to check the barometric pressure when sailing.
Why did the pharaoh build a statue of himself? because he sphinx hes the best., sphinx, Refers to the mythological creature, The Sphinx of Giza is one of the most recognizable monuments in Egypt., A sphinx poses a riddle that must be solved to pass.
"What did the bread say after its massage? ahh, i kneaded that.", kneaded, Refers to the act of kneading dough, The baker kneaded the dough carefully to ensure it was elastic., The patient kneaded the clay to make it easier to work with.
Feel free to ask for any adjustments or further assistance!,,,,
