sentence,word,explanation,first_new_sentence,second_new_sentence
sentence, word, explanation, first new sentence, second new sentence
What do you call a bus on its way to comic con? virgin mobile, virgin, an inexperienced person, The young actor was still a virgin in the film industry. , The Virgin Islands are known for their beautiful beaches.
Why cant you trust an atom? because they make up literally everything, make, to fabricate, Some people like to make excuses instead of taking responsibility for their actions. , They need to make a plan for the upcoming event.
What does the date inside of a wedding ring stand for? best before..., date, a specific day, The meeting date has been set for next Tuesday. , The produce section has a lot of fresh date fruit on display.
Let me know if you need any further modifications or additional information!,,,,
