sentence,word,explanation,first_new_sentence,second_new_sentence
sentence, word, explanation, first new sentence, second new sentence
Why do they call camels the ships of the desert? because theyre full of arab semen, ship, refers to a type of vessel used for transport vs. a vessel used for transporting goods and people," The ship departed at dawn, carrying cargo across the sea.", The financial planner had a ship that he used to set sail for new investment opportunities.
What do you call an illegally parked frog? toad., toad, refers to a type of amphibian vs. toad as it relates to a term for an illegal parking situation," The toad jumped across the road, searching for a place to rest."," After analyzing the data, the researchers observed a toad in the area indicating a healthy ecosystem."
Why couldnt the octopus take off her bra? it had suction cups., suction, refers to the action of drawing in versus a device that draws in liquids or gases, The suction of the vacuum cleaner made it easy to clean the carpet., The engineer designed a suction system to efficiently remove debris from the construction site.
Why do cows have bells? because their horns dont work, horn, refers to an instrument that produces sound vs. a bony projection on an animals head," The musician played a horn at the festival, captivating the audience.", The cow had a shiny horn that was used for protection against predators.
