sentence,word,explanation,first_new_sentence,second_new_sentence
When my father wont stop telling bad jokes... ... the puns go on dad nauseum!, nauseum, Nauseum is a term indicating the feeling of sickness or an unpleasant sensation in the stomach," After eating the spoiled food, I was struck by a severe nauseum.", The film was so repetitive that it created a nauseum in the audience from its unoriginality.
What did the buffalo say to his son before he went to college? bison., bison, Bison refers to a large mammal that is native to North America, The bison grazed peacefully on the open plains., The restaurants special featured a delicious bison burger.
I accidentally left a butt plug up her ass for 2 weeks... no shit, butt, Butt refers to the rear end or backside of a person, He fell and landed hard on his butt., The design of the chair is intended to provide maximum comfort for the butt. 
Why do the undead read cringe stories? because theyre already... dead inside., dead, Dead refers to the state of no longer living, The plant was left without water and eventually died., The project was deemed a dead end after several failed attempts to revive it.
I decided to sell my vacuum... it was just collecting dust., dust," Dust refers to fine, dry particles of matter", The dust collected on the shelf indicated that it hadn’t been cleaned in weeks., The ancient artifacts were covered in dust before they were restored.
What does a nosy pepper do? gets jalapeno business., business, Business refers to a persons occupation or the activity of buying and selling goods, She started a business selling handmade crafts online., The meeting concluded with a discussion about the future of the company’s business model.
