sentence,word,explanation,first_new_sentence,second_new_sentence
sentence, word, explanation, first new sentence, second new sentence
Why did the muslim with a toothache go to the airport? for a free cavity search., cavity," A cavity refers to a hole in a tooth. It also refers to a space or void, especially in a body. ", The dentist confirmed that I had a cavity in my molar., The archaeologists discovered a cavity within the ancient skeleton they found.
A conductor ... what do you call a part time conductor ?? . . . a *semiconductor*, semiconductor," In physics, a semiconductor is a material that has electrical conductivity between that of a conductor and an insulator. In electronics, it often refers to components made from these materials.", Silicon is a common semiconductor used in electronic devices. , The design team created a solar panel with a semiconductor that increased efficiency.
What is your biggest weakness? sometimes im too succinct can you give an example? yes, succinct," In language, succinct means being clear and brief in expression. In the context of a poem or writing, it can refer to the style or manner of writing.", His succinct response provided clear answers to the interview questions., The poets succinct use of language conveyed deep emotion in just a few lines.
What do you call one-tenth of a bell? a decibell., decibell," A decibel is a unit of measurement for sound intensity. In a musical sense, it refers to a melodic tone or bell-like sound."," The concert was measured at 100 decibels, causing concerns for hearing safety.", The ringing of the church decibel at noon signaled the start of the service.
