sentence,word,explanation,first_new_sentence,second_new_sentence
I like my women like I like my slaves: coffee., coffee, The word coffee refers to a beverage made from roasted coffee beans, The Cup of coffee in the morning wakes me up., She had her coffee with a splash of cream.
I love spending time with my step ladder. Ive never known my real ladder., ladder, The word ladder refers to a structure used for climbing up or down, I used a ladder to reach the roof., My real ladder is helping me with my projects.
Fold., fold," The word fold refers to a technique used in games, especially poker, to discard a hand", He had to fold the letter before sending it., The fabric will fold easily when pressed.
What do mexicans put under their carpet? underlay, underlay, The word underlay refers to a material placed beneath a carpet, We need to install an underlay before laying the carpet., We should add a sound underlay to that scene.
"Each line contains the sentence from the joke, the key word, an explanation of the words meanings, and the two serious sentences featuring each meaning of the word.",,,,
