sentence,word,explanation,first_new_sentence,second_new_sentence
1. I bought a new lock for my bedroom door wound up getting half off when it didnt work., lock, A lock is a device for securing something., The lock on my front door is broken and needs to be replaced., The lock of the door was so rusty that it could not be opened easily.
2. Why couldnt jfk be a boxer? he couldnt take shots to the head., shot, A shot is a hit or strike., He took a shot at the target and hit the bullseye., The shot was heard across the entire hall during the event.
3. Why did the alarm go off at the mansion? because the owner entered the correct code., code, A code is a system of symbols used to represent information., The secret code was revealed during the meeting., The genetic code determines the traits of living organisms.
4. Why was six afraid of seven? because seven raped snow white., seven, Seven is the number following six., There are seven colors in a rainbow., Seven days make a week.
5. A dog was giving birth on the side of the road... she was cited with littering., littering, Littering is the act of throwing away trash in public places., The littering in the park drew complaints from residents., Littering is illegal and can result in fines. 
