sentence,word,explanation,first_new_sentence,second_new_sentence
What happened when the reporter fell into the water? she became an anchor..., anchor," The word anchor refers to a heavy object that moors a vessel in place, and also signifies a person who presents a news broadcast.", The ship was secured in place with a heavy anchor. , The news anchor presented the evening news with confidence.
Why did the manic depressive cross the freeway? to get to the *other side*, side," The word side refers to a position or direction, and it can also describe a persons perspective or opinion.", She stood on the left side of the road to wait for the bus. , His side of the argument was well-received during the debate.
What do you call a sad coffee? a depresso, depresso," The term depresso is a play on depressed, while also referring to espresso, a type of coffee.", The barista made a rich espresso to kickstart the morning. ," After hearing the bad news, she was feeling quite depressed."
Why do cows have hooves instead of feet? because they lactose.., lactose," The word lactose refers to a sugar present in milk, and can also be humorously interpreted as lack toes."," Milk is rich in lactose, which some people struggle to digest. ", My friend often jokes that he lacks toes after a few too many drinks.
Feel free to ask for further assistance or clarification!,,,,
