sentence,word,explanation,first_new_sentence,second_new_sentence
sentence, word, explanation, first new sentence, second new sentence
Judge threw out a lawsuit against starbucks said the plaintiff had no grounds., grounds, Referring to the land or property, The farmer has rights to the grounds surrounding his house., The suspect had no grounds for his claim in court.
Why is it easy to arrange for private yoga classes with a teacher? they are flexible., flexible, Referring to physical adaptability, The company has flexible policies that allow employees to work from home.," The gymnast is exceptionally flexible, able to perform incredible feats of agility."
What is the hungriest mineral that exists? apatite, apatite, Referring to a mineral (a type of phosphate), The geologist studied the properties of apatite in the lab., The childs apatite made it difficult to share his snacks at school.
These examples both use the specified word in a serious context and show its dual meanings as per your requirements.,,,,
