sentence,word,explanation,first_new_sentence,second_new_sentence
1. ,,,,
Why was the floppy disk self-conscious? because it was fat., fat," In one context, fat describes having a large amount of body mass.", The elephant has a fat trunk that stores food., The storys plot was fat with twists and turns that engaged the reader.
2. ,,,,
What do you call a corvette following a camaro at high speeds? chevy chase., chase," In one context, chase refers to pursuing someone or something.", The police were in a high-speed chase after the fleeing suspect., She decided to chase her dreams of becoming a singer.
"If you need further analysis or more entries, let me know!",,,,
