sentence,word,explanation,first_new_sentence,second_new_sentence
"Went to type in build a bear and accidentally googled build a bar. better idea, i know", bar, 1. A bar is a place where people can order drinks and socialize. 2. A bar is a long rod or block of material," in law, it can refer to a barrier preventing access to the court.", 
I was recently diagnosed with color-blindness. it came out of the green., green," 1. The color green is often associated with nature and growth. 2. In reference to a traffic signal, green means go or that it is safe to proceed.", ,
What driver doesnt have a license? a screw driver., driver, 1. A driver is a person who operates a vehicle. 2. A driver can also refer to a tool used to drive screws into materials., ,
What did one amorous flea say to the other? i love you aw-flea., flea," 1. A flea is a small, wingless insect that feeds on the blood of mammals and birds. 2. Flea can refer to a market where second-hand goods are sold, often known as a flea market.", ,
"These selected jokes demonstrate the required characteristics, and each word has been placed into serious sentences that highlight its different meanings.",,,,
