sentence,word,explanation,first_new_sentence,second_new_sentence
sentence, word, explanation, first new sentence, second new sentence
Did you hear about that glacier off the coast of Italy? It was a romaine iceberg, iceberg, A large floating mass of ice, The iceberg broke off from the glacier and drifted into the ocean. , The scientist studied the iceberg to understand climate change.
What do you call a cow that just had a baby? de-calf-inated, cal- (from calf), The process of sucking air out of something, The barista de-calf-inated my coffee so I could sleep at night. , The scientist examined the de-calf-inated cow to ensure it was healthy after giving birth.
Where does Moses get his coffee? Hebrews it, Hebrew, The ancient Semitic language, The Hebrew Bible contains many historical texts. , Many people study Hebrew to understand ancient texts better.
"Each word selected is a single word that maintains the same spelling but has two different meanings in the context of the jokes provided, and the serious sentences illustrate both meanings of the chosen words.",,,,
