sentence,word,explanation,first_new_sentence,second_new_sentence
What do you call a line of black people? a chocolate bar, line, a row of people standing together in a straight formation, a sweet treat made from cocoa beans that is typically brown, 
What do you call a terrorist holding an ak47 to your head? sir., sir, a formal title used to address a man, an expression of respect or authority towards someone, 
Why are manhole covers round? because manholes are round., round, having a circular shape, to cycle through a process or a recurring situation, 
Which chord do pedophiles like the most? a minor, minor, a scale degree in music, involving a person who is below the legal age of consent, 
"Each entry is formatted according to your requirements, capturing the two meanings of the specified word for use in serious sentences.",,,,
