sentence,word,explanation,first_new_sentence,second_new_sentence
"1. **Joke**: “Why dont you mess with one-ply toilet paper? it doesnt take shit from anyone.” (Note: this joke plays on the word bark in a misinterpreted context, however, it does not meet the matching definitions, hence not included in this list.)",,,,
Here’s the information about each selected joke in the specified CSV format:,,,,
sentence, word, explanation, first new sentence, second new sentence
Whats the difference between a fraternity and a gang? gangs dont have to pay for friends., pay, One meaning refers to giving money for a service or good. The other meaning refers to admission to an event., I have to pay my rent today., He did not want to pay his friend for the tickets.
"If you would like to further analyze specific jokes or need more help, please let me know!",,,,
