sentence,word,explanation,first_new_sentence,second_new_sentence
sentence, word, explanation, first new sentence, second new sentence
Why did the sperm cross the road? because I put on the wrong sock this morning, sock, A sock is an item of clothing worn on the foot, I bought a new pair of socks for the winter, The sock was the focus of the joke. It is a playful reference to the sperm and its functions.
Why were the orphans thrown out of the restaurant? because it was a family restaurant, family, Family refers to a group of related individuals, My family celebrates holidays together every year," The family was the center of the joke, referring to the type of restaurant and the concept of families."
What do you call it when a jedi doesnt heat something up fully? luke warm, warm, Warm describes a moderate temperature," The weather is warm today, perfect for a picnic", The warm temperature was the punchline of the joke referring to the under-heating process.
Feel free to request any further modifications or additions!,,,,
