sentence,word,explanation,first_new_sentence,second_new_sentence
sentence, word, explanation, first new sentence, second new sentence
Why did the mortgage broker go out of business? ...because he lost interest., interest, Interest can refer to a financial gain or benefit and also to a mental engagement or concern about something., The bank offers a high interest rate on savings accounts.,Her interest in environmental issues grew as she learned more about climate change.
What do you call five black cars that all crash into each other? a three car pile-up., car, Car refers to a vehicle and colloquially can refer to a physical person (used in a joking manner)., I drove my car to work today.,The car at the party was the life of the event.
What does the average drummer get on an iq test? drool., drool, Drool can mean saliva that flows from the mouth and can also refer to someone being excessively droopy/infatuated, The dog started to drool when it saw the treat.,He couldnt help but drool over the beautiful painting in the gallery.
This output captures jokes based on words with two meanings and provides serious sentences for each meaning.,,,,
