sentence,word,explanation,first_new_sentence,second_new_sentence
What can a chicken do that you cannot? eat with his pecker., pecker, A slang term for the male genitalia and also refers to the beak of a bird., A woodpecker uses its beak to tap on tree bark., The chickens pecker is used for eating food.
Whats a pedophiles favorite type of shoe? white vans., vans, A type of vehicle and a brand of shoes., The delivery vans are parked at the depot., The child wore her new white Vans to school.
One direction splitting up? my daughter just announced to me she is in d-niall., d-niall, A pun on denial (refusing to accept) and a fictional name.," In d-nial, one refuses to accept the consequences of their actions.", I was in d-nial about the reality of the situation.
"I couldnt sleep because my fan was making loud noises. yeah, its a huge metal fan!", fan," An electrical device used for cooling, and a person who has a strong interest in something.", The sports fan cheered loudly at the game., The fan circulated the cool air throughout the room.
"Each joke features a word that fulfills your specified characteristics, along with serious interpretations of its meanings in proper sentences.",,,,
