sentence,word,explanation,first_new_sentence,second_new_sentence
I lost both of my arms today... its ok though. ive learned to embrace it, embrace, to hug or hold someone closely, I find it difficult to embrace new ideas. , We need to embrace our challenges to grow as a community.
"These egyptian fireworks are nice. oh wait, they are planes.", planes, flat surfaces used for flying, The carpenter carefully measured the planes of the wooden boards. , The artist painted a beautiful landscape of planes and hills.
Did you hear about the lunatic who tried swimming in the river in paris? he was in seine, seine, a fishing net, The fisherman cast his seine into the river to catch fish. , The river Seine is known for its picturesque views in Paris.
What did the melun king say to the two young melons in love? they cant-elope., elope, to run away secretly in order to get married, They decided to elope to the beach for a private ceremony. , The couples decision to elope surprised their families.
Let me know if you need further modifications or additional assistance!,,,,
