sentence,word,explanation,first_new_sentence,second_new_sentence
sentence, word, explanation, first new sentence, second new sentence
What will kayne wests political leaning be if he runs for president? west wing, wing, (1) A wing is part of a birds anatomy that allows it to fly. (2) The west wing refers to the section of the White House that houses the presidents office and staff.,,
What do you call two canadians buy coffee? double double doubles, double, (1) A double can refer to two of something. (2) A double can refer to having a double shot of espresso in coffee.,,
What do you call a gathering of arthurs knights? a sir conference, sir, (1) Sir is a title used as a form of respectful address to a man. (2) Sir can refer to a title given to a knight or baronet.,,
What do you call a gender reassigned person who has a baby? transparent, transparent, (1) Transparent means something that can be seen through. (2) Transparent can refer to someone being open about their gender identity and experiences.,,
