sentence,word,explanation,first_new_sentence,second_new_sentence
Just went to an emotional wedding. even the cake was in tiers., tiers, The word tiers refers to levels or layers in a structure., The wedding cake had three distinct tiers., The students were assigned to different tiers based on their academic performance.
What do you call a hard rock fan going through gender reassignment surgery? a transition metal., metal, The word metal refers to a type of chemical element known for its conductivity., The metal used in the construction of the bridge is very strong., She loves the sound of metal music and often attends concerts.
What do you call colorful secret police? the rgb., rgb," The acronym RGB stands for red, green, and blue colors used in digital displays.", The RGB color model is fundamental in computer graphics., The sunset displayed a beautiful RGB spectrum.
What happens when your friend from prague topples over? you right a czech., czech, The word Czech refers to a nationality or something related to the Czech Republic., She is planning a trip to the Czech Republic next summer., He received a cheque as payment for his services rendered.
Why did the donut go to the dentist? to get a filling!, filling, The word filling refers to the material used to fill cavities in teeth., The dentist applied a filling to repair the chipped tooth., She baked a donut with a raspberry filling for dessert.
