sentence,word,explanation,first_new_sentence,second_new_sentence
What do you call a queer redneck? a confederate fag., fag, A fag is a derogatory term for a homosexual person. The term also refers to a cigarette in British slang., He lit a fag before entering the bar., The protestors carried a banner depicting a fag in support of LGBTQ+ rights.
Whats the worst thing you can say to a jewish bread delivery man? whats the challah cost?, challah, Challah is a type of Jewish bread typically eaten during the Sabbath. The term challah also can refer to the amount of money or the cost in informal contexts., The challah was fresh and warm when it arrived., I asked him how much the challah would be for the event.
What do you call someone who only speaks one language? american., american, An American is a citizen or national of the United States. It also describes someone who predominantly speaks English and may not have knowledge of other languages., She is a proud American who participates in all local events., His view reflects that of many Americans about the importance of multilingualism.
What do you call it when someone steals someone elses coffee? a mugging., mug," A mug refers to a large cup used for drinks, especially coffee. In criminal contexts, mugging refers to an attack to steal from someone.", He drank his coffee from a favorite mug every morning., The victim reported the mugging to the police as he walked home.
What do cows get when they do all their chores? mooney., mooney," Mooney refers to the condition of being emotional, dreamy, or whimsical. It can also denote a playful term for money.", She had a mooney look on her face as she daydreamed., They were mooney when discussing their plans for a vacation.
