sentence,word,explanation,first_new_sentence,second_new_sentence
sentence, word, explanation, first new sentence, second new sentence
What do you call a fast ghost? spooky gonzales, fast, The car is very fast on the highway., He had a fast inclination towards solving puzzles.,
What do you call a nun with a drinking problem? a bad habit, habit, My daily habit includes exercising in the morning., Many animals have a habit of migrating during the winter.,
What do you call the system of honour of french horses? chevalry, chevalry, The chevalry of the ancient times was known for its knights., The term chevalry refers to the qualities associated with the ideal knight.,
"What happens when you throw a laptop into the ocean? you have a dell, rolling in the deep.", dell, The computer on my desk is a Dell., He was happy as he had sold his Dell.,
