sentence,word,explanation,first_new_sentence,second_new_sentence
1. Whats dean martins favorite eel? thats a moray.,,,,
   , moray ," In this context, moray refers to a type of eel.", The moray eel is known for its elongated body and can be found in tropical waters. , The scientists studied the behavior of the moray as it hunted in the reef.
2. Whats the difference between your mom and my mom? your mom still sucks my dads dick.,,,,
   , suck ," In this context, suck means to draw into the mouth by creating a vacuum.", He had to suck the air out of the bag to seal it properly. , The child learned how to suck his thumb as a means of comfort.
"3. A sheep, a drum, and a snake fall off a cliff baa-dumm-tsss.",,,,
   , baa ," In this context, baa refers to the sound a sheep makes.", The farmer watched the sheep as they began to baa for food. , The childrens book featured a cute baa from the sheep as it jumped over the fence.
4. What do you call a woman on her period? a bloody cunt.,,,,
   , bloody ," In this context, bloody refers to something covered in blood.", The butcher showed us how to properly handle and hang a bloody carcass. , The bloody knife indicated that the chef had been preparing meat.
5. Why are blacks so fit? from running away from fatherhood.,,,,
   , fit ," In this context, fit refers to being physically in good shape.", She exercises regularly to stay fit and healthy. , The new program is designed to help people fit into their old clothes again.
"Note: The jokes provided carry different connotations and sensitivities, so please approach them with awareness of their implications and potential to offend.",,,,
