sentence,word,explanation,first_new_sentence,second_new_sentence
sentence, word, explanation, first new sentence, second new sentence
Why did the egyptian spit out his water? because it came from the suez. , suez, A waterway in Egypt that serves as a passage for ships (first meaning) and can also colloquially refer to sue someone or something (second meaning), The Suez Canal is crucial for international maritime trade. , She decided to sue her former employer for wrongful termination.
Why was diarrhoea classified under hereditary diseases? it runs in the jeans. , runs, To operate or function (first meaning) and to move quickly (second meaning), The machine runs efficiently when properly maintained. , He runs every morning to keep fit.
What do you call a surprise party in india? arranged marriage p.s. im an indian living in india. , arranged, To organize or plan in advance (first meaning) and the often traditional setting of a marriage (second meaning), They arranged for the guests to arrive at 6 PM. , Their arranged marriage was celebrated by both families.
"Please note that while I tried to fit the requirements, it appears that the context of certain jokes may not perfectly adhere to the strict definitions you’ve asked for. If you need further refinement or additional examples, feel free to ask!",,,,
