sentence,word,explanation,first_new_sentence,second_new_sentence
they always get cold feet!,cold,"In the winter, the air can get very cold, making it uncomfortable to be outside without proper clothing.","After the argument, he felt a cold chill between them that made it hard to continue their conversation.",
what do you call a dinosaur with an extensive vocabulary? a thesaurus.,thesaurus,A thesaurus is a reference book that lists words in groups of synonyms and related concepts.,"The ancient thesaurus was nearly the size of a small encyclopedia, full of complex terms.",
you have my word., word,A word is a single distinct meaningful element of speech or writing.,"He made a solemn vow in his speech, promising to keep his word about the project timeline.","In the courtroom, the witness took the stand, swearing to tell the truth with every word."
the stakes are always just too high,stakes,"In gambling, the stakes are the potential loss or gain involved in the wager.",The stakes of the game were raised when the prize money was doubled.,"In a personal relationship, the stakes can increase when one partner proposes moving in together."
"Each entry includes a joke that features a word with dual meanings, the filtered word, an explanation of its meanings, and two serious sentences using that word in both contexts.",,,,
