sentence,word,explanation,first_new_sentence,second_new_sentence
"My butcher introduced me to his wife the other day... he brought her out and said, meet patty", patty," A patty refers to a type of food, usually a round flat cake of minced meat, while it is also a common name", I ordered a cheeseburger with a beef patty. ," My friend’s name is Patty, and she is very nice."
What lies at the bottom of the ocean and twitches? a: a nervous wreck., wreck," A wreck can refer to the remains of a destroyed ship or vehicle, while it can also describe a persons state of extreme emotional distress", The shipwreck was discovered at the bottom of the sea. ," After losing the job, he was a wreck for weeks."
Why didnt abraham lincoln go to jail? because he was in-a-cent!, in-a-cent," The word can mean free of guilt (innocent), and also refers to a monetary coin (cent)", The defendant was found innocent in court. , I found a shiny new cent on the ground.
A couple of cats and dogs were seen wearing crowns. i think theyre reigning cats and dogs., reigning," To reign means to hold royal office or rule, and it also can mean to dominate or control", The king has been reigning for over a decade. , The athlete is reigning champion of the tournament.
"This output provides each joke that meets your criteria, the related word, an explanation of the two meanings, and the two new serious sentences for each respective meaning.",,,,
