text,humor
Only 90s kids will get this: slavery. (1790s),True
What did the italian man with dementia have for dinner? forgetti bolognese.,True
A conference call is the best way for a dozen people to say bye 300 times.,True
What did the agnostic dyslexic insomniac do? he stayed up all night wondering if there was a dog.,True
I fell bottom-first on to a window today. it was a pane in the arse.,True
What did sushi a say to sushi b wasa b!,True
Beauty is only skin deep... but it sure looks good on the ladies.,True
"I was horrible in school... i failed math so many times, i can't even count",True
I invented a sport called mexican football you take a mexican and kick him over a wall.,True
The food in our school canteen is perfect. if your a bug!,True
Some doctors see private clients other doctors see their client's privates.,True
What happens when you give a cow a joint? the steaks are high,True
What bounces and makes kids cry? my child support checks.,True
Eighty-seven percent of people think lasers are friggin' awesome. - pew pew pew research center,True
"Want to read a joke about pizza? never-mind, it's too cheesy!",True
When a clock is hungry... it goes back four seconds.,True
Peter pan and the lost boys are actually the souls of aborted kids that explains captain hook,True
Why can't leopards hide? because they are always spotted!,True
Wanted to know what the did in the pentagon... so i built a hexagon *they,True
"Thanks to home security commercials, i am now terrified of middle aged white men.",True
Where is the best place to hide a lawyer? in a brief case.,True
How many software engineers does it take to change a light bulb? none. it's a hardware problem.,True
"If someone hits you with a coffee mug, have you technically been mugged?",True
Co-worker: why did you hit me with your chair?! me: because my desk is too heavy.,True
What did the spider say to the bee ? your honey or your life !,True
What's it called when you jizz on a spanish woman's face? nutella.,True
Household chores how do you turn a dishwasher into a lawnmower? send the bitch outside.,True
Q: what is your least favorite force of nature? a: gravity. it's always bringing me down.,True
What do you call a black guy that flies a plane? pilot,True
My penis was in the guinness book of world records. until the library kicked me out....,True
Even that crack on the wall becomes more interesting when you're meant to be studying.,True
"Better out than in, my dad always used to say. lovely man. terrible heart surgeon.",True
Why can't you trust atoms? because they make up everything!,True
Why did the computer programmer put his brownies back in the oven? they were too gui.,True
What do native americans call vegetarians? poor hunters,True
Bill gates is so rich... he hired cancer to kill steve jobs.,True
"According to webmd, this hairy thing on my chest is a cat",True
Someone tried to sell me a coffin today... i told them its the last thing i need.,True
A man walks into a bar... another man ducks.,True
What did the snake say when another asked him the time ? don't asp me !,True
A skeleton walks into a bar orders a beer and a mop.,True
Do you like cats? me too. but i can never finish one by myself,True
Did you hear about the new bolt the apple company made? the eye bolt,True
Why is the mushroom so happy ? because he's a fun-guy :p,True
"A tree falls in the forest and kills a baby, whos fault is it? the lumberjack",True
What do you call someone that delivers baby horses? an equinecologist.,True
Social media for drug dealers it's called instagram,True
The candidates keep appealing to hard working americans... but what about the reddit community?,True
100% of people who eat in the dining area of the grocery store are murderers.,True
What's brown and rhymes with 'snoop?' dr. dre,True
Q: what did the fish say when it hit the wall? a: dam.,True
How many points do i get if i hit a pokemon player with my car?,True
Knock knock who's there ! carson ! carson who ? carconogenic !,True
What did the religious pear say to the grape that lost his wife? everything happens for a raisin,True
Remember your elementary gym coach? i should've worked out more for his girlfriend,True
"What do you call a dinosaur with a big mouth, big ass and tiny hands? t-rump",True
"What do you call the german version of harry potter? heinrich potter, and the chamber of gas.",True
What do you call the people that always are around musicians? bass players.,True
Me and julio at least 500 feet away from the schoolyard,True
Budweiser is a lot like sex on the beach; it's fucking close to water.,True
"Its poor! but, what happens when supper stars fart in public? lol",True
Yo mama so stupid she stole free bread.,True
How do american chickens cross the road? in a bucket.,True
"If love is the answer, could you rephrase the question?",True
Google just alerted me to light traffic in my area which is odd because i'm in the bathtub.,True
What does my physics professor have in common with gandalf? you shall not pass!!!,True
I scream. you scream. we all scream. isis laughs.,True
Mexican carpet layer. what does a mexican put under his carpet? underlay! underlay!,True
Have you seen the new french flag? it's a white cross on top of a white background.,True
Why does donald trump want classical music at his inauguration? he wants to grab them by debussy.,True
What did one lawyer say to another lawyer? we are both lawyers.,True
What were acdc called when they were kids? abcd,True
"Oh my god, that's so offensive!- someone, about everything.",True
"Knock knock knock, knock. who's there? horton. horton, who? horton hears a who.",True
Why do native americans hate snow? because it's white and settles on their land,True
What did the impatient waiter ask the gluttonous aardvark? is that your final ant sir!,True
What is a blind persons favourite song? hello darkness my old friend,True
Saw a chameleon today so it's safe to say it was a pretty shit chameleon,True
Werewolves are notoriously hard to find... otherwise they'd be known as therewolves.,True
What is a parrot's favorite game ? hide and speak !,True
Yo mama so fat... ...she had an heart attack while running an app.,True
A new girlfriend asked me how did you manage to stay single for so long? single handedly,True
What animal is faster than a cheetah? a cow dropped out of a helicopter.,True
What do you call a blind person who can't find his/her glasses? eyeronic.,True
What do you call it when an employee poops in the food at a chinese restaurant? shitty wok,True
I bet that at some point in history a baby ate a dingo.,True
Usda approves shipment of marijuana-fed cows' beef analytical studies show that the steaks are high,True
How many straight vassar men does it take to screw in a lightbulb? both of them.,True
"You had me at- well, you're breathing and female. that's about the point you had me.",True
Break ups are the worst in china... you see her face everywhere.,True
What do you call a girl who pushed her father off a cliff? pushpa!!,True
There's a joke in this thread. it's you.,True
High cholesterol food will always have a special place in my heart.,True
"Wife, i am truly truly upset... i must take this out on your vagina.",True
"How come the government can keep printing money but when i do it, it's a crime?",True
"According to the bible, what's noah's favorite fruit? pears.",True
"Life is like a penis simple, soft, straight, relaxed, and hanging freely. then women make it hard.",True
What was bob the builder called after he retired? bob.,True
What would it take to reunite the beatles? 2 more bullets.,True
"I killed a man once, because killing him twice is a physical impossibility.",True
