text,humor
Crayons are a lot like m&m's. all of the colors taste the same.,True
"Whats hard, black, and keeps me up all night? my roku.",True
What's the difference between black people and cancer? cancer got jobs,True
Mexicans cats are attacking my home! looks like a gato raid,True
Looks like brenda in accounting drew on her angry eyebrows today...,True
What did the bumble bee striker say ? hive scored !,True
I'm old enough to remember when it was rude and weird not to leave a message.,True
(oc dad joke) what do you call a goat on a small mountain? a hillbilly,True
How do you make a gay guy fuck a woman? shit in her cunt.,True
Q: where do mentally unstable trees go? a: the insane a-xylem.,True
What's harder than nailing 10 dead babies to a tree? nailing one dead baby to 10 trees.,True
I'm really good in bed. when you compare it to how fucking awful i am out of it.,True
A pregnant woman came in looking for a girly stroller so i kicker her in the stomach.,True
Could you take a couple steps back. i have a nut allergy.,True
What do you call two mexican men playing basketball? juan on juan.,True
"I saw a guy with antlers on his car, so i shot it.",True
Why did daniel larusso suffer from sexual frustration? he wouldn't whacks off,True
"The other day, a clown held the door open for me. it was a nice jester.",True
I have the quran on cd... people sure are getting upset when i said i burned it.,True
My neighbour hit the post reversing out of the driveway. he hit the poor man delivering it too.,True
"Am i capable of premeditated murder? your honor, i've been planning my cheat day for two weeks.",True
A dyslexic man walks into a bar and yells hands up mother fuckers! this is a stick up!,True
Why did the chicken crossed the road? to piss off drivers,True
What's the difference in roast beef and pea soup? anyone can roast beef.,True
Why is there no such thing as a great golfer? the best ones are consistently sub-par.,True
What is the biggest compliment you can pay at a gay bar? pushing in somebody's stool.,True
Some women are born to make history.... i prefer the ones who get deleted from mine.,True
I wonder if my first cat appreciates being at least slightly immortalized in my passwords.,True
Knock knock shoes there. must be the invisible man.,True
Q: what did one strawberry say to the other? a:look at the jam you've gotten us into!,True
"Hey baby, you must be from ireland because when i look at you, my penis is dublin",True
What do you call a crate of ducks ? a box of quackers !,True
A pregnant teen and her baby is thinking the same thing... my mom is gonna kill me.,True
Keep microwaving fish in the office and stop wondering why you never get a desk by the windows.,True
Why can't you tell jokes to a nympho? because they'll take them too hard.,True
What does a suicidal teenager do on the weekends? hang at home.,True
What's the worst part of fucking twenty-seven year olds? there's twenty of them.,True
My friend david had his id stolen. i just call him dav.,True
Had an ant farm once. them fuckers didn't grow shit.,True
What is the proudest body part? the veins,True
"Bacon and eggs walk into a bar the bartender says get out, we don't serve breakfast here",True
Where does the army keep fish? in a tank.,True
What are a psychoanalysts first words to a suicide bomber? what makes you tick?,True
What do trees do in autumn? take a leaf of absence.,True
So the presidential debate is tonight. even vegans can't stay away from this pig roast.,True
Which side of the chicken has more feathers? the outside,True
So this guy with a premature ejaculation problem ... comes out of nowhere!,True
My mom thought my laptop on the floor was a scale. my mom weighs 800 dollars,True
"My hobbies include working out, staying fit, eating healthy, and lying.",True
You know what they say about big feet... big socks.,True
I exclusively use internet explorer to download google chrome.,True
My ex-wife still misses me. but her aim is getting better!,True
What do you call a fat relative around halloween? a plump-kin,True
I once won an argument with a woman...in this dream i had.,True
What's the definition of a parapet? pet parrot kept by parachutist!,True
How is donald trump going to get rid of the mexicans if elected? pesticide,True
"If she shovels shit at the local zoo, then she's a keeper",True
What's the difference between snowmen and snowomen? snowballs,True
Heard a good joke about hillary clinton's email scandal top secret,True
Did you hear about the guy who invented knock-knock jokes? he won the nobel prize,True
Why is santa's sack so big? he only comes once a year.,True
I wanted to make a chemistry joke... but i'm too basic.,True
In lieu of a gift i liked a couple of charities on fb in your honour,True
What's the difference between reddit and the 1984 universe? you can leave reddit.,True
Why did tiger woods bring three socks instead of two? in case he got a hole in one.,True
"When in canada, what is bruce lee's favorite vegetable? carrot-eh",True
How to get a jewish girl's number? roll up her sleeve...,True
How come when someone says we need to talk it's never about ice cream or star wars?,True
What did the buffalo say to his son when leaving for college? bison,True
Today i found out what it was like to play a fps first person shoveler. gg blizzard.,True
Why didn't thor like the party? it was too loki.,True
What do you put on big rusty boobs? double d 40,True
How does moses make tea? he brews it.,True
Did you hear about the two guys who stole a calendar? they each got six months.,True
"You know that's not even a word, right? i said, condescendingatively",True
Why was the magnet seeing the psychiatrist? because it was bipolar.,True
Why did the elephant bring toilet paper to the party? he's a party pooper!,True
Where do south africans buy their pastrami and salami? at the nelson mandeli.,True
Ms. pac man is the biggest hoe in history for 25 cents she swallows until she fucking dies.,True
Wtf is almond milk almonds ain't even got titties,True
Why was noah a great businessman? he floated his stock while everyone else was in liquidation.,True
Why did the film critic protest the new children's cemetery? he's not a fan of juvenile plots.,True
If we get to have sex with our valentines on valentine's day i can't wait until presidents' day.,True
Hmmm... jack nicholson. he's that guy from the laker's games right?,True
Why can't muslims eat pigs? because the quran forbids cannibalism,True
I went to an aa meeting i met a lot of batteries,True
What do you call a bear with no teeth? a gummy bear!,True
What do you call two black men on a videotape? evidence.,True
How do you call a male prostitute? a prostidude!,True
"I think sarah jessica parker quit the church when the minister giggled & said, let us bray.",True
Why are some flowers gangsta ? cause they carry pistils.,True
What did the spice merchant say when someone knocked on his door? cumin!,True
What do you call a sheep covered in chocolate? a chocolate baa,True
"There are four states of matter: solid, liquid, gas, and black lives.",True
Q: why did the jews wander in the desert for forty years? a: somebody dropped a shekel.,True
My mother was feeling cold so now i'm wearing a sweater.,True
My friend entred me in a double-entendre competition that's it.,True
You know why fencers subscribe to /r/jokes? because they always appreciate a riposte.,True
Why couldn't the lifeguard save the drowning hippie?  because he was too far out man!,True
What did mc hammer say to his wife when she caught him cheating? can't trust this,True
