text,humor
Everyone on reddit seems to want a secular turkey... my fat ass just wants a succulent one.,True
"According to steve jobs, what type is the pokemon scizor? feature/borrow",True
How do you spell your name? her: me: her: k-i-m me:,True
I feel like a lot of single women have been naming their cats adele this year.,True
Why didnt the pedicurist accept black customers she was blacktoes intolerant...,True
Apparently watching your lover sleep is only romantic when they know who you are.,True
Where do poor meatballs live? in the spaghetto.,True
Why does it take *two* premenstrual women to change a light bulb? #because!!,True
Q. what does chaos stand for? a. the chiefs have arrived on scene.,True
A kiss makes my day. anal makes my whole week.,True
What do you call a greek arsonist? a,True
My friend might be hung tomorrow... the suspense is killing him.,True
Did you hear about the old chameleon that couldn't change color? he had *a reptile dysfunction*.,True
"So a banana gets a job, how much does he make? not that much he's working for scale.",True
Why is it called a funny bone? because its humerus!,True
When stoves die... they go to hoven. i'm^so^sorry,True
"Chuck norris doesn't breathe, he holds air hostage",True
Why is dog man's best friend? they keep the mailman away from his wife,True
"You don't control me, god! you hear me? i don't care what you named me!",True
How many sycophants does it take to screw in a lightbulb? how many do you want?,True
People with a sense of humor are so much easier to talk to.,True
Next time you get in a fight with your girl.. go tighten all the lids on the jars.,True
What do you call a retard who is super high? a baked potato lol xd,True
Two silkworms had a race it was a tie,True
Why hasn't there been a coup in the united states? because they don't have a us embassy.,True
You don't realize just how eco-friendly clowns are until you think about how much they carpool.,True
"My girlfriends dad asked me what i do apparently, your daughter wasnt the right answer",True
Humpty dumpty had a good summer... but he had a *great* fall!,True
What do u call a nun in a wheel chair virgin mobile. xd,True
If you watch cinderella backwards its about a girl who finds her place in society.,True
This joke up me crack everytime i hear it will tell you after next bowel movement.,True
Why isn't my hand 12 inches? because then it would be a foot,True
"Roses are red-ish... violets are blue-ish. if it wasn't for jesus, we'd all be jewish.",True
I forgot how to throw a boomerang and then it came back to me,True
What do you call a speech so scary it makes you crap your pants? a dire rhetoric.,True
I think i want a job cleaning mirrors it's just something i can see myself doing.,True
You know you're an alcoholic when you can't even say the word sober without making air quotes,True
Thinking of getting another bed just for all my laundry,True
You know who loves to get fisted? sock puppets... -credit to daniel tosh,True
Do you have a little irish in you? well... would you like some?,True
By shear coincidence... ...all these sheep look the same...,True
If i could rearrange the alphabet i would put u & i and your hot friend amber together.,True
"What's pink, bubbling and tapping on glass? a baby in a microwave.",True
I'm scared of trampolines they make me jump!,True
What has 40 teeth and holds a monster at bay? my zipper.,True
What do you call a cow with no sense of humor? moody.,True
Web md should go ahead and sell caskets.,True
Did you hear about the epileptic snake? it had a hissy fit.,True
Why don't cannibals like to eat carl lewis? he gives them runs!,True
How do you make a cat go woof! pour lighter fluid on it and set it ablaze... woooof!,True
What's the difference between a politician and a bucket of shit? the bucket.,True
"You can't have everything, where would you put it?",True
What adjective do you use to describe a bad pun? pungent,True
Why does jesus suck at call of duty? because it takes him 3 days to respawn.,True
I like my women like i like my whiskey... ....15 years old and mixed up with coke.,True
Too poor for whole foods too ugly for walmart,True
What do you call the slimy stuff between dinosaurs' toes? slow cavemen.,True
I cut so much rug... ...that i had to open a plpd policy on my feet.,True
Who's the world most famous blacksmith? will smith,True
Where do you take a sick boat? to the dock!,True
"Remember folks, beauty... is only a light switch away.",True
What is donald trump's least favorite candy? jelly beaners,True
Who was the most well known jewish cook? hitler!,True
Never trust an atom they make up stuff.,True
"'no no no no no no' - my brain, every time words start coming out of my mouth.",True
What do you call a handjob from a midget? a jump and touch.,True
Live this friday like it was your last.  the mayans,True
"If i pour superglue into a non-stick frying pan, somebody is going to be wrong, right?",True
Steven tyler is aging pretty gracefully for a claymation skeleton who fell into a pile of feathers.,True
Breaking news: the irish have come up with a new use for sheep. wool.,True
Who the hell called it 69ing... instead of cuddlingus.,True
Was hit by a rental car earlier today. it still hertz.,True
Ok but how old is your child in minutes?,True
What happens when you drop a decimal point in water ? it floats.,True
I bought some new london bridge jeans they keep falling down.,True
"What happens when the past, present, and future walk in to a bar? it becomes very tense.",True
So how about the bbc sacking jeremy clarkson ? i think the whole thing is a huge miss-steak.,True
What did onlookers say to the wright brothers as they took off? bye plane,True
I bet you haven't heard this one before 53154,True
I like my coffee how i like my slaves. whipped,True
I'm gonna try and shoot the whole school said the yearbook photographer,True
"My name is joseph king. nah, just joeking.",True
If you hate crime... is that a hate crime?,True
What's the worst thing you can do to a blind man? leave the plunger in the toilet,True
Why were the witch and wizard always kissing each other's necks? because they were neckromancers,True
"Why can't australians play chess? they keep saying check, mate.",True
"Bro. it's not ladies man, it's ladies' man. chicks dig a dude who can navigate a plural possessive.",True
I always hang on the rim after i dunk because it's really high up and i'm scared.,True
I quit my job so i had time to file my income tax that's the joke,True
Plane delayed... as mrs. plane finishes getting ready. (courtesy of american dad),True
I like my women how i like my wine 12 years old and locked in the cellar,True
I dropped my phone in the toilet it's ringing wet!,True
What did the busy tailor say to the scarecrow who needed some mending? i can't find the twine.,True
Did you hear about the bread-less klansman who couldn't drink milk? he lacked toast and tolerance.,True
What do you call a five year old with no friends? a sandy hook survivor,True
Is it possible to be bored to death? that all depends on the drill.,True
I kept reading a book about gawker... but every page kept going back to chapter 11,True
Where do internet pirates get their loot? from pier to pier.,True
What does mexican binary code consist of? zeros and juans.,True
I committed suicide today never gonna do that shit again nearly got myself killed,True
