text,humor
"Oh, look! she's drinking vodka, let's kill her! - spiral staircases",True
Your momma is so fat that her measurements are 26-34-28 and her other arm is just as big!,True
What do a plate of homemade brownies and a golden shower have in common? urine for a treat.,True
Q: what word begins with the letter f and ends in uck? a: firetruck.,True
Somebody parked in my spot and now i'm in the market for a rocket launcher.,True
What's the definition of a great farmer? he's outstanding in his field.,True
What type of rock is this holmes? it's sedimentary my dear watson!,True
I wish my lawn was emo so it would cut itself.,True
Do you know that awesome feeling after understating math? me neither,True
Why couldn't spongebob get a mortgage? because his house was underwater.,True
Chris rea came to my garden centre today... ...he bought a driving gnome for christmas.,True
"If a man with no arms has a gun, is he armed?",True
I'm not a racist but. . . i fucking hate marathons.,True
"A guy walks into a bar... and says, ow.",True
What do fish do when they have cancer? nemotherapy,True
(q)..... what do you call a brunette standing between two blondes? (a)..... the interpreter.,True
Adele: hello from the other siiiiiide me (shouting): tell us your surname,True
Who makes a drinking sound like this *makes drinking sound*? george grashington!,True
I don't need a girlfriend to get action... the pokemon servers go down on me all the time.,True
What is the key to picking up girls who are musicians? get a flat and be sharp,True
Coworker: you smell good. what is that? armani? me: thanks! it's febreze. i just took a dump.,True
I just bought a sewing machine i needed to get my sheet together,True
They should sell flags for fake countries so people can burn them without offending anyone.,True
What makes for a good first date? not movies,True
Argon walks into a bar the bartender says we don't serve your kind here. argon doesn't react.,True
What do you call a dumb bunny? a hare brain.,True
What did the redditor say to the other redditor? yes.,True
I'll stop at nothing... ...to avoid using negative numbers.,True
I think i'm done clapping for stuff. it's enough already.,True
I think rachel dolezal is misunderstood. . . it turns out she's bi-rachel.,True
"The best curve on a woman is her smile  ...hahahaha lmao! no i'm kidding, it's her boobs.",True
Where does an 800 pound gorilla sleep? with the fishes.,True
This joke is brought to you by arnold schwarzeneggers one-sided chess set. i'll be black,True
What game is in schrodinger's xbox? dead or alive,True
I'm so patriotic i ejaculate red white and blue minus the blue part. i should see a doctor.,True
I had a huge erection. i started running and hit a wall. you know what broke? my nose.,True
"I'm fat, so when i get mad, i get massive aggressive.",True
Missionary impossible: when 2 fat people try to have sex.,True
What do you call a white guy in an abusive relationship? whipped cream.,True
From my 7-year-old: what type of phone does a hawk use? a hawkie talkie.,True
Ladies: stop looking for a man to sweep you off your feet.....sweeping is your job.,True
Why did the monster put the cake in the freezer? because he had been told to ice it.,True
A new chef from india was fired a week after starting the job. he keep favoring curry.,True
"You know what grinds a germans gear? nothing, they are too well engineered. edit: spelling",True
Why was oedipus against profanity because he kisses his mother with that mouth,True
We don't serve time machines a time machine walks into a bar,True
"I want to die peacefully in my sleep, like my dad. not screaming in terror, like his passengers.",True
My friend just landed a boob job the perks are great,True
Why does nobody talk to circles? because there is no point!,True
I think i might go gold mining today... aurum just gonna stay at home and relax.,True
I'm sick of pretending. i'm ready to tend!,True
I'm sorry to hear your uncle was run over by a boat in venice. my gondolences.,True
Which blood type does a bad speler have? typo,True
Used to have no life. now i have a laptop and facebook!,True
Knock knock... police.... police who? well i won't fall for that one again...,True
An escalator can never break  it can only become stairs.,True
What would you have if your car's  motor was in flames? a fire engine.,True
Wet astronaut the astronaut thought he was taking a pee but it turned out to be a piss-up.,True
How did the swordsman keep annoying r/jokes? constant ripostes.,True
Dry january is going really well. even if everyone keeps saying that i need to shower.,True
I take pictures of my weed because they say the camera adds 10 pounds.,True
How do you get a horse out of jail? hay bail.,True
I just found out my wife has an identical twin i saw her on tinder.,True
What do you call a sheep covered in chocolate? a candy baa,True
I was going to tell a gay joke but fuck it,True
"Donald trump wants to build a wall between usa and mexico... it's okay, we have tunnels.",True
Knock knock who's there ! alistair ! alistair who ? alistairs in this house are broken !,True
"Not right now green light, i'm taking a selfie.",True
Did you here about the scientist who got cooled to absolute zero? he's 0k now.,True
Why was the skeleton using the internet? to bone up on his schoolwork.,True
What's the difference between an enzyme and a hormone? you can't hear the enzyme,True
"Omg, you guys, there's a button on this stove that says stop time. should i press it??",True
The united kingdom. a country whose name is now ironic.,True
What do you call a mexican midget? a paragraph... he isn't a full essay,True
Having sex with a waitress sucks. she only takes the tip.,True
You don't have to be crazy to be my friend!........but it sure helps!,True
Dmx is in jail because x didn't give it to them.,True
Why is the ice planet in star wars called hoth...? ...shouldn't it be coldth?,True
"I'm a female historian who specializes in war atrocities, check out my blog the war atrocity babe",True
What body part is most sensitive to a man while he is masturbating? his ears.,True
What did the green grape say to the purple grape? omg!!!!!!! breathe!! breeeeeathe!!!!!,True
Happy alentine's ay! for people who won't get the d or v,True
What did the self-deprecating indian say about his car? it has injun problems.,True
My friend can only masturbate when he listens to really bad music. beats off.,True
What will they now call hormonally-induced knockers on men? broosts,True
It's not a matter of when the world will end... ...it's which applebee's you find out at.,True
*eats one piece of lettuce* *checks for abs*,True
Sometimes i call meteors hot space potatoes and everyone just keeps ignoring me,True
Do you know what the women are saying after an orgasm... apparently you don't know...,True
I think trump will be a great president just had to put my two pence in there,True
Why do buddhist monks have such sour faces? because they're acetic.,True
Why doesn't anyone in  use the toilet in the morning? so they have something to do at night.,True
Chuck norris has held the world championship in every weight class at the same time.,True
My brother had to give up tap dancing recently. he kept falling into the sink!,True
What has no life but a lot of spirit. (a ghost) you've been a terrific audiance!,True
It is always the wrong time of month.,True
My kids keep bugging me about dinner even after i told them i already ate...,True
2:40 is the opposite of 4:20 if you wake up at 2:40 you're in rehab and detoxing.,True
If a tree falls in the forest and kills a mime... ...would anybody care?,True
If horses could talk i reckon they'd mostly just say 'get off me'.,True
