text,humor
What happened when the pig ran into his ex? there was a porkward silence,True
"I'm done with this shit. he thought as he closed reddit, locked his phone and stood up.",True
My new wifi password: whatsawifi enter dwmc-esque dude/sweet scene.,True
Why didn't the cashier get the punchline? it didn't register.,True
"How does santa make new baby reindeer? in vitro, in prancer, in dancer, in vixen.",True
What did the pair of flip-flops say to the approaching man with disgusting feet? shoe.,True
Treat others the way you want to be treated *buys everyone snacks,True
"Jesus fed 5,000 people with two fishes and a loaf of bread. that's not a miracle. that's tapas.",True
French toast is just regular toast that smokes cigarettes and has a tiny mustache.,True
How much money did the bronco have? only a buck!,True
Whoever called it getting drunk and not grunk detting just didn't get it.,True
"Sex between 3 people is a threesome, 2 is a twosome... does that make me a handsome guy?",True
What's the difference between hitler and lance armstrong? lance armstrong can finish a race,True
I'll bet petr pan lives in nether netherland.,True
Anal with my girl friend made my whole day..  .. but it made her hole weak.,True
So i was drinking this vampire's blood the other day it was irony.,True
How many programmers does it take to change a lightbulb? none. it's a hardware problem.,True
Who took care of german army dogs after the war? veteran aryans,True
What did the bumble bee striker say? hive scored!,True
What do you call a little polish boat? a jetski.,True
I don't understand hair it's just over my head.,True
"I'm expended, i'm expensive, and i'm expanded. ... ijkwim.",True
What do you call a nice jewish lyft driver? an uber mensch.,True
You know what they say... 99% of lawyers give the rest a bad name,True
What's the best time to go to the dentist? tooth hurty!,True
"What's smarter than a dog, but dumber than a cat? their owner.",True
What do pothead barbarians say when 420 rolls around? 420 raze it!,True
I just lost my virginity to a retarded girl i wanted my first time to be special.,True
You're just not my cup of tea i say to someone else's cup of tea.,True
How do you get 4 gay guys to sit on 1 bar stool? flip it upside down.,True
What did the depressed pimp want for his birthday? to be alone with his thots,True
Since lesbians eat so much pussy should they be considered sexually snacktive?,True
"When life gives you chlamydia, make lemon chlamydia?",True
"Just saw 666 on a license plate and, in case you guys were wondering, satan drives a jeep.",True
Why are gametes used in big marketing campaigns? because sex cells,True
Whoever stole my dildo can go fuck themselves.,True
Pooping on a party is still the number one way to poop a party.,True
What is the most common phrase in a gay bar... can i push your stool in?,True
My mom likes to get to the airport three days before her flight.,True
Where do you go during a zombie apocalypse? the living room.,True
Why would koreans make great jazz musicians? because they have seoul.,True
What do you call a girl whose profile pictures are only facial close ups? fat.,True
What do you call a hippo that swears? a hippopottymouth,True
Heard about the berlin comedy club in the 1940s? it was nazi time for holocaust jokes.,True
What's more dangerous than a serial killer? a parallel killer.,True
An f1 racer gets addicted to amphetamines. he soon felt the *need* for *speed*,True
"Eliminate anime and islam, and you secure the the existence of western culture for eternity",True
*cinderella drops her glass slipper* prince: i have a girlfriend.,True
Girl are you a mathematician? 'cause you turn my quadratic parabola into a linear straight line.,True
How can a middle aged unemployed rat with 4 teenage turtles afford so much pizza?,True
Breaking: new torture report reveals cia use of facebook year in review videos.,True
Why wouldn't the teacher fart in public? because she was a private tutor,True
What is the difference between michael phelps and hitler? michael phelps could finish a race.,True
What pokemon spys on you while he has a cold? peek achoo!,True
The best part of being single is that you always get to be right.,True
Why did the chinese chicken cross the road? the eggrolled,True
Laughter is not the best medicine. please take your medicine.,True
"(amazingly, an original joke!) where will they put deadmau5 when he dies? in a mau5oleum!",True
What do you call a humor site with bad ads? punhub.,True
What is the name of an irish girl who hangs out on your lawn? patti o'furniture,True
Why did helen keller try lsd? because she was told it makes you see things!,True
What's the difference between an elevator and a black guy? the elevator can raise a child.,True
It's hard to explain puns to kleptomaniacs... ...because they always take things literally.,True
How do you say doormat in spanish? matador,True
What do you call a canadian enchilada? a centimeter-alada,True
A mosquito walks into gang territory looking for blood... all he finds are cripz.,True
Congratulations west ham the only club named after two things that isis hate.,True
Did you hear rick ross's new song about the ebola crisis? it's called 100 blacks coughin',True
My keyboard squeaks and so does my mouse.,True
Sex with a homeless guy is right up your alley,True
I might have alzheimer's... ...but at least i don't have alzheimer's.,True
What do naturopathic doctors use to keep up with their finances? quackbooks!,True
Moisten thyself and wait for me in the westernmost grunting shed,True
What's wrong? i'm lost. you're in the mall you little idiot.,True
Why does saudi arabia have so much oil? because the women are not allowed to drive.,True
"Some people have six packs... i have a keg. my wife, however, has a goddamned brewery.",True
I like my women like i like the sun... not exploding.,True
How do you make a cat go woof? you pour some gasoline and toss a match and woof!,True
What do you call a fat mexican? a spic with span.,True
"Can a kangaroo jump higher than a house? of course, a house can't jump at all",True
How do you make a hormone? don't pay her...,True
What do ghosts do when they're sad? they get in an elevator to lift their spirits.,True
1. get tipsy. 2. go into a tanning bed. 3. pretend you're a panini.,True
Had my son's hearing tested because he's always yelling. turns out he's just an asshole. :(,True
Which group of people are the best at jazz? the saxons!,True
"You don't need a parachute to go skydiving: **however**, you need a parachute to go skydiving twice",True
"Yo momma so old, her birth certificate says expired",True
So there's 100 000 pascals in a bar...,True
"So, hows your dns lookup up? yet again, i am very sorry.",True
"I used to steal jokes of comedians. i still do, but i used to too.",True
"The russian skater has a mullet. glasnost in front, perestroika in back.",True
Why couldn't moses adopt a kitten from the animal shelter? because the shelter was non prophet.,True
"In israel, we just want peace. a piece of jordan, a piece of egypt, a piece of lebanon...",True
Drake like his women like... i like my mustang... 47 years old.,True
What is the best part about having sex with twenty eight year olds there are twenty of them,True
Being a hacker in the '80's was way easier. *shakes vending machine until chocolate bars falls.,True
Ladies tell me i have the body of a god buddha,True
Kim jong died. i guess you could say he was a little il.,True
I once knocked out a champion boxer... i'm still banned from crufts.,True
Why should you never take a shower with a pokemon? because it may pikachu.,True
