text,humor
When do the leaves begin to turn? the night before a test.,True
You can't run in a camp site. you can only ran because it's past tents.,True
"I almost killed my whole family last night, but eventually chose not to let my wife drive.",True
I'm a ginja. what is that you might say? a ginger ninja,True
I asked my friend how he can date a fat chick... he says she's grown on him,True
It only takes 3 inches to please a woman and it doesn't matter if it's visa or mastercard,True
What is hilary clintons favorite part about going to the beach? her flip-flops.,True
"What do you call a vampire, that follows the rules? draculaw",True
Why did the pentagon change it's name to the square? because they were cutting corners.,True
Toyota's solution for sticky gas pedal - shorten driver's right leg,True
"I will be posting telepathically today. so if you think of something funny, that was me.",True
"What do you call a mexican child? a paragraph, because he isn't yet an ese.",True
I forgot to go to my seminar on mindfulness,True
You miss 100% of the shots you don't take. -wayne gretzky -michael scott -melania trump,True
Last night i dreamt i was a muffler. i woke up exhausted,True
How do you greet your mexican friend eating sushi? wassap b?,True
Have you guys heard my joke about elevators? it's funny on multiple levels,True
"Last night, my chevy was bitten by a vampire. now it's vlad the impala.",True
I wonder if people with eye patches thought it was all fun and games.,True
How do you get a dog to stop humping your leg? you suck his dick.,True
Why do hippies have sex at music festivals? because it is intents,True
How is a teacher like a hooker? they're both pretending that they're enjoying it.,True
"''hey, you like water? yes? well i can turn it into wine.'' -jesus flirting in a bar",True
Dicaprio finally won an oscar!!! sorry wrong sub...,True
"Ever since getting married, i've become really into politics. everyday i hold my own caucus!",True
"Why is yoda the worst copilot? yoda, are we still going the right way? off course we are",True
"Success, like a fart, only bothers people when its not their own.",True
What goes up and down but does not move? stairs,True
Why don't catholics wear condoms? because little boys can't get pregnant.,True
What happens if you cross breed spiderman and catwoman? i don't know..can you guys tell me?,True
What kind of sex toys do terrorists prefer? blow up dolls.,True
I celebrated 4/20 on january 5th. i know how to reduce fractions.,True
What's all pent-up and missing a cunt? chelsea manning.,True
What does joe biden say as he is leaving his house? biden,True
What's the difference between the chinese and germans? the chinese rike and the germans reich.,True
"When people ask if they can get me anything, i always ask for a jetpack.",True
Why does a german always have the last laugh? he has to wait for the verb.,True
"A friend of mine collects national geographic magazines, he really has a lot of issues.",True
Who's the nicest player in the nfl? drew brees. the guy's a saint.,True
"I asked my wife for sex recently... she said, no, it's a super moon, not a blue one.",True
Did you say that you need to go see a psychiatrist? that's crazy!,True
Zombie mom: brains for dinner! teen zombie: again?!?  i wish i was alive!!,True
Did you hear about that jew that started a charity? neither did i.,True
I walked into my sister's room and tripped on a bra. it was a booby-trap.,True
Do you know how to really disappoint a fellow redditor?  *repost*,True
How many women does it take to park a car? a man.,True
Did you hear about the man with 5 penises? his pants fit him like a glove.,True
"*whispers, spitters are for quitters. ~wine tasting, you pervs!",True
"Going to see the new batman tonight, heard it got killer reviews.",True
I know a guy who doesn't love raymond.,True
"Did you know that after this next album, matisyahu will be retiring? soon he will be jah-bless.",True
What is a spectre's favorite theme park attraction? the roller ghoster,True
I dated a schizophrenic once... ...but i had to break it off because he kept seeing other people.,True
Where do onions fight? in the onion ring!,True
A liberal arts student walks into a bar. (insert pronoun here) can't buy anything.,True
Why was the black man selling drugs? he was a pharmacist.,True
What do you call the hash marks on your headboard? your tally skeet.,True
When do computers go to sleep? when it's internight.,True
Did you hear about the guy who od'ed on homeopathic medicine? he had forgotten to take them.,True
What do you call a black pilot? a glitch in the matrix,True
Thinking about becoming an unemployed mom so i can make up to $64/hr online.,True
I dropped acid this morning the teacher made us evacuate the lab.,True
I like my coffee like i like my women. without some other guy's dick in it.,True
What did the priest get at toys r us? an erection.,True
I overdosed on my homeopathic medicine today. forgot to take it.,True
"On a scale of 3 to orange, how octupus is your jam sandwitch?",True
"Row, row, row your boat gently down the stream.. ha, ha fooled you, i'm a submarine.",True
What do you call a cow that's masturbating? beef stroganoff,True
What did the middle eastern terrorist say when he was captured by the police? oman!,True
What do you call a vegan wizard? a soyceror.,True
What is the difference between a duck? one leg is both the same.,True
Tifu by having sex on an airplane ..,True
I thought i wanted to get married again. then i laughed and remembered why i shouldn't think.,True
Why do dinosaurs use christian dating sites? because they can lie about their age!,True
"Ladies, admit it. sometimes you look down at your own boobs and think wow, this is awesome!",True
If a quiz is quizzical what is a test?,True
My wife is not buying that autocorrect changed you're psychic to you're psycho.,True
When it's cold out i wear my ugg boots. when it's frustrating out i wear my ugh boots.,True
What did the banana say to the vibrator? what are you shakin' for? shes gonna eat me.,True
Q: what do you call a cheap circumcision? a: a rip off,True
"Larry page's note to himself when wife mentions she wants motorola, she means phone.",True
A dog owner tells his dog.. owner: who's a good boy? doggo: did you just assume my gender?!,True
"Apparently the bin laden plane hit a porsche, it's 911 all over again.",True
"Beer before liquor, never sicker. toothpaste before orange juice, dead.",True
What do trump supporters and child molesters have in common? they both like immature assholes.,True
"Every day, i win arguments from 10 years ago in the shower.",True
My girlfriend is really into space... so i've started calling my junk the pillar of creation.,True
Why are european cars the lightest? because there's no americans sitting in them.,True
It's never your successful friends posting inspirational quotes on facebook.,True
Roses are brown... violets are brown... wait...who shat in my garden?,True
Why did the farmer vivisect his daughter? he wanted to reverse cowgirl.,True
Counted five pregnant women at this noah matinee. praying their water doesn't break.,True
Dang girl. are you a werewolf... cause i'm lycan what i see.,True
"Guys, i just found a bunch of mohicans!",True
I worked myself up from nothing to a state of extreme poverty.,True
I'm going to start a blog for irrational numbers... i think i'll call it the 3.1 forums...,True
"*cat opens gift from her husband* it's...an empty box. *silence* oh honey, i love it!",True
"Reporter: russell wilson, do you want another superbowl ring? wilson: nah i'll pass.",True
What's next to moscow? pa's cow. i'll show myself out...,True
What's the number one pick up line at a gay bar? may i push your stool in?,True
