text,humor
Have you seen the features on the next-gen iphone? just google 'galaxy s4 reviews'.,True
What is the only way to stop donald trump? a cruz missile.,True
I have two requests for my funeral 1) be scattered at disney land 2) not to be cremated,True
I peed on the floor in front of the beverages at a party now there's no punchline.,True
What do paper towels call their family? napkin,True
"What's got two wings, a tail and twenty five pricks? england's return flight.",True
What was the former name of captain hook? captain hand,True
Why are jewish men circumcised? because jewish women don't touch anything unless it's 20% off!,True
The guy who invented urine therapy died a few days ago. may be rest in peace.,True
I bought a cosmo magazine that said best sex ever! all i got was a bunch of papercuts.,True
How do you make five pounds of fat look sexy? slap a nipple on it.,True
What's grey and can't fly? a parking lot.,True
Ever heard a good joke about sodium? na,True
What's a cow's favorite chemical? molybdenum monoxide moo,True
What has four legs but isn't alive? a dead dog,True
Why are giraffe's heads so far away from their bodies? long necks.,True
Which hotel does link use when he goes on vacation? the hyat,True
"Why did satan need life alert? because he had fallen, and could not get back up.",True
What do you get if you cross a fish and an elephant? swimming trunks.,True
I like my beef how i like my misbehaving teenagers... grounded.,True
The pope just reaffirmed that jews can go to heaven damn legacy applicants.,True
Why i'm leaving /r/jokes i'm going to bed,True
Been throwing up gang signs all morning. must've eaten some expired gang signs,True
What do you call an exploding monkey? a ba-boom!,True
"What's blue, small and sits in a corner? a baby with its hand in the power socket.",True
Don't forget to stop and instagram the roses.,True
If my boyfriend ever cheated on me i'd be like omg i have a boyfriend :),True
Nick: can you tell me the way to bath? rick: i use soap and water personally.,True
Why aren't fish good tennis players? they don't like getting close to the net!,True
Why were the teachers eyes so crossed? she couldn't control her pupils.,True
I like my coffee like i like my women ground up and in the fridge.,True
Anyone else wake up in a grass skirt and coconut bra?,True
Reddit's letterbox is sorta like a ... wordbank.,True
"What do jesus, gandhi and mel gibson all have in common? they all had a brave-heart.",True
I once had a voice like justin bieber. then i turned 4.,True
Those who live by the sword get shot by those who don't!,True
"I'd like to die like my grandfather, who passed away while sleeping not like his four passengers...",True
What is the quickest way to double your money ? fold it in half !,True
Chuck norris's daughter had her virginity stolen:chuck norris stole it back,True
What do disabled people get when there's a fire in the building? left behind,True
The energizer bunny as been arrested! he was charged with battery. edit: h key on my damn keyborad.,True
Which blood type do most of the people in taiwan's capital city have? taipei,True
Why is it called almond milk? nut juice wasnt very popular.,True
What's the award for being the world's best dentist? a little plaque.,True
That awkward movement when you... read movement as moment.,True
What is black and rhymes with snoop dogg? dr. dre,True
"Everything is made in china... except for babies, they are made in vachina.",True
A politician in an ancient civilization... he'll only just babble on.,True
Some guy in a in a wheelchair stole my camo jacket he can hide but he can't run.,True
Did you hear about that new state of the art jackhammer technology? groundbreaking,True
"Ll be posting telepathically today.. so if you think of something funny, that was me.",True
How do you kill a hippie? tape a hula hoop to the bottom of a pool,True
Take your child to work day must be awkward at the dildo factory.,True
What is wrong with the number 6.9? there is a period in the middle.,True
Volunteer shark bait is a much more inspiring name for surfers,True
I asked my sushi chef what his favorite roll was. . he said payroll.,True
What do you call a retarded kid with no arms and one leg. names.,True
A preachers son told him he was an atheist the preacher accepted it and was very supportive.,True
Why did the chicken not cross the road? because it was lunch,True
A reposter reposted... and he was ashamed of himself.,True
When fish play football who is the captain ? the team's kipper !,True
Always wash your clothes in tide because it's way too cold out-tide,True
What does a triangular acorn say when it grows up? geometry.,True
"I bought my dog a toy cell phone, now it takes him 45 minutes to shit.",True
What do you call a skinny person with a lisp methed up,True
Peter: my brother wants to work badly! anita: as i remember he usually does !,True
"Guess what came in the mail today i did, i ran out of tissue.",True
{commercial for floors} is this you? {footage of man falling endlessly to oblivion},True
What did the hacker do when the police came for him? he ransomware.,True
"How do you tell if someone is opposed to gmos? don't worry, they'll tell you.",True
I definitely could not be a surgeon. blood freaks me out when i'm high,True
Have you guys ever heard of the crazy mexican train killer? he had...... loco motives,True
I'm dating an older woman. when i go down you know what it tastes like? depends...,True
Why did the guitarist get arrested? he was arrested for fingering a minor,True
What did one reddit user say to the other? (punch line in comments),True
Why is it a long and expensive process for fruit to get married they just cantelope,True
Audrey hepburn probably has my favorite last name that combines an std and a symptom of an std,True
Waiter there is a worm on my plate ! that's not a worm sir it's your sausage ?,True
Why are asians not optimistic? because they have a limited view of life.,True
How can you tell when a bar is haunted? it's full of boo's and spirits.,True
Police: ask him where the money is hidden. me: spaghetti tortellini benghazi fibonacci cappuccino.,True
What do you call a pedophile musician? a kiddy-fiddler,True
"I've got a really crappy joke for you... ... nevermind, it's too corny.",True
Why do bees hum ? because they've forgotten the words !,True
Accidentally went to rouge one instead of rogue one. boy is my face red.,True
I have the cutest bird in the world... ...a jackd'awww.,True
A lawyer contracts a cold for two hours. what does he have? a brief case.,True
Why does gandalf prefer coupes? because other cars have mordor.,True
What's grey and moves at a hundred miles an hour ? a jet propelled elephant !,True
Ferguson shoe store broken into and looted everything but the work boots section.,True
I assume most of braille writing is just shit talking about non-blind people.,True
"I'm going to get crucified for this joke, but here goes... i am the son of god",True
"I like my sex like i like my banana trees if it won't bear fruit, it's not appealing.",True
*whispers in random chicks ear i have pizza in the van,True
"The problem with we, the people is mostly you, the people.",True
Being single is like a vacuum cleaner: its sucks when you're turned on,True
How does moses make his coffee hebrews it,True
How can you tell an auto mechanic just had sex? one of his fingers is clean,True
"What do you tell a nazi with two black eyes? nothing, you already told richard spencer twice!",True
Why was the computer tired when it got home? it had a hard drive.,True
