text,humor
What goes in big and hard and comes out soft and soggy? bubble gum.,True
What tv game show do fish like best? name that tuna!,True
Yo mamma so dumb..... that she climbed a glass wall to see what was on the other side.,True
"Confucius say virginity is like bubble; one prick, all gone.",True
How many norcal kids does it take to screw in a lightbulb? hella.,True
A truck driver almost crashed into a dam son that was close!!! nope? :( ok i'll shut up...,True
Does anyone know what subreddit your mamma jokes are in? jk.,True
Historic moments in rap. jay w  jay z,True
Alex: this term indicates a zero score in tennis. contestant: what is love? *dance party erupts*,True
Did you hear about the carnival fires? they were intense.,True
Where do hamburgers go to dance? to a meatball.,True
"Processed pork, gelatin, and salt in a can this is now a spam post.",True
What did michael jackson say to the vegetables? just beet it,True
"If you love something, set it free.. if it comes back to you,,,,you love a boomerang",True
Why did the power go out when optimus prime got his first blow job? someone blew a transformer.,True
Gonna hand out job applications to teenage trick-or-treaters who ring my doorbell.,True
I tried playing uno with all my mexican friends... ... but they kept stealing all the green cards!,True
What do you get if you cross some ants with some tics ? all sorts of antics !,True
What's the most fun a monk can have? nun,True
Sometimes a person is completely out of the picture but you just can't let go of the frame.,True
Why could darren jump higher than zeus? because he was mortall.,True
What do you get when you cross a joke and a rhetorical question? ...,True
A mexican is on your front lawn bleeding out and calling for help. what do you do? reload.,True
My boss is so inappropriate at work whenever there's an opportunity for innuendo he slips it in,True
Just finished building doors for my fish. i'm highly skilled in the field of carp-entry.,True
What do you call a reliable coke dealer? instagram,True
What did the newly paroled french prisoner name his restaurant? attempted crepe,True
What did the pirate say on his 80th birthday? aye 'maighty,True
Knock knock who's there ! alda ! alda who ? alda time you knew who it was !,True
"My teacher asked me if i knew any anagrams of denied. i said, indeed.",True
Q:what happens when your gf illegally downloads a movie? a:she becomes piratebae,True
I just gave my cat a bath. your move satan.,True
"Every time i click on amas that's all the time we have, thanks everyone!",True
I'm going to take a nap... wake me up when september ends.,True
Roses are red roses are red i'm feeling elated i'm doing gisele my balls are deflated,True
"If a woman says, all men think with their dicks well... then blow my mind.",True
How do you get a dog to stop humping your leg? you suck its dick.,True
Say no to drugs. although if you're talking to drugs you may already be on drugs.,True
What did the alaska native's girlfriend say when she broke up with him? *i'm just not that inuit.*,True
Did you know king solomon made love to 1000 virgins but he never enjoyed great sex :-p,True
T now! what do we want? more time-travel jokes! when do we want them? righ - john freiler,True
What's the difference between batman and a black man? batman can go out at night without robin,True
"What has 12 hands, 12 legs, and 12 eyes? 12 pirates.",True
What did dr dre cook for thanksgiving? beats.,True
Knock knock who's there ! burglar ! burglar who ? burglars don't knock !,True
I went to this zoo. all they had there was this one dog... it was a shi-tzu,True
I went to see a psychic today she said she was expecting me,True
Women need a reason to have sex. men just need a place.,True
Why did the baker have brown hands? because he kneaded a poo!!,True
75% of men dont get enough fibre in their diet.. ....tough shit,True
Why are dogs bad at dancing? they have two left feet,True
What's got four legs and one arm? an attack dog in a preschool.,True
Whats the best thing orlando bloom's ever been in? katy perry,True
How does germany pay for all these refugees? krautfunding.,True
Why did god put the ring on saturn? because he liked it.,True
"To all you letters that want to be before p in the alphabet, join the q.",True
What do you call an extremely flamboyant loaf of bread? a faggette,True
Why are bananas never lonely? because they hang around in bunches.,True
Why was the little martian sad? curiosity killed his cat.,True
What's the difference between a vacuum and a harley davidson? the position of the dirtbag,True
What does paddy irishman says when he meets a one legged jockey? how're you gettin' on?,True
Why doesn't justin bieber shop at 'sporting goods?' because he likes dick's better.,True
Did you hear about the magic tractor? it went down the road and turned into a field.,True
I found a website with guaranteed real virgins (http://9gag.com),True
If we didn't have lawyers... we wouldn't need lawyers!,True
Drummers always have such lame jokes... i've heard them all like a zildjian times.,True
I might not be the sharpest knife in the drawer but i will still cut you.,True
"I went to a zoo that only had no animals in it. i exclaimed, doggone!",True
I was going to post a really cheesy pun but there was just no whey.,True
A former boxer decided to go into the writing business there is no punchline.,True
Where do na'vi go when they get hurt? icu,True
"Sorry, just got your text. are we still on for last night?",True
I made a graph of my past relationships. it has an ex axis and a why axis.,True
"Why do seagulls fly over the sea? if they flew over the bay, they would be bay-gulls.",True
What do you call a group of eight cowards? octopussies.,True
If a gay jumped onto your friend's back... would you help to toss him off?,True
I just saw a girl pay for a drink. is everyone okay?,True
"Y'know, hitler wasn't all that bad... he did kill hitler after all.",True
How many out of date redditers does it take to change a light bulb? over 9000,True
I know it's illegal for me to cook my own alcohol... but still.,True
I told siri to use bing instead of google.. we both laughed.,True
What does santa listen to while delivering presents? sleigh-er,True
Friends and family of jedis should be called the force kin,True
"Surely sometimes hookers just look around and say shit, i'm really a hooker right now.",True
What do you call two bees at the seaside? a b&amp;b,True
"No thanks, granola bars with no chocolate in them",True
"Think casey anthony will go into porn now, . . . since she gets off so easy?",True
The greek restaurant in my town is so authentic that it went bankrupt,True
What did the jalapeno dress up as for halloween? a ghost pepper.,True
I think my friend is addicted to drinking brake fluid he says he can stop anytime he wants,True
Why did jesus stop playing hockey? because he kept getting nailed to the boards.,True
What do you get when you cross an elephant with a rhino? 'eleph ino.,True
What does a nosy pepper do? get jalapeno business.,True
What's best about a sixteen year old girl? her fourteen year old best friend.,True
Why was the tomato blushing? because it saw the salad dressing.,True
I would love to buy a harley davidson motorcycle... but i can't afford all the shirts.,True
What happened to the ghost who went to a party?  he had a wail of a time.,True
"Apparently being poor is genetic, my son loves bologna and thinks pants are optional.",True
How do you make polish sausage ? first you gotta find a retarded pig...,True
What do monica lewinsky and a vending machine have in common? both say please insert bill.,True
