text,humor
My grandma warned that boys only want one thing from me. so i hid my playstation 3.,True
Why did prince oxygen inherit the throne after the king died? because he was the rightful heir,True
"I saw an ad for burial plots and i thought, that's the last thing i need.",True
/r/jokes has the most original content on reddit! that's it.,True
What is a religious gorilla called? a monk-ey,True
What's the same as an ocean rabbit? a c-hair!,True
"If sex is a pain in the ass, then you're doing it wrong ...",True
Lpt: never buy anything made of velcro... it's a total rip-off.,True
Dont do phone sex or you'll get hearing aids,True
I can't tell if i'm going bald... or if it's all in my head.,True
What do you call an eskimo who's a peeping tom? itookalook,True
"I've decided to take some time off facebook so i can focus on work and, ok, i'm back",True
Went bass fishing the other day caught a subwoofer this big!,True
I have a great hippa joke! but i can't tell you.,True
Q: what did dahmer do when he finished his vegetables? a: he threw away their wheelchairs!,True
*first date* him: you have a very defined jawline. me: thanks! i chew a lot.,True
You can fit fifty mexicans in a van but i can fit six million jews in my ashtray.,True
Q: how do you catch an orange elephant? a: i don't know. i've never seen an orange elephant.,True
What comes out of the mating of a donkey and a bunny? the bunny's eyes,True
You know why russia is more productive? they're rushin',True
"What should you say when an old lady calls you a bastard sonofabitch? i love you too, mom.",True
What do you call a comedian that can't get a girl pregnant? carl barron,True
Cigarette's killed my wife. she was run over by the marlboro truck.,True
What's the difference between a wedding and a funeral? one less drunk.,True
Some lady on the price is right just won a brand new 2016 epi-pen.,True
Ur a pony! ur a tablecloth! the shapeshifting continues for hours.,True
Awful purim joke grogger? i hardly knew her!,True
What do you call a mexican rolling in sand? a churro.,True
What's an arab man that drives a bus an otto-man,True
My girlfriend treats me like a god she ignores me till she wants to ask for something,True
You get what you get and you don't get upset... you have cancer.,True
I saw a transvestite... wearing a t-shirt that said guess. source: demetri martin. person.,True
Why don't chinese restaurant owners do their dirty dishes? because it's too much wok!,True
Paying bills is fun and easy when you have a bottle of wine and a shredder.,True
How did the tugboat get aids... it was rear-ended by a fairy.,True
Dear algebra stop asking me to find your x . . . she is not coming back!,True
*opens a window and the wind blows 84 hamburger wrappers from my desk.* oh no! my research!!,True
Why did the doughnut maker retire? he was fed up with the hole business.,True
"I'm no cactus expert, but i know a prick when i see one.",True
Why do mushmelons always have traditional marriages? because they cantaloupe.,True
What do you call a waterfall that's all dried up? a waterfell.,True
Made the mistake of dropping my pants when my dentist put on latex gloves.,True
"When people see you as a competition, you already won.",True
*runs into bank with gun* alright! everyone put your hands up! *tickles everyone*,True
"Employee: sir, overall sales are really low. ceo: when did we start selling overalls, bro?",True
What do you say about a pig who acquires a lot of cash? he's making bankon.,True
Lpt: don't let a doctor examine you without clothes on make him put his clothes on,True
How does the karate kid pleasure himself? wax off,True
War does not determine who is right... ...only who is left.,True
What do you call money you pay prostitutes? headquarters,True
When a transgender goes missing.. you put their photo on a carton of half and half.,True
(from my 8 year old) what do you call a mexican chicken giving directions? arrows con pollo,True
"Not to brag, but they know me by name at the liquor store and the police station.",True
"Huge shout out to the woman that message me first... love you, mum!",True
"What did the pirate say on his 80th birthday? aye, matey!",True
I give everyone nicknames because using real names is for people who can remember people's names.,True
Who served as the 45th vice president of the united states?,True
"Don't necessarily nominate me for sainthood, but i just gave a very ugly woman directions.",True
Q: what do you call a male quartet? a: three men and a tenor.,True
Gay marriage is legal now so... is the internet over now? do we go on vacation?,True
What do you get when you eat all of the potatoes? *chuckle* they're all gone!,True
Did you hear about the argumentative  skunk? he always liked to make a stink!,True
Overheard: i think that guy is listening to us.,True
What did blizzard do on warcraft's opening night? farm gold in china.,True
What do a bass guitar solo and peeing your pants have in common? it's quiet and embarrassing.,True
Tombstone: here lies houdini 2nd tombstone: now i'm over here,True
I'm like a dead owl... i just don't give a hoot anymore.,True
Today is david finchers birthday... whats in the box!?????,True
They should make a minecraft movie it would be a blockbuster.,True
Why did shrodinger's girlfriend dump him? because she didn't like his lack of commitment,True
"I used to be addicted to soap but it's okay now, i am clean.",True
How can you tell if lunch meat is from west virginia? it's in bread,True
"What's the difference between ignorance and apathy? i don't know, and i don't care.",True
I asked an atheist how do you view homosexuality? he replied mostly on pornhub,True
A cleaning service of men who think a hot girl is coming over in 20 minutes.,True
I hear most muslims are capitalists... they're always going on and on about some great profit.,True
Man gets left side crushed in car accident. but don't worry he's all right now,True
Who is the biggest gangster in the sea ? al caprawn !,True
What did the fish say when it ran into a wall? dam,True
What did the black man get for his 18th birthday? your car.,True
Sometimes you have to make a stand. not there though. you're blocking the tv.,True
Retweet! retweet! yelled the german commander as we invaded normandy,True
I tried coke once. and then for like another 3 years to make sure i didn't like it,True
"French guns for sale! never fired, dropped only once.",True
I'd completely forgotten i had a boomerang it just came back to me.,True
From my 7 year old daughter: what do you call a girl shell? a she shell.,True
What is the hamburglar's favorite david bowie song? rebel rebel!,True
A husband and wife were found smothered in their bed... detectives called it the pillow case...,True
I like my coffee served the same way like i like my women... a cup,True
I want to debate! someone disagree with me! no.,True
Here's a step by step guide to staircases *gives you a handrail*,True
My fruit business went into liquidation. i now sell smoothies.,True
What did the tomato say to the mushroom? you're a fun guy,True
Maybe design women's clothes so the person wearing it can also zip it.,True
I'll never forget the day i met you... ...but i'm trying.,True
Is your dad retarded? because you're something special,True
Don't let a man put anything over on you except an umbrella.,True
I like my coffee how i like my women warm,True
"Sometimes i miss my real friends and then i think, screw them, they don't even star my tweets.",True
Her parents wanted her to date someone of her own ethnicity. but polly wanted a cracker.,True
