text,humor
What's 12 inches long and stiff in the morning? cot death.,True
Sometimes i visit websites that have videos of people making love,True
I wonder if the clothes in china say made around the corner,True
What celebrity never payed with a cheque or credit? johnny cash.,True
A dickhead is talking to an asshole when suddenly they yell oh shit!,True
My father was from iceland and my mother was from cuba. i'm an ice cube.,True
Why doesn't a window scream when you shatter it? because it's paneless.,True
How do you unlock a door made of dough with a cookey,True
"Ramen noodles are like masterbating when you finish, you feel guilt and regret.",True
What's a gay couples least favorite fruit? cantaloupe.,True
Women that date guys with bad grammar are the goodest.,True
"Roses are red, violets are blue, some poems rhyme, this one doesn't",True
"How many vowels are in the word 'vowel'? four. o, double-u and e.",True
Why did the car judder to a stop when it saw a ghost? it had a nervous breakdown.,True
I just realized why my wife never posts on reddit. she always has to have the last word.,True
"I'm more than happy to take your sloppy seconds. who am i kidding, i'll take corroded fourteenths.",True
What do you call a kid with one arm and three legs? unfortunate.,True
Knock knock. who's there? 9/11. 9/11 who? ...*you said you'd never forget*,True
I'd tell you the joke about the pirate but i don't think its arrrrrrpropriate.,True
I'm breaking up with my girlfriend that uses comic sans... she's just not my type.,True
I got my dog vaccinated... ...i think she might have paw-tisim now.,True
An opinion without 3.14 ...is just an onion.,True
What do you call an expert at making ship parts? a master master.,True
Did you hear the one they don't tell retards? no? oh well never mind then.,True
"When life gives you lemons, use their natural acidity to temporarily blind your opponent",True
First cannibal: we had burglars last night.  second cannibal: did they taste good?,True
"When i make my first million, im switching from 2 ply toilet paper to white bread.",True
How much is a metric fuck-ton? a shitload.,True
My friend left his job at a nut factory... cause they paid him peanuts...,True
What do you get when your iphone auto-corrects lardass? kardashian,True
Why did the semen cross the road? i wore the wrong socks today...,True
What did the police say to the hot dog? you are under arrest.,True
"A sad dickhead walks into a bar... and the bartender asks him, why the schlong face?",True
"I thought the undertale genocide run was comic, but than i met sans. ^i'm ^so ^sorry.",True
I'm very pleased with my new fridge magnet. so far i've got twelve fridges.,True
Why did the blind girl fall in the well? she couldn't see that well.,True
Did you hear about the gay midget? he came out of the cupboard.,True
"What do you say to a giraffe? hi, asshole! (made that up myself, i did.)",True
What do you call a cow with only two legs? lean beef!,True
What do you call a muslim flying a plane? captain you fucking racist!,True
I can't wait to get married and communicate my disdain solely through aggressive dishwashing.,True
If you borrow my laptop and the volume is at 16% go wash your hands immediately,True
Why did adele cross the road? to say hello from the other side!,True
I made the starbucks guy say large instead of venti i have already conquered wednesday what now,True
Where do you find 100 fat cows? at bingo,True
What did the black guys say to the bleach? you basic,True
Why is it that most nudists are people you don't want to see naked?,True
Where does dracula buy his writing supplies? pencilvania.,True
What do eskimos get from sitting on the ice too long? polaroids!,True
How did the hipster burn his mouth? he ate food before it was cool,True
What was the islamic star wars fan for halloween? hijabba the hut,True
What do you call a vampire junkie? count drugula.,True
Startin' a band with some guys i used to work with called linkedin park.,True
How did the blonde die raking leaves? she fell out of the tree.,True
Did you hear about who's new report about processed foods causing cancer? who?,True
"Did you hear about the car with wooden wheels, a wooden engine, and wooden doors? it wooden start",True
Confucius say... man who run in front of car get tired.,True
How do you find will smith in a snow storm? you look for fresh prints.,True
Do you like fish sticks? who are you? kanye west?,True
A good artist knows where to draw the line.,True
So oxygen went on a second date with potassium that went ok2,True
Why don't muslims have dirty minds? because they're so easily brainwashed.,True
Keep death off our roads drive on the pavement. . .,True
Need terrorism jokes for a terrorism and communication class. help a brother out!,True
I'm not on the atkins diet. i'm on the rowan atkinson diet... it's all beans!!,True
What do you call a chinese fanatasy series? lord of the chinks,True
I knew a woman who was very liberal with her kids. she had them aborted.,True
Apparently my twitter session today has lasted 12 hours. i don't even miss my life anymore,True
We should stop making fun of fat people they have too much on their plate already,True
"What does idk mean? i keep asking people, but they don't know either.",True
Your mother is so fat... ...even whilst fucking her it feels like a long-distance relationship.,True
How are a tupperware container and a walrus alike? they both like a tight seal.,True
What does a plumber call screwing his wife  servicing the dishwasher,True
To the person who stole my selfie stick: you need to take a long look at yourself.,True
Bon iver just walked into my starbucks. wait nope just a super sad cat.,True
Hippocrates was pretty damn smart ... for a horse.,True
I think i'll tell my kids that the titanic sunk because jack and rose had sex before marriage.,True
Advertising slogans are the official language of the united states of america,True
Why can't the t-rex play the piano? cause they're dead!,True
So i work with dogs whenever they get unruly i just tell them they are adopted.,True
Q: why did the boy throw his clock out the window? a: he wanted to see time fly.,True
"My wallet is like an onion. when i open it, it makes me cry.",True
How does a korean walk a dog? with a little bit of oil.,True
"I saw a woman with 12 breasts sounds amazing, dozen tit?",True
What's the only thing better than roses on a piano? tulips on an organ.,True
"Sandwich walk into a bar/ the bartender said, sorry, we don't serve food.",True
What is a monkeys favorite candy? rhesus species,True
Why did jesus go to the gym? to make sure his cross fit.,True
The isis have recruited a new rapper... they're calling him the real islam shady!,True
The three up's in life: 1. show 2. keep 3. shut,True
The furniture store keeps calling me to come back. but all i wanted was that one night stand.,True
What did the black kid say to his mom when he had diarrhea? help! i'm melting!,True
Whoever stole my copy of microsoft office is in big trouble. you have my word.,True
What do you call spiders in the middle east? iraqnids. yep. an original.,True
Eat her already! - animal watching people kissing,True
My ex-wife is like barbie... the bitch has everything.,True
My car is equipped with the best anti-theft device in florida. i call it no air conditioning.,True
I asked my welsh friend how many times he'd had sex... he started counting then fell asleep.,True
(1st day in heaven) angel: stop asking everybody what they died of,True
What do you call a security guard in a jumping castle? a bouncer,True
