text,humor
Do you struggle with rational thinking and basic literacy? let us know in the comments below,True
The women who are attracted to me all have one thing in common... write your own punchline,True
A few redditors wake up in hell. a few less reposts.,True
What do you call a disabled asian? sum ting wong.,True
"Tifu by getting on the normal bus instead of the dyslexic one whoops, wrong bus.",True
I'd rather keep thinking there are punctuation errors in everything i read than clean my monitor.,True
Why does hillary clinton not give good blowjobs? because her teeth are too fake and big,True
"There's safety in numbers. unless there are 6,000,000 of you. and you're jews.",True
America was declared the country with most busty people. in the both genders category.,True
"What did the mexican say when two houses fell on him? get off me, homes!",True
What do use to lure really big fish? master bait,True
Knock knock who's there ! amos ! amos who ? amos-quito!kn,True
Whats wrong with four black people in a cadillac driving off a cliff? the cadillac seats five.,True
How do you find an alive baby in a pile of dead babies? with a pitchfork!,True
Why do black people like fried chicken? because its delicious.,True
I've lost all the aces from this deck of cards. i just can't deal with this.,True
Women don't make good meteorologists because they're never wrong,True
"Mirror mirror on the floor, who's the worst at home decor?",True
I'm a recovering alcoholic! :i'm recovering from last night!,True
I heard that comedians never tell jokes about the jonestown massacre. the punchline is too long.,True
Oh u love jesus with all of ur heart? name 3 of his albums,True
"I've accepted the fact that being cremated is my last hope for a smoking, hot body.",True
Why do congressmen make terrible cashiers? they're all too afraid of change.,True
"If you're still undecided on a certain tattoo, try it out first on your baby.",True
Why did the calculator pay $100 for a pack of cigarettes? there was a sin tax error.,True
I wouldn't last 5 minutes in prison what with my milky skin and glee themed tattoos.,True
I just got a socially progressive phone... it has an lgbtqwerty keyboard,True
What kind of money do religious businesses make? prophet.,True
What rock group has four men that don't sing? mount rushmore.,True
Why is it bad to have a strong american dollar? it's harder to break bills.,True
What s the only white thing about a black guy? his owner.,True
I used to be addicted to the hokey-pokey but i've turned myself around,True
Vodka giveth and vodka taketh away... it giveth me a hangover and taketh away my underpants. amen.,True
How do you define necrophilia? the urge to crack open a cold one,True
If you touch your computer in all the right places... you can turn it on,True
I was watching the grammys when something hit me my dad,True
Why didn't the skeleton go to the party? he had no *body* to go with,True
My mom burned my hawaiian pizza today... i guess she should have put the oven on aloha setting...,True
"There is no reason to hit a woman! lol, just kidding",True
What do you get when you cross a rhetorical question and a joke?,True
What kind of bees make milk instead of honey? boo-bees,True
Dark humor is like a child with terminal cancer it never gets old,True
Light beer is like having sex in a canoe... it's fucking close to water,True
Freebird! (when you purchase a bird of equal or lesser value.),True
"Hi, i'm black and i can't stand the stereotype that we are all criminals. -sent from your iphone",True
According to this box of cereal i am a family of 13 eating breakfast,True
"Did it hurt when you fell? into the toilet, you piece of shit?",True
"Why do irish stew recipes only call for 239 beans? because one more, and it would be too-farty.",True
What does the aardvark take sailing? an aard ark!,True
So apparently rsvp'ing back to a wedding invite 'maybe next time' isn't the correct response.,True
I always play it safe during sex. i cut the telephone chord.,True
Why does everyone hate hitler? the man was a hero... after all he did kill hitler,True
The camera adds 10 pounds. the front facing iphone camera adds 437 pounds.,True
Why did the zombie only eat blonde brains? she was on a diet.,True
Where do senior citizens often go to the restroom? depends.,True
"People say i don't have what it takes yeah, because every time i get it, it takes it.",True
One day i'll cure deafness... you hear me!,True
"What did the milk say to the cheese? hey, you're old!",True
It takes two who know how to tango to tango.,True
Ted has split personalities. this shows in his behaviour to his girlfriend. he's a dick ted to her.,True
What's a kkk members favorite beverage? white power aid.,True
What do you call gay paraplegics? fruits and vegetables!,True
What's the difference between donald trump and hitler? hitler had a plan.,True
"Ultra funny meme if assholes... if assholes could fly,this place would be an damn airport :d.",True
"Nothing says, i have a lot of free time, more than someone eating a pomegranate.",True
Have you seen the movie about constipation? it hasn't come out yet!,True
Mariah carey sounded horrible the other day. it was like a cannon went off in her throat.,True
What do you call a man standing up to his knees in water? wade,True
My wife's so square in bed she has cubic hair,True
Where is the best place to hide something? on the second page of google search results.,True
Me: *empties 4's maracas 4: *shakes maracas* they're broken me: oh no.. what happend?,True
I just got arrested for using my iphone it looks like i'm going to face time,True
Girls are like square roots... if they're under 18 just do them in your head.,True
What did one testicle say to the other testicle? this guy in middle is a dick.,True
What does sean connery surf on the internet? reddish.,True
What do you call a racist shark? great whitey,True
What do you and 1 ply toilet paper have in common? you both eat *da*-booty!,True
Why don't pencils and graph paper get along? because they're made out of graphite,True
What was rihanna's nickname for chris brown? beats me.,True
Life is like a box of chocolates. it doesn't do well in a hot car trunk all day.,True
Sometimes peeing feels better than sex. it lasts longer too.,True
How many cops does it take to push a black man down the stairs? none. he fell.,True
Why did the pedophile masturbate to kim kardashian? because he was blind.,True
"As a child, my family's menu consisted of two choices - take it or leave it.",True
I'm really regretting getting that discount circumcision... ...it was a total rip-off!,True
Why did the germans bail the greeks out? because they took pita on them,True
Why did the witch go commando? she needed some better grip on her broomstick.,True
"Why is the sea salty? because when it waves, you never wave back!",True
"Our dog runs away so much, i'm just going to spray paint our phone number on her side.",True
What did the farting pharaoh say to the farting slave? we only have a toot in common.,True
Roses are red violeta are blue i have schizophrenia and so do i,True
My cow got parkinson's now she only produces milkshakes.,True
How do find the blind man at the nudist colony? it's not hard.,True
What do you call a fake enemy? a faux!,True
Imagine meeting the person of your dreams and then finding out they use cutlery to eat a burger.,True
Why did susie fall of the swing set? because she had no arms.,True
What's the difference between usain bolt and hitler? usain bolt can finish off a race,True
Never under estimate the value of stretching...the truth.,True
A nun is put to death by a firing squad.... she lived and died holey.,True
"I met a guy who said he was a test tube baby. i said, groovy, daddy-o.",True
