text,humor
Q: what did the football say to the football player? a: i get a kick out of you.,True
Welcome to the sexual innuendo club thank you all for coming,True
I respect older people because they made it through school without google or wikipedia.,True
Why are some musicians so antisocial? because all they want is tonics and dominance.,True
It's really only a matter of time before lady gaga gets justin beiber pregnant.,True
Q: why did the man put cheese on his computer? a: he wanted to feed the mouse.,True
"Me: i'm so lonely. microscopic organism: wow, i'm right here.",True
They should make a weed strain called wmd except it turns out it doesnt exist,True
I really didn't like dick at first... then it grew on me.,True
What do you call an origional joke on r/jokes mine,True
What is the preferred newspaper of lighting fixtures? the lamp post.,True
My phone autocorrects 'sex' into 'pez' in case you were wondering just how dead my pez life is.,True
Why does america have so many boasting republicans? because it needs some bragging rights.,True
My girlfriend started smoking... ...so i slowed down and applied lubricant.,True
"Hey guys, i think i just got murdered but i'm not sure, and webmd is like zero help.",True
"If you marry a woman in tennessee, but divorce her in kentucky... ... is she still your sister?",True
What breaks when you give it to a twelve year old? her hips.,True
The nsa the only part of the government that actually listens,True
Your word is echo can you use it in a sentence? sentence entence entece ece ce,True
"Man i ran so fast from the italian lesbian, but the dichotomy.",True
I used to have a job circumcising elephants.. it was shit work but the tips were massive.,True
I asked a genie for the ability to shoot microwaves from my hands... clunk. these are heavy.,True
"Sometimes, you have to realize that some people can stay in your heart, but not in your life.",True
My friend has a habit of dropping things. it's getting out of hand.,True
Doctor doctor i keep thinking i'm a  caterpillar don't worry you'll soon change!,True
"Didn't support the troops, saw a bumper sticker, now do.",True
Why did the mushroom go to the party? because he was a fungi!,True
I bet my fish rolls his eyes when i tell people on the phone how busy i am.,True
What do you get when you cross a squirrel with a hummer? a gray and red hairy paste.,True
"Ego and super ego walk into a bar. bartender says, i'm going to need to see some id.",True
"What do you think of the anus, as a whole",True
Hey pigs stop trying to swallow entire apples you keep dying,True
Why is arrested development funny? because the farce is strong with that one.,True
Whats the hardest part about being a pedophile? trying to fit in.,True
Pancake day ... has has really creped up on me this year,True
When is a door not a door? when it's ajar,True
So sick of all the time travel jokes next week.,True
"When a jehovah witness dies, heaven turns off all the lights and pretends no one is home.",True
I started a band called 1023 megabytes we're pretty good but we haven't gotten a gig yet,True
What do you call a dog with no hind legs and balls of steel? sparky,True
Why do humans mainly use the decimal number system? it's just what we tend to do,True
If donald trump has been married three times... does that make melania the third lady?,True
Reddit is like sex a well-placed thumb makes all the difference,True
"According to the heart rate monitor on this treadmill, i died 14 minutes ago.",True
"10 people understand binary. those who do, and those who dont.",True
"How do you comfort a grammar fanatic? there, they're, their...",True
Why didn't the american leek want to talk to the japanese leek? because it was negi,True
Why is caitlyn jenner's stomach bad for you? 'cause it's full of trans-fat.,True
"Past, present and future walk into a bar... it was tense.",True
What is the rudest part of the body? the privates. they're either dicks or cunts.,True
How many babies does it take to shingle a roof? it depends on how thinly you slice them.,True
What did the gay guy say to pinocchio? lie to me motherfucker.,True
The problem with money is too much of it belongs to people who aren't me.,True
Why do rabbits make good mathematicians? because they're constantly multiplying!,True
Where do crows hang out on friday night? the crow bar.,True
What makes a isis joke funny? the execution.,True
Who's the opposite of willem dafoe? willem dafriend.,True
What kind of monkey can fly? a hot air baboon!,True
What's jewish and runs? the diarrhea of anne frank,True
The liberal media won't report that i can easily do 100 push-ups because they are frightened,True
Why did the ghost cross the road to get to the other side.,True
What did the boston marathon bombers do that hitler couldn't? successfully end a race.,True
Why does santa say ho ho ho? because three hos are better than one!,True
How to win an argument. 1. have a vagina. 2. that's it. 3. you win. 4. congratulations.,True
How could a leper afford a nice house? it cost an arm and a leg,True
Taylor swift seems like the kind of chick who'd stare at her boyfriend while he's sleeping.,True
"A roman walks into a bar, sticks two fingers up to the barman and says, five beers please.",True
Jesus wakes up one day to find only 11 disciples with him. who unfollowed me?,True
What's white and flies through the air? the second cumming.,True
What did the triceratops sit on? its tricerabottom.,True
"I just let my mind wander, and it didn't come back.",True
Dating is easy. you just *goes into fetal position*,True
What powerful reptile is found in  the sydney opera house ? the lizard of oz !,True
"When i see battlestar gallactica, i feel this! cylons are bunch of mean girls.",True
First date:  her: do you come here often? me: *shoots unarmed black teen*,True
What's difference between jesse owens and adolf hilter? owens can finish a race.,True
I fucked a fat woman in an elevator.. it was wrong on so many levels,True
Why do dyslexics drink tea when having a heated argument? because they're having a sipping contest.,True
I'd have an extra 18 hours of free time every day if i lost my phone.,True
Now i know why charlie sheen was always winning... ...he was just being positive.,True
"I got a new high score today. sadly, it was on my bathroom scale!",True
3 middle aged men walk into a notary office. half life 3 confirmed.,True
"What did the two oceans say to each-other? nothing, they just waved.",True
What did the left nut say to the right nut? that guy above us is a real dick,True
Where would you find percy miller's toothbrush? in his master p room.,True
"Me: look, it's walking down the stairs kid: what else can it do me: literally nothing",True
What does a super saiyan always put on his sandwich? ka-mayomayo,True
Why do you never see zebras or antelopes at victoria station ? because it's a 'mane-lion' station !,True
"Do you ever smoke after sex? i don't know, i never look.",True
Why did the scarecrow win so many awards? because he was out standing in his field.,True
A skeleton walks into a bar... ...and orders a beer and a mop.,True
What do you get when you cross an atheist and a christian? an argument,True
How are doctors so well tempered even under heavy stress? they have a lot of patients,True
I got sacked from my job at the clock factory. i just stood around making faces all day.,True
There's way too much blood in my alcohol system today,True
"I accidentally filled the escort with diesel, she died.",True
What did the black man say to the white kid? put the gun down!,True
I have a step ladder. i just wish i knew who my real ladder was.,True
A blonde joke you probably haven't heard for a while ... hillary clinton,True
If ice cube and snoop dogg adopted a child... they could call it slush puppy :),True
