text,humor
What did the o say to the 8? nice belt.,True
Is it physically possible to be sad in rollerskates? cause i think my cat's just being dramatic.,True
What do you call a vaping vegan? a steamed vegetable,True
"I'm not very good with pets. i had a pet rock once, but it ran away.",True
What do you call a confused asian person? disoriental.,True
A man walks into a bar. it knocks him out cold.,True
Q: what two states are opposites? a: maryland and misury,True
To the handicapped guy who stole my bag you can hide but you can't run,True
Why dont jewish people like getting made fun of? because millions of them already got roasted,True
Why don't indians play soccer? every time they get a corner they put a dairy on it.,True
I bought a boomerang from a ghost yesterday.. i know it's going to come back to haunt me!,True
What do american beer and a canoe have in common? both are fucking close to water.,True
"I usually read this subreddit on a toilet,... ...so that i dont shit my pants.",True
Which position is for a baseball player wearing a buttplug? shartstop,True
What did the broken bridge say? i have truss issues.,True
Why is canada the part of the illuminati? because they have 3 ehs in the name. c-eh-n-eh-d-eh,True
How do priests make holy water? they bless the hell out of it.,True
Nothing embarrasses a psychic more than throwing them a surprise party.,True
"I typed 18 beers into my calorie counting app, and it uninstalled itself.",True
Why did the guitar teacher go to jail? he fingered a minor,True
You know something bad's gonna happen in a law & order when the electric guitar kicks in,True
"If you hated really old teak furniture, would you be anti antique teak?",True
What type of missiles were used in the movie top gun? tom cruise missiles.,True
What's worse than having ants in your pants? uncles.,True
What did the american accountant say to his british counterpart? mind the gaap.,True
Where did all the cuts and blood come from? the school went on a trip!,True
Which dinosaur walks with a limp? a myfeetasaur,True
I just walked through a spiderweb and invented the next macarena.,True
What is it called when benedict cumberbatch is constipated? no shit sherlock.,True
"When the machines finally take over, prepare yourself for pope prius the first.",True
A hermaphrodite... is the only thing that is capable of fucking itself.,True
What kind of cheese do you use to hide a small horse? mascarpone!,True
Two native indians in a canoe and two dutchman in a restaurant... who tips first?,True
You can't make a squid cake... but you can make an octopi.,True
"Life is like a box of chocolates, the good ones are always gone before i get there!",True
What would marilyn monroe being doing if she were alive today? clawing at the lid of her coffin.,True
Did you hear about the 120 pound man with the 60 pound testicles? people say he was half-nuts.,True
Why are demons so fat? because they hate exorcising.,True
"How many software developers does it take to fix a light bulb? none, its a hardware issue.",True
"What's the shortest possible sentence in canadian english? sorry, eh.",True
Spell icup why the fuck are you watching me urinate?! fuck you!!!!!,True
Did you hear about the woman who had her left side cut off? she was alright.,True
What do you call a french man who's been attacked by a bear? claude,True
Your mommas so fat that when she posted to /r/gonewild they renamed the sub /r/earthporn,True
This doctor... knock knock. who's there? interrupting doctor. interup- you have cancer.,True
What do you call a mexican ghost? a juanting.,True
I can't define pattern matching ...but i know it when i see it.,True
My doctor gave me a prescription of daily sex my girlfriend insists it says dyslexia,True
What did the violin say when it finally played the music correctly? viola.,True
Despite how vital drinking water is.... i always turn my nose up at it.,True
What's the difference between a circus and a whore house? one has a cunning array of stunts.,True
I was sitting in traffic the other day got run over.,True
A buddhist was struggling to complete his jigsaw puzzle he just needed to find his inner piece.,True
"What is grey, very big and when it falls out of a tree the stove breaks? the stove.",True
I told my mom i wanted to become a stand up comedian. she laughed.,True
Why does noddy have bell on his hat? because he is a cunt.,True
Ancient chinese proverb say man with hole in pocket feel cocky all day,True
Caught red handed i walked in on my wife masturbating while on her period again.,True
On which day do monsters eat people?  chewsday.,True
What do you call a a a a aoohhh? yo mama last night bro.,True
What's a black mailman called? a blackmailer. i'll show myself out :(.,True
Why did the lemon turn green? because he had lime disease,True
Sometimes i get down on my knees and pray for a pigeon to fly directly into my mouth,True
Can somebody put that thing on silence please? it's a baby.. ... ... vibrate?,True
A friend got some vinegar in his ear now he  suffers from pickled hearing.,True
"If op was a pizza delivery driver, how much would he make? nothing because op never delivers.",True
My dyslexic uncle was suicidal... he kept jumping behind trains,True
Something hit me at high frequency today it really hertz.,True
Have you ever noticed the lack of trigger discipline cops have in movies? it's so realistic.,True
How many potatoes does it take to kill am irishman? zero.,True
What's the difference between jam and jelly? i can't jelly my dick up your ass...,True
I'm allergic to football fields they send me into nflactic shock.,True
Is your refrigerator running? better go catch it!,True
"What did the feminist jedi say to darth tyrannus? check your force privileges, sith lord!",True
Went to the corner shop... bought four corners.,True
"I get it bryan adams. it was the summer of 69, but what year?",True
What's the difference between a chickpea and a lentil? i wouldn't pay good money to see a lentil.,True
"Can't afford a cat? duct tape 3 squirrels together, next question",True
Do you want to hear a joke about sports cars? are you sure? it contains spoilers!,True
What's a dead baby's favorite holiday beverage? infanticider.,True
What do you call a rooster looking at a vegetable patch? chicken caesar salad,True
"Started a pillow fight with my boyfriend, but i forgot that's where i hide my oreos.",True
What do you call a russian cat that's been to space? a cos-meow-naut.,True
The best part of being married with kids is.....is.....umm.....yeah.,True
Why is the united states always in political disarray? it's a nation without a litre.,True
"With a name like progressive, shouldn't the commercials be better by now?",True
Why do men like love at first sight? it saves them a lot of time.,True
Have you seen stieve wonders house? -niether did he,True
Donald pharmabro trump: he wwebsite as on the internet!,True
You ever pump your gas slowly on purpose so no one realizes you only had $3 on you,True
Why do teenage girls only hang out in odd-numbered groups? because they can't even.,True
A hero without a villain becomes useless. a villain without a hero becomes.. the government.,True
Which dog eats with its tail? all dogs keep their tails on when eating.,True
"What's the maximum velocity while having sex? 68, cause at 69 you flip over",True
What is a polish person's favorite weapon? a warsaw...,True
What did one candle say to the other? don't birthdays burn you up?,True
Did you know that 95% of jews aren't jews? they're dead,True
My dad is looks for fettucini in the ethnic foods aisle years old.,True
If you watch cinderella backwards.. it's about a woman who learns her place.,True
"Jesus, take the wheel. carlos, you take the stereo & i'll take lookout.",True
