text,humor
You are my fan because u blow me away.,True
What was the shy rock's wish? to be a little boulder!,True
Social media is one of the best things to ever happen to stupidity.,True
How do you use a philosophy degree in a professional context? *why* would you like fries with that?,True
How do you describe the facial features of a man who shaves with sculpting tools? chiseled.,True
A man walks into a bar... ... he ended up with three stiches on his nose.,True
Paying for things with hugs because it's legal tender.,True
Did you hear about the man who lost his left arm and left leg? he was alright.,True
Everything brightened up when you came into our presence. - food in my refrigerator.,True
"Fact: if you don't own a suit, you get to stay in your twenties forever.",True
The pleasure is all mine... the greeting of a greedy hedonist.,True
My girlfriend wanted me to be more like her ex. so i dumped her.,True
How do i know when your sister's on her period..... your dad's dick taste like blood,True
What is jesus' favorite video game on earth? i am bread.,True
Why is it a bad idea to change clothes at a pokemon's house? because he might pikachu!,True
My friend would not believe canada has a new prime minister it's tru-deau.,True
What can't you hide in a basement full of dead hookers? my erection,True
Boss: i'm following you on twitter. me: sweet! 'nother follower!  me: oh wait. shit.,True
Why doesn't jesus play hockey anymore? he kept on getting nailed into the boards.,True
How do jews get around town? on penny boards.,True
What do redditors give one another on christmas? gifs.,True
Why do pigs love halloween? there's lots of hogsgobblin.,True
My grandfather died peacefully and in his sleep but the kids on his bus were screaming.,True
What do you do in the bathroom if you are trying to waste time? stall,True
What do you call wifi in space? mars bars,True
Daughter: i will never learn to spell. mother: why? daughter: the teacher keeps changing the words.,True
Three guys walk into a bar the fourth one ducked.,True
What do you call a rastafarian police officer? jamaican bacon...,True
"What's great about living in japan? well, the flag is spot on!",True
I would settle for life handing me anything citrus right now.,True
Why did the cows cross the road? they wanted to go to the mooo....vies,True
You should not vaccinate your children. get a health care professional to do it.,True
Why are women's feet smaller than men's? so they can stand closer to the sink.,True
"3 doors down: okay, so we've named the band. now what?",True
Why did god make women last? he didn't want someone telling him what to do,True
"If you want something to be misinterpreted, post it on the internet.",True
"What's a jews favorite beer? bud light l'chaim (pronounced like lime, guys)",True
What is worse than bad grammar? pour grammar,True
Why can a number divided by zero never be found in the dictionary? because it's undefined.,True
Why are there no joke about jonestown? the punchlines are too long.,True
Where's spiderman's home page? on the world wide web.,True
Butterfly ass and other smells as told by the dog,True
I was going to make my friend some spaghetti made from milk protein... but sadly he pasta whey.,True
Say literally and legit a few more times in that sentence so i know it's literally legit,True
I'm bad at delivering jokes... the doctor that delivered me was great at it though!,True
Why was six afraid of seven? generations of institutionalized bigotry.,True
How do poor people make it rain? they don't.,True
I'm reading a book about zero gravity i cant put it down,True
What caveman say when he get hurt? meow.,True
How do you think the unthinkable ? with an itheberg. - mike tyson,True
A met a girl with 12 nipples sounds weird. dozen tit?,True
What did the unicyclist say to the bicyclist? i'm bi curious.,True
Just recently sold all my dead batteries free of charge,True
What pablo escobar and other narcos fear most? legalization,True
History teacher: what ended in 1918 ? student: 1917,True
I made a short joke today... it wasn't very funny.,True
There's a new movement against cutting in line. now that's a movement i can get behind!,True
The best joke ever * insert story here * * insert punchline here *,True
I was in a near-sex experience. my wife flashed before my eyes.,True
Why did america remove the u from colour? because fuck u that's why,True
On a scale of casey anthony to jerry sandusky... ...how much do you like kids?,True
What do you call a sober irishman? a liar.,True
How do you clear out an iraqi bingo parlour? call out b-52,True
"What's black, white, and red all over? the bludgeoned face of a bi racial man in 2017 america.",True
True story my dad ate whale in japan but it wasn't on porpoise.,True
"In my defense, it was a fantastic idea at 3am...",True
Two thumbs up! -man with 12 thumbs reviewing a movie he hated,True
Why do flower beds have mulch? so you can't see their underplants.,True
I was kicked out of the army because i got gonorrhea it was a dishonorable discharge,True
Who was the most powerful cat in china ? chairman miaow !,True
Steps to success 1:speak with god 2:??? 3:prophet,True
Why did hitler like his adidas's? they were made by his distant relative.,True
What dogs are best for sending telegrams ? wire haired terriers !!,True
What do you call a hoe that you use to stir a fire. an ash hoe.,True
What do you call it when a lizard can't get it up? a reptile dysfunction,True
Did you know diarrhoea is hereditary? it runs in your jeans.,True
Did you hear about the indian guy who opened up a grocery store? he called i new deli.,True
Put a load in the dishwasher last night she was mad i didn't pull out.,True
What's the best time to visit your chinese dentist? tooth hurty,True
Fox news has determined the cause of the recent plane crash. it was the left wing.,True
One injured in greyhound rollover in texas. but the rest of the puppies are fine.,True
Q. what did one tornado say to the other?  a. let's twist again like we did last summer....,True
If i like my job am i a gruntled employee??,True
Why are there so few female politicians? it's hard to put makeup on two faces.,True
Pacifist i'll pass a fist right through your fuckin' face nigga.,True
How do you make your gf cry during sex? phone her... ;),True
If you didn't get caught did you really do it?,True
Which classical composer is best at playing hide and seek? haydn.,True
What do you call a penis with bad logic? a phallusy.,True
What did the collections person say to the board.. you've been surfed!,True
There are five frogs staring at me right now but only one can be america's top model.,True
How many feminists does it take to screw a vegan? lightbulb.,True
What's the most googled word in mozilla firefox? chrome.,True
Have you ever had african food? neither they have.,True
Someone called me a horse today... i just looked at him and said nay!,True
"*takes out one earbud* not guilty, your honor",True
Why does hiring a ship illegally always cost $3.14? because they're pi rates.,True
I was called a village idiot today which really upset me. i live in a city.,True
Why are orphans bad at baseball? they have no idea where home is.,True
What do you call a woman-hating masseuse? a massage-onist.,True
