text,humor
I think i may be emotionally constipated...i haven't given a crap in days.,True
You can tell the quality of a person by how they treat people they don't need.,True
Why did the baker have stinky hands? he kneaded a poo,True
Happy birthday to me. 27 years old... in spice girl years.,True
What did one fish say to the other during the race? i'm going tilapia!!!,True
What has only one arm and can't swim? an excavator.,True
Facebook status: i caught your boyfriend having internet sex with one of my farmville sheep.,True
What does snoop lion do when he forgets to wear oven mitts? drops it like it's hot.,True
You might be a redditor if you clicked.,True
What did the leper say the the prostitute? keep the tip,True
I'm writing a swiss novel but there's a lot of plot holes.,True
What is an ear of corn's favourite leonardo dicaprio movie? inception,True
Warning: racist i saved a drowning black family once ... ... as a jpg.,True
What's the point of a high school reunion? i have facebook. i already know you got fat,True
What's the hardest thing about rollerblading? telling your parents you're gay.,True
Are birth control pills deductible? only if they don't work.,True
Why did people make white chocolate? so black kids could get dirty faces too.,True
What does snoop dogg use to wash his clothes? bleyotch!,True
"Oprah lost a fortune in the stock market. don't worry, she gained it all back.",True
It makes more sense to dump gatorade on the losing head coach.,True
Understanding women isn't rocket science. rocket science has rules and boundaries.,True
"Now that china has blocked wikipedia, they're considering replacing it with... ... xikipedia!",True
"Chivalry isn't dead. he's just sleeping. right, chivalry? chivalry!?",True
"What do you call an ion that also raps? fluoride, duh.",True
Why are gas giants always so happy? because they're so jovial.,True
I'm no weatherman... but you'll be seeing more than a couple inches tonight. ;),True
Why don't 90 year old women have sex? have you ever tried to open a grilled cheese sandwich?,True
What do you call the illegitimate son of a man with a big face? a cheeky bastard.,True
Be the change you're looking for between the couch cushions.,True
What do you call a door only prostitutes use ? hodor,True
"When my toaster broke, my wife left me. i guess she was lack toast intolerant",True
"What's dj khaled's favorite number? 11, because it has another 1.",True
What mental illness does hank hill have? propanic depression,True
Jesus was born in the middle east... why'd you think he was white?,True
You never realize how much you love sleeping until you have to wake up in the morning.,True
"Time is a great teacher, but unfortunately it kills all its pupils.",True
What is an alcoholic's favorite book? tequila mockingbird,True
Why do writers always feel cold? because they are surrounded by drafts!,True
Punny chemistry what's jerry sandusky's favorite compound? what? a mole ester,True
Don't try to tell me how to use quotation marks.,True
I like when my girlfriend wears a 1 piece the top piece or the bottom piece,True
If there was ever a great name for a male only massage parlor it would be: the massaganist.,True
"Exposed ashley madison users feel hurt & betrayed, unsure if they can ever trust again.",True
Why did the ghost go to the funfair. he wanted to go on the rollerghoster.,True
"Other than the aristocrats, are there any jokes where the telling of it is the joke itself?",True
What do you do when you come across a tiger in the jungle? wipe it off and apologize.,True
My mum says i don't know anything about colourless gases. but ammonia little boy.,True
Premature ejaculation man i need help!! i'm coming!,True
Why are there no owls here? i was lead to believe there would be owls here! #hooters,True
I like my girls like i like my coffee. in a bag in my freezer,True
"The best part of waking up is... nothing. waking up blows. fuck you, folgers.",True
"Autocorrect has been around for centuries, i got mine when i married my wife.",True
Why do jewish guys get circumcised? because jewish women love anything 10 percent off.,True
If my love life was a movie it would be demolition man... ...starring sylvester still-alone.,True
What do you call a man who used to like tractors? an extractor fan!,True
How do you make holy water? you boil the hell out of it. bahaha.,True
What do you call a midget psychic that escapes from prison? a small medium at large,True
What is a dog's favorite camp sport? woofleball,True
What did they call ebola before the internet? bola,True
Eating noodles while studying for a test? that's so ramen.,True
Why are programmers so consumeristic? because they're object oriented.,True
What is the best bang for your buck? vaseline.,True
Really google auto-complete? you really think i want to search for 'hardcore poem'???,True
Why can't you keep jews in jail? they eat lox!,True
"Knock knock. open up the door, its real wit the non-stop, pop pop and stainless steel!",True
"What's the difference between a fence and a wall? i give them a wall, and they take offense.",True
There's literally no way to know how many chameleons are in your house,True
The real winner in the mayweather pacquiao fight.? the bookmakers,True
I know a great knock knock joke. you start.,True
The sweater you left is in the closet. just like you.,True
I thought kegels were like jewish bagels...boy was i wrong,True
Snowflakes are like vaginas... each one unique... and i like them on my tongue..,True
Why can't you have christmas dinner in the eu? because there is no turkey,True
How do bees get to school ? by school buzz !,True
I added michael j fox as a friend on instagram... he likes every single one of my photos.,True
I had a viagra addiction... and it was the hardest time of my life.,True
What did victoria say to vancouver? i'll bc-ing you later.,True
What's the difference between a porcupine and a ferrari? the porcupine has pricks on the outside.,True
"Today i learned to count in taiwanese... taiwan, taitwo, taithree!",True
Putting a ring on a woman's finger... is like pulling the ripcord on an inflatable raft.,True
What's the most dangerous animal in alaska? sarah palin,True
Why is sae not that racist? because some of their best friends are black... for halloween!,True
What's the difference between a pick pocket and a peeping tom? a pick pocket snatches watches.,True
What do you call a sexually-confused arctic circle? bi-polar,True
What does pingu say when he feels suicidal? noose noose,True
Ted cruz just looks like a... saturday night live skit,True
What's the difference between sand and menstrual blood? you can't gargle sand.,True
Interview joke interviewer: why should we hire you interviewee: coz you are hiring :),True
Are you a termite? cause you're about to have a mouth full of wood.,True
Why must rabbits never miss dinner? with out their tea they'd be rabbis.,True
"I'm hosting a benefit for people who struggle, to reach orgasm. let me know if you can't come",True
What does a hippie say when he runs out of weed? this music sucks!,True
What do you call toddlers who are dictators? dictator tots,True
Why didn't the lifeguard save the hippy? he was too far out man!,True
What do you call children who are afraid of santa ? they are clausaphobic,True
I wanted to be a feminist for halloween... ...but a fat suit is out of my budget.,True
Why do black people wear flares? because their knee grows,True
I met a girl with 12 nipples today! sounds fun.. dozen tit,True
Why is 9 afraid of 7? because 7 ate a bunch of pcp and is going apeshit!,True
"What do pedophiles and mcdonalds have in common? they are both bad for kids, but *i'm lovin it!*",True
