text,humor
"What happened when justin bieber went to michael jackson's house? nothing, michael liked boys.",True
How do you kill a one-legged fox? tell it to run across canada ;) boom! too soon?,True
Why don't pc gamers get laid because they're micro-soft,True
Why do all black men have nightmares? the one with a dream was shot.,True
"If you had a choice between world piece and a million dollars, what color ferrari would you buy?",True
Feel free to use the or less feature of your 140 characters.,True
How many tickles does it take to make an octopus laugh? ten,True
What is lil wayne's favorite food? caesar salad,True
Why did the farmer cross the road? he was fucking the chicken.,True
What song title defines a redditor's love life? left hand free by alt-j,True
What do you call a black pilot? you call him a pilot! you racist!,True
Why are girls so hot? because they lay out in the sun so much lol :p,True
What did the shy pebble wish for? only that he could be a little boulder!,True
Why did the scarecrow earn an achievement award? he was outstanding in his field,True
Who's driving? a mexican and black guy are in a car. who's driving? answer: the police officer,True
What did the blind paraplegic get for christmas? cancer.,True
Open mike night sounded like a lot of fun until i realised i'd been invited to an autopsy.,True
"Before taking viagra, ask your doctor if your heart is healthy enough for sex. riiight.",True
There were two peanuts walking down a dark alley one was assaulted.,True
What did the skunk say at church? let us spray,True
What do you call three pokemon nerds having a circle jerk. dugtrio,True
If there's one thing i'm better at than everyone else... it's humility.,True
Victims of successfull murder attempts: whats your story? serious replies only.,True
What's the cheapest cut of meat? deer nuts: they're under a buck.,True
Why was the fruit really upset he had to get married in a big church?  because he cantaloupe.,True
Why can't you keep a jew in jail? they eat lox...,True
So a blind man walks into a bar. no one warned him.,True
Why would no one listen to the percussion section? because they couldn't drum up enough support.,True
Why do jamaican philosophers shit together? because they discuss tings.,True
"Don't feel sad, don't feel blue, frankenstein was ugly too.",True
Q: what do you call a blonde in a tree with a brief case? a: branch manager.,True
A brazilian got the first gold medal the police are already after him.,True
Why is microsoft going straight to windows 10? because 7.. 8.. 9,True
You haven't experienced awkward until you try to tickle someone who isn't ticklish.,True
What's obama's favorite game console? the xbox one,True
Its so cold in massachusetts i just seen a democrat with his hands in his own pockets! ;),True
"You are what you eat thats funny, i don't remember eating a pathetic failure",True
Why did the man cross the road? because his dick was stuck in the chicken.,True
The c in closed is open... but the o in open is closed,True
A fat person doesn't eat what's right but eats what's left.,True
"What do you call people who aren't christian? light, because they're massless.",True
New drugs? look them up on trip advisor!!,True
He stuck it in the wrong whole http://imgur.com/v7qxo87,True
This dollar store thesaurus sure is coming in... *shuffle shuffle* ...hippopotamus.,True
"What does vlads wife say about his premature ejaculation? just putin, don't russian",True
How about like a tye dye chicken who screams actual words at you,True
My doctor said if i get 1000 upvotes he will perform free lasik surgery! upvote for visibility.,True
I like my women like i like my student debt always there and constantly fucking me,True
What do you call fake german currency? question marks,True
What do you call a snake that works in the government? a civil serpent,True
Let the bodies hit the floor was originally written as chuck norris' theme song.,True
Never vote for a tunnel-digging politician because he's probably just another burrowcrat.,True
What kinds of jokes do cats play on each other? purranks.,True
Why are there no knock knock jokes about america? because freedom rings!,True
A hooker has sex with a leper... he said keep the tip.,True
What did the really ugly man do for a living?  he posed for halloween masks.,True
Why are men smarter during sex? because they're usually plugged into a know-it-all.,True
Who are the fastest readers in the world? 9/11 victims. they went through 87 stories in 11 seconds.,True
Who do you call when theres a fly in your house? the swat team,True
Did you hear about the cat that wanted to be a justice on the supreme court? just kitten.,True
Slept like a log last night woke up in the fireplace.,True
In know what comes after i... just kidding!,True
Why wouldn't the pimp water his lawn? he couldn't trust his hose.,True
What does the ll in ll cool j stand for? lickin lips,True
Q. who is the greatest babysitter mentioned in the bible? a. david. he rocked goliath to sleep.,True
A cheese factory just exploded... there was de-brie everywhere,True
Nobody in this neighborhood ever got along until we all hated your rooster.,True
Why did peter parker get fired? he spent all day on the web.,True
Q: what do you get when you cross a ghost and a the letter k? a: a book.,True
Why can't you hear a pterodactyl urinate? because of its silent p.,True
I am the big shot at my new job. i am the human cannonball at the circus.,True
"What do you call a dog with no legs? don't bother, he's not coming.",True
Before we got married i caught her in my arms. now i catch her in my pockets.,True
I'll keep my women like flo jo... ....dead,True
"Snooki, but without the orange tan and poofy hair. and she's in charge of north korea.",True
"So a priest, a pedophile and rapist walk into a bar ...he orders a drink",True
Don't move leaves without their permission... that's rake.,True
What do you call the science of knives? cutting edge technology.,True
"My head is throbbing, maybe i have amnesia nah, i don't remember hitting my head",True
"What do you call something that is big, red, and sucks cock? a big red cocksucker.",True
What did the astronaut say to his girlfriend when he broke up with her? i need some space.,True
How do you escape from a jewish cop? you take the toll road.,True
In beantown for the night. i expected more burritos.,True
Today i almost fucked up by finishing with a bad bunch line whoops-,True
Christianity: one woman's lie about having an affair that got seriously out of hand.,True
"Son, you're good with computers i'm alright how do i find pictures of mean looking dinosaurs?",True
What did moses say when he wanted to see through his door? let my peephole grow!,True
How many cops does it take to change a lightbulb none.they just beat the room for being black.,True
I used to be a phone sex worker... until i got hearing aids.,True
How do a neckbeard's cells divide? by m'tosis,True
I never really wear camouflage. it's just something that i can never see myself wearing.,True
I would make a terrible buddhist because i kill a lot of ants and drifters,True
How do you tell the difference between an oral thermometer and a rectal thermometer? the taste.,True
What is a burp? a fart taking the elevator.,True
What's the similarity of the world series and lorde? they'll never be royals,True
What did olive oyl say to popeye on their wedding night? no fisting.,True
Why are there no casinos in africa? there are too many cheetahs.,True
What do you call a dog with a great sense of humor? a chihuahahaha.,True
Anybody have some good summer reads for me that...oh wait. nevermind. found my phone,True
I got all my coworkers condoms and bibles for valentines day because i'm praying they get laid,True
