text,humor
What's a polar bear's favourite soup? a laksa.,True
What do you call batman when he skips church? christian bail.,True
Why don't good golfers cheat? cause they play the fairway.,True
Why didn't the ghost have any children? because he had a halloweenie!,True
Why are ethiopians so good at blowjobs? because they have to swallow everything they can,True
"As an artist, i'm not comfortable drawing people's butts. you gotta draw the line somewhere..",True
Why were there coffe beans at the subway station? because they were under-ground.,True
Why was the burger thrown out of the army? he couldn't pass mustard! (muster),True
My grandfather invented the cold air balloon it never really took off.,True
When is the closest leo will get to an oscar? when he takes out the trash,True
What do you call fake spaghetti? an impasta!,True
"If you think nobody cares whether you're alive, try missing a couple of payments.",True
What do you call a person who fights fire? firefighter.,True
Packing do gays really have a lot of s**t to pack before moving?,True
Why did the mexican take xanax? to control hispanic attacks,True
A mean mathematician is just an average guy.,True
Noticed lots of older people reading the bible. it's like they are cramming for their final exam.,True
I've given up masturbation for a week i'm just not feeling myself anymore.,True
What's the difference between and egg and a wank? you can beat an egg.,True
How does rex reclaim make his music? he composts it,True
What do you get when a deaf guy tries to talk to you at a urinal? wet,True
"Have you ever tasted african food? don't worry if you haven't, neither have they",True
"What did mitt romney say to c3p0? threepio, hand me those binders, willya?",True
I was playing guitar and someone asked if i could play wonderwall ...i said maybe..,True
"I've got a terrible addiction, i can't stop eating deli meats. i'm trying to quit cold turkey.",True
What is a wolf's favourite dance move? the shuffle ... pack of wolves.,True
My girlfriend is so crazy she even traced down the girl who once kissed me in kindergarten.,True
What do mathematicians say when they encounter a difficult problem? f(x),True
Accounting joke: what do you call inventory that doesn't exist? finnish goods,True
Why did the cow cross the road to get to the udder side,True
I thought i liked spheres then i realized they're pointless.,True
"How do you fit 1000 jews in a volkswagen? 2 in the front, the rest in the ashtray",True
"The next president of the united states of america, donald trump.",True
In russia i like my coffee the way i like my women...,True
What do you call a mexican super saiyan? fajita,True
Why did the man wear a diaper to the bar? so he could save his stool.,True
What did the rastafarian say to his lady friend? jamaican me crazy!!,True
How many feminists does it take to change a light bulb? ****,True
What do you call a person who hates fat people? weighcist,True
What can you hear but never see? everything if you're stevie wonder,True
"What does a jamaican do when he sees a spaceman? he parks his car, man.",True
"I could be way funnier with like, 143 characters to work with.",True
That was supposed to be a compliment. -men,True
Why did my exotic bird startup store fail? i didn't have enough seed money.,True
How attractive are skeletons? they're drop dead gorgeous!,True
Redditors of north korea: what's your opinion on the recent sony hack?,True
Whats the difference between in-laws and outlaws? outlaws are wanted,True
I like my women how i like my jokes funny :),True
It's ok. this is normal for her. - how my friends explain me to others.,True
I just hate when these girls take selfies on road specially when i am peeing in the background.,True
What's the difference between parsley and pussy? nobody eats parsley.,True
"What goes cluck, cluck, cluck, boom? a chicken stepping on a landmine.",True
Why did god put men on the earth? becuase a vibrator can't mow the lawn.,True
What percentage of the zombies are just chasing you down to tell you they're vegan?,True
Hey hot single dads; i wanna call you daddy too.,True
You can't spell a.d.d. without hey what is that is that some go-gurt,True
Why is it nasa has never sent a woman to the moon? it don't need cleaning!,True
Simple math problem how does one become a .666 humorist? http://i.imgur.com/dvvbs15.png,True
You know why midget performers attract customers? they remind them that life is short,True
You know why some people simply don't have a butt? because they are on a gluten free diet.,True
What's the best part about bangin' twenty six year olds? you get to meet jared fogel.,True
How does a pirate tip his hat? m'hearty,True
Whats long and black and hard to cut into? the line at kfc,True
What do australians call upside down cake? cake.,True
"What did oliver twist say at the slave auction? please sir, i want some moors.",True
My doctor told me i have type-a blood. apparently it was a type-o!,True
Sausage jokes are bad... but german sausage jokes are the wurst,True
I'm doing asbestos i can.. dealing with mesothelioma.,True
"Mommy, mommy can i lick the bowl out? noooo...just flush the toilet like a normal person......",True
"How do you catch a politician? with a special interest group, or evidence of a sex scandal.",True
Who else wakes up in the morning and checks their facebook like its the morning newspaper??,True
What did the host serve his guests for the simpsons marathon night? disco stew!,True
Why does a squirrel swim on its back? to keep its nuts dry.,True
What do you call a gay man milking a cow? a dairy queen.,True
I skipped 9 puns and killed the last one... that's a pun in ten dead.,True
"Have you heard about the new movie, constipation? it hasn't come out yet.",True
Where can you find a dog with no legs? right where you left him.,True
At first i didn't like my new haircut but it's starting to grow on me,True
Why does dr. pepper come in cans? he's a strange dude.,True
Why did the condom fly across the room? he was pissed off!,True
What does a baby diaper and obama have in common? there both full of shit.,True
I have never met a farmer that isn't pro tractor,True
Where do the chinese study? in the pupils republic of china,True
Two people commited a crime while having intercourse its said to have been an inside job,True
"If i'm guilty of anything it's that i care too much, that and murder",True
1. ice *check* 2. ice *check* 3. baby *calls 911* - freezer inspector -,True
'you look fat' is both an ice-breaker and a bone-breaker,True
My autobiography would just be a really long taco bell receipt.,True
I always get nervous before injections so i shut my eyes. i usually end up stabbing the chair.,True
"I came into some wealth recently, but it turns out my bank doesn't accept that kind of deposit.",True
"What kind of sex do you have twentyseven year olds? any kind you want, there's twenty of them",True
If i had a dollar everytime i saw a hipster... i'd have an obscure amount,True
What is a tree's favorite drink? root beer,True
Hell yeah i'm a catholic i've been addicted to cats my whole life,True
Why does nobody like the element bi? because he's all up in your bismuth.,True
I once dated a midget... i was nuts over her,True
My friend gets an erection whenever he sees chickpeas... he's a hummussexual.,True
Be nice to a nerd. prevent a supervillain.,True
That new vet really screwed up my pig's colonoscopy he's pretty ham-fisted,True
Women's rights. want to laf again? **womyns rites!!!** el oh el,True
