text,humor
Movies you wish tom cruise would star in: remission impossible,True
"Did you hear about the new canadian pornographic news network? i'll jizz here, eh?",True
What does the ninja call his penis? meningococcal,True
If you want to pick up girls ....keep your back straight and lift with your knees,True
What do you call a lamppost in niger? progress.,True
"Why don't kleptomaniacs ever get puns? the take everything, literally.",True
Me: you're going to disagree with this statement. wife: no i'm not.,True
Yeah i can take a hint. i'm not going to though.,True
Native americans watch the movie 1492 backwards because they want to see a happy ending.,True
"A lot of people cry when chopping onions, but the trick.. ..is to not get emotionally attached.",True
How does carrot top have sex? gingerly. *(source: the late late show with craig ferguson)*,True
What's white on bottom and black on top? rape.,True
"If i had a dollar for everytime i unnecessarily sexualize a sentence, i'd have 69 dollars.",True
How do hens encourage their football teams? they egg them on!,True
What do you call a blowjob from a short person? a low blow,True
How did michael jackson get food poisoning? he ate a 10 year old wiener.,True
"If you really want people to notice you, be a typo.",True
"Don't make this weird... (i whisper in your ear, as i pet your eyebrows)",True
When you get a brain freeze from a margarita you know you have problems,True
I could tell it was a monopoly board from the word go,True
What is the difference between a tea bag and england? tea bag stays in the cup,True
"What did the mexican say with one sleeve rolled up and one sleeve not? not even, homes",True
"What did adam say the day before christmas? it's christmas, eve!",True
Where did mary go during the bombing? everywhere,True
"Did you hear about the fat absent father? he was never around, but at least he was portly.",True
2 guys walk into a bar... ... the third one ducks.,True
Offensive jokes? is there a subreddit for this?,True
When is a door not a door? when its ajar.,True
What hired killer never goes to jail? the exterminator.,True
Never buy a used dream catcher from the flea market near a mental hospital.,True
I told my friend she drew her eyebrows on too high she seemed surprised.,True
I used to love the village people until they came at me with torches. -gay frankenstein,True
The best halloween costume of the year goes too... bruce jenner!,True
I think my chemistry teacher is anti-semetic he asked me to find the ph of the final solution.,True
What is blue and smells like red paint? blue paint,True
What do you call an assault which is both positive and negative? a battery.,True
At first i thought this subreddit was beating a dead horse. but it had only fainted.,True
How do pirates agree with each other over long distances? with their aye-phones.,True
My cat just told me to stop talking during the movie. maybe homemade psychedelics were a bad idea,True
Which country will be the first to change to all electric vehicles? madagascar,True
"What's the tallest building? a library, because it has so many stories.",True
Did you hear about the unnecessarily large string orchestra? it was shut down due to mass violins,True
What do you call an english rock band that is high? the rolling stoned!,True
Christmas is shit. whoever invented it should be nailed to a cross.,True
What part of the body does a woman never move while dancing her bowels,True
Why won't a bike stand up by itself? it's two tired.,True
What four man rock group doesn't sing? mount rushmore,True
What's the difference between jam and marmalade? you can't marmalade your cock up a girl's arse,True
What does a nosy pepper do? gets jalapeno business!,True
Thank god lent is over.... not using condoms was definitely getting nerve-wracking.,True
Could you kill a monster just by throwing eggs at him? of course - he'd be eggs-terminated.,True
It ain't the jeans that make your butt look fat.,True
Why shouldn't you get asylum in russia? cuz you'd be snowed-in,True
"Tifu in math class by saying 'subduct' instead of 'subtract' whoops, wrong sub",True
Say hello to my little friend *holds up a cat*,True
"Mirror, mirror on the wall, was the dwarfs' mother high when she named them all?",True
"I got the early bird special at denny's. don't do it, these worms taste like shit.",True
Is google a woman? i can't even finish a sentence without it coming up with other suggestions.,True
What do you call a self proclaimed straight woman? a liar,True
It's all shits and giggles until........ someone giggles and shits,True
You gotta hand it to the blind prostitute. .. ...,True
Why did the irishman wear two condoms? to be sure to be sure,True
What happens in vegas will most likely cost you a fortune in dry cleaning.,True
I wish i was important enough for my nudes to get leaked.,True
What do hookers and guns have in common? the customer wants the most bang for their buck.,True
What do you call a bra designed for neutrois? ze-bra,True
What do you call an ex-muslim? a waslim,True
What did the terminator say when he decided to take up piano? i'll be bach.,True
How come computers are soo smart? it is because they listen to their motherboard.,True
Whitney houston may not have had the last word! but i know she had the last line!!,True
What does r/jokes have in common with amy schumer most of these joke aren't original.,True
Where do ghosts live? at the dead end.,True
*beats arachnophobia* *trips over child dressed as spider-man* *fears spiders again*,True
I wrote a book about homeopathy.... i named it 1001 uses of alcohol.,True
He died doing what he loved; getting stabbed to death in a tj maxx.,True
Why is nascar so popular in the southern states? because that's where the most racists are.,True
Why did the blonde tip-toe past the medicine cabinet? she didn't want to wake the sleeping tablets!,True
What cheese does a piano princess eat? mozart-rella!,True
I'm eating this banana sideways so my husband doesn't get the wrong idea.,True
Why can't people with alzheimer's tell a joke?,True
Halloween is a great time for comedy because skeleton jokes are always humerus,True
How do you find the click bait audience?,True
Why is it difficult to pan for gold in somalia? because pyrites arrrrrr everywhere,True
Have homeless dudes tried just running a comb through their hair?,True
"Damn girl, are you life alert? cause you just called the cops.",True
My doctor prescribed me viagra and ex-lax today. now i don't know if i'm coming or going.,True
"Ever seen an elephant hiding in a cherry tree? no? well, they must be hiding pretty good",True
What did one german wheat farmer say to the other german wheat farmer? gluten tag,True
I was going to join the debating team... ...but someone talked me out of it.,True
At what point does cpr become necrophilia? when you're both stiff,True
Who plays center forward for the vampire  football team? the ghoulscorer.,True
Q: how do you make a blonde's eyes twinkle? a: shine a flashlight in their ear.,True
"Baby, you remind me of a perennial... cause you always make me come more than once.",True
You know what they call alternative facts that are true? facts.,True
Where do you find a turtle with no legs? right where you left it.,True
"Why were episodes 4, 5, 6 made before 1, 2, 3? because in charge yoda was.",True
I like to stop drinking somewhere between watch this and ohhhhhh shit.,True
Really?! why?! - my reaction to meeting a white guy named andre,True
Apparently typos only become visible to the human eye after you hit send.,True
How many light bulbs does it take to change people?,True
