text,humor
Plan ahead - it wasn't raining when noah built the ark.,True
Where do animals go when their tails falls off? the retail store,True
Dear sir / madam... your transgender operation was a partial success.,True
Why does snoop dogg carry an umbrella with him everywhere? fa drizzle,True
Why did the astronaut break up with his girlfriend? he needed space.,True
My girlfriend just walked in and called me g@y. if my nails weren't drying i swear to god...,True
"You know reddit, yall like school in the summertime... no class.",True
Why does donald trump watch the olympics? to see how high mexicans can jump,True
Why doesn't spiderman like rice? it reminds him of uncle ben.,True
Imagine how much money you could save on vitamins by dying.,True
Why couldn't the ghostbusters ever finish oregon trail? because they couldn't cross the streams.,True
Why can't scat be legally banned? i could've gone my whole life without seeing that shit.,True
"Dad always said, never get on one knee for a girl... ...who won't get on both for you.",True
What animal would you most like to be on a cold day? a little otter,True
Secret: something which is told to one person at a time.,True
So a man walks into a... all you just got to do is finish it.,True
Why was the socialist kicked from his party? because he was anti social.,True
What do you get when you enter a cow into the kentucky derby? milk and bookies.,True
My middle finger will be answering all questions today!,True
Whats the difference between a woman and a battery a battery has a positive side,True
They say masturbation makes you blind.... i don't see any problem with it.,True
Missed connection: she wanted classy and i thought she said gassy...,True
"I just ran out of tissues... lately, it's been coming in handy",True
What do you call a greek with a spanking fetish? spanakopita,True
There are three things i hate... * reposts * bullet lists * irony,True
A selfie stick is very useful..... .. as a prod to keep people out of your personal space.,True
Wanna hear a pizza joke? ....nevermind its too cheesy,True
What do you call a fruit that argues against the position it supports? the devil's advocado.,True
Very offensive man on the loose with flint and steel sparks outrage,True
The japanese flag is actually just a pie chart.. ..about how many of them are scared of godzilla.,True
"I see, said the blind man, pissing into the wind. it's all coming back to me now.",True
What do you call 2000 mockingbirds? two kilomockingbirds (credit goes to my old physics book),True
My noisy upstairs neighbour reminds me of that person i killed next week.,True
Bbq joint offers the betty ford special half a rack with extra sauce,True
I'm bored. if i were a man i would be scratching my balls right now.,True
What is a businessman's favorite game? call of duty: economic warfare,True
"Lately, there are a lot of leftists... ...who all think they're right.",True
Friends with an ex? i don't even want to be friends with my friends.,True
"Never go to a place that has burgers, sushi, chicken wings and donuts on one menu. never.",True
How do you know if your wine was made in the 90's? it smells like teen spirit.,True
Why is it faster to download midget porn? the files are always smaller.,True
What kind of tie is best to wear in a fight? muay thai,True
When do rabbits have buck teeth? when their parents won't get them braces.,True
I had a friend from ukraine. now he's from russia.,True
I called a suicide hotline today... they do not give the kind of advice i was looking for.,True
How did the burger king get the dairy queen pregnant? he forgot to wrap his whopper.,True
"My boyfriend isn't allowed to go to the zoo without me, he might see all his ex's there...",True
What does trump call his immigration plan? order 66.,True
I had anal sex and my sperm were so confused they tried to fertilize a piece of corn.,True
What do you call a mexican who loss his car? carlos,True
Why did the rabbi stop buying beer? hebrewed his own,True
There are plenty of fish in the sea. sometimes you just need a really big fishing rod.,True
What's the similarity between free healthcare and good jokes? americans don't get them.,True
What are mario's overalls made of? denim denim denim (pronounced with the mario underground theme),True
"If you don't come to my funeral, then i won't go.",True
"The fast food restaurant for babies. welcome to gerber king, may i take your order?",True
What's the difference between a feminist and a vagina? nothing. they are both cunts!,True
"Iron man joke iron man is a super hero. iron, woman. is a command.",True
What do you get if you walk under a cow? a pat on the head.,True
"I drink twice a year.... when it's my birthday, and when it isn't",True
What is the summit of trust? receiving a blowjob from a cannibal,True
Why did the premature ejaculator cross the ro... never mind.,True
"If it hurts you more than it hurts them, you're probably holding the taser wrong.",True
Why was hitler born on 4/20? his mom wanted him to blaze it,True
Why did jesus take 3 days to resurrect? he got hammered with his buddies.,True
What did the physicist say to the suicidal guy on the bridge? don't do it! you have potential!,True
"What's the difference between a lambo and 1,000 dead babies? i dont have a lambo in my garage...",True
I married miss right. i just didn't know her first name was always.,True
If i ever go to prison i will immediately go up to the biggest person and tickle them.,True
Why is the angel of death so socially awkward? because he sucks at life.,True
"What did santa give the blind, autistic, paraplegic kid with down syndrome for christmas? cancer.",True
"My right ear keeps ringing today. it's the left ear that means your gay, right?",True
How did pinocchio realize he was made of wood? his hand caught on fire.,True
"Man, helen keller would have been fun to party with. she's always blacked out.",True
"No one spoil the ending, i haven't finished the itunes user agreement yet!!",True
What's long and hard and full of semen? a submarine.,True
What do chinese bears use to cook? a pan. duh!,True
How do librarians file melted marshmallows? according to the gooey decimal system.,True
What does a cannibal do after dumping his girlfriend? he wipes his butt,True
How does an abstract artist paint? they wipe their ass with canvas.,True
"What did one sea say to the other sea? nothing, they just waved.",True
Did you here about that original joke? neither did i.,True
What's the difference between ronald reagan and donald trump? reagan helped tear down a wall.,True
Why aren't elephants allowed on the beach?... because they always blow their trunks off!,True
Who's the most badass flower salesman? chuck florist,True
What 6 inches goes to your mouth? toothbrush...you dirty bastard,True
Did you know kurt cobain had dandruff? they found his head &amp; shoulders behind the couch.,True
What did palpatine order in the drive thru? friiiiiiies,True
Why did jesus quit playing hockey? he kept getting nailed to the boards.,True
"I'll never forget my grandfather's last words stop shaking the ladder, you little bastard!",True
With all the negativity in the world today... ...at least charlie sheen is staying positive.,True
In a parallel universe calories are trying to burn people.,True
You want to hear a paper pun? it's tearable.,True
What's the absolute worst city to live in? an atrocity.,True
Everything always ends well. if not  it's probably not the end.,True
"How do you get a dog to stop licking his balls?, pick it up and suck its dick.",True
Did you know diarrhea is hereditary? it runs in your jeans. ba dum tss.,True
What's the hardest part of skydiving? the ground!,True
What did the hammerhead shark say to his buddies when he got laid? nailed it.,True
A frendly reminder! you will live to see man-made horrors beyond your comprehension. nikola tesla,True
