text,humor
What's the difference between a paddling pool and a swimming pool? deep ends really.,True
"How many mens' rights activists does out take to change a lightbulb? well, not all of them.",True
What stopped winter from coming? winterfell and it can't get up.,True
"For an extra $20, you can purchase a mountain bike instead of a kia.",True
Whoa. whoa. whoa whoa whoa whoa whoa. whoa. whoa. whoa. whoa! whoooooooooa! this horse is an idiot.,True
What is the best joke you have heard? any best joke,True
I saw a ufo yesterday. so i quickly grabbed the worst camera i own to film it with.,True
"Donald trump trump never uses the washroom, ..... that's why he's so full of shit!",True
A fish swimming upriver and bumps his head. dam he says.,True
What do you call a pig with the flu? a swine swine.,True
She asked me to go deeper so i started quoting nietzsche,True
Whats the worse part of being a pedophile? trying to fit in.,True
Why does heisenberg hate driving? he gets lost every time he checks the speedometer.,True
Why did the astronomer break up with his girlfriend? he just needed some space.,True
"Oh, you don't like my lego jokes? blocked haha, get it?! *retires*",True
A person automatically becomes ten times more attractive when you find out they like you!!!,True
How did mark zuckerberg meet miley cyrus? social net twerking,True
What do you call a castrated german? a munich,True
Live debate - where is the china counter? someone must be doing this :),True
"What's the best part about switzerland? i don't know, but their flag's a plus.",True
Earlier today i had a titanic thought. it was *unthinkable*.,True
Having kids has taught me that their ears are for decorative purposes only.,True
Real men don't cry...tears for real men are only unnecessary liquids in the body.,True
What do an eagle and a broom have in common? they both fly but the broom doesn't.,True
You should never use the word nutsacky when describing how a newborn baby feels.,True
What do you get when you throw a piano down a mineshaft? a flat minor,True
How do generals show their gratitude to their troops? they give tanks.,True
Can't live without your coffee? tweet about it!,True
What does a dyslexic agnostic wonder about? is there a dog?,True
*jerks off to a picture of a good personality*,True
How long does it take for a white women to take a shit? 9 months,True
Why are jews and the amish so similar? neither like cooking with gas.,True
Half of men in america watch porn everyday. the other half are liars.,True
How do chemists get high? they drop acid of course,True
"Grammar. the difference between feeling your nuts, and feeling you're nuts.",True
What do you get when you cross the russian mafia and the yakuza? killed.,True
I just made the greatest construction-related pun of all time works on so many levels,True
Why does a pterodactyl always urinate on the side of the bowl? because the pee is silent.,True
Why did the bread machine go to see a therapist? it was too self-loafing.,True
I just flew in from chernobyl and boy are my arms legs.,True
"On this day eleven years ago, greece won euro 2004. today, greece would be happy with 2004 euros.",True
What do people in prague call abortions? canceled czechs,True
Just went to an emotional wedding even the cake was in tiers.,True
What is green and oblong? a well disguised orange!,True
What's the most dangerous possession a gun nut will ever own? his car.,True
Give me the best quality tv commercial i can get for $57! -every attorney apparently,True
Who put semen in the basement? i don't know. that's just the way it's spelled.,True
Brother: did you put the cat out ? sister: why is it on fire ?,True
Have you heard about the south korean subreddit? apparently it's the /r/seoul of reddit.,True
I need to borrow some cheese can i get a provolone?,True
I have a taiwanese friend who is is incredibly rude and bossy he has a strong taipei personality,True
Doctor: you have bronchitis me: omg i've always wanted a dinosaur!what do i feed it?,True
Fight fire with fire! - motto of my town's least successful volunteer fire company,True
*doesnt stand for national anthem as protest against people who don't stand for national anthem*,True
What is yellow and cant swim? an excavator. why? it only has one arm.,True
Malaysia airlines loses contact with another plane. at least they know where this one is.,True
What do you call a north korean gorilla? king kong un (from my younger brother).,True
Q: why do so many fishermen own banjos? a: they make great anchors!,True
What kind of music do they play at stonehenge? hard rock.,True
Just because nobody complains doesn't mean all parachutes are perfect.,True
A feminist is someone i could really get behind.,True
My mother taught me about reverse osmosis. shut your mouth and eat your dinner.,True
Why should rihanna date the edmonton oilers? because they don't beat anybody.,True
"Found this great joke in the latest serious askreddit thread, thought you guys might like it",True
What's the difference between jelly and jam? you can't jelly your dick into an asshole...,True
Where do trees keep their money? in branch banks.,True
Why are the whores in the docks never hungry? there are so much seamen there.,True
"So, i hear islam is the religion of peace. piece of you here, piece of you there.",True
My friend begged me to stop playing wonderwall i said maybe.,True
"I picked up a jewish girl today, wanna know how? with a dustpan.",True
"My wife asked me: what's the most risky, dangerous food you've ever eaten. me: wedding cake.",True
What do you call oral sex with a fresh corpse? a david blowie.,True
Friend: you'll find love again. me: stop threatening me,True
"What do you call a smiling, sober, courteous person at a bar association convention? the caterer.",True
Why did the mother feed her newborn lamb? because it's baby food.,True
What do you call a german jerk? deutschebag,True
Why don't blind people go skydiving? because it would scare the shit out of the dog.,True
What do you call a very cold vodka? absolut zero,True
You know what they say about beetroot. you can beat an egg but you can't beet a root.,True
I've never met an air conditioned room i did not like.,True
What's the difference between crime and cybercrime? at the moment this joke.,True
Deja vu is just god fixing a typo and reposting.,True
Why is there a wolf in the smoke shop? he's just looking for a pack.,True
How do three gay guys sit on a stool? flip it upside down.,True
Today some boiled water died.. it shall be mist,True
"I heard that the president was poisoned, then cured. but the information is purely antidotal.",True
What is common between my ex-wife and my last job? they don't suck anymore.,True
What brand of vodka does a canadian drink? grey moose,True
Two competitive silk worms decided to race... ...it ended in a tie.,True
Two prime numbers stayed married for life. they couldn't be divided,True
Just heard on the news about the 1993 luggage murder. apparently the police are reopening the case,True
"Did you hear about the kidnapping at the local school? it's okay, he woke up.",True
"The safest place to stand when i hit a golf ball, is directly in front of me..",True
"Yes, neil, everything sounds better when you have a great voice. that's how sound works.",True
Why couldn't the pirate learn the alphabet? because he was always lost at c.,True
*checks watch* *gets up off toilet* i don't have time for this shit,True
Q: what did the tire say to the tire? a: i'm tired!,True
What band performed at the jefferson memorial? nickelback,True
A man tried to keep two crows illegally as pets! he was arrested for attempted murder.,True
It turns out flasher wasn't one of the reindeer and i'm being asked to leave this holiday party.,True
