text,humor
"I think at this point, a pterodactyl egg has better odds of getting laid than i do.",True
While the worker was talking about computer parts he made my motherboard,True
I lost 100 pounds. getting mugged in europe.,True
"When i was 15 i was raising a tamogochi, not a baby.",True
If i were a dog would you help me bury my bone?,True
Why did the chicken cross the road? to watch the mason lay a brick.,True
Butler i've got a friend who has got a butler whose left arm is missing  serves him right.,True
Do you know why every new bride smiles? because she just gave her last blow job.,True
"Hey, i lost my teddy bear. would you sleep with me?",True
"What happens when you cross a grown kitten, a donkey, and a champion? a cat-ass-trophy.",True
*empties an ice cube tray in the arctic* you're free now.,True
How do it technicians prefer to be paid? cache in hand.,True
Your costco id photo shows you what you'd look like if you were a meth addict.,True
You know that amazing feeling you get after kissing a woman? of course you don't.,True
Cubs fans last night looked more distraught than patrick kane's last blind date.,True
Why can't men get mad cow disease? because all men are pigs.,True
"I like my men like i like my neutron stars hot, dense, and degenerate.",True
Q: what do you call a frog with no hind legs? a: unhoppy!!,True
Latte is latin for: you paid too much for that coffee.,True
So i heard tiger woods changed his name.. to cheetah,True
Officer: you've been identified as the runner who.. me: let me stop you right there.,True
If pronouncing my b's as v's makes me sound russian... then soviet,True
"This christmas, i got a new car for my wife i thought it was a great trade.",True
"Baltimore, eat a snickers. you turn into ferguson when you're hungry.",True
"What did the janitor say when he jumped out of the closet? supplies!, i'm gay.",True
What happens when you throw a green stone into the red sea? it gets wet.,True
Greek cheese turns me on. it is a feta-ish.,True
What's the worst thing about jonestown jokes? the punch line.,True
What do you call an ugly spanish chemist? iron oxide,True
How do you circumsize an alabama man? kick his sister in the chin.,True
How do you stop a mexican tank? shoot the people pushing it.,True
I always say no to drugs... but they never listen.,True
"How many borg does it take to screw in a light bulb? irrelevant, you will be assimilated!",True
If i got 50p for every time i failed a maths test i'd have about 6.30 by now,True
"Woman across from me will not shut up about her where she works. ugh, i hate job interviews.",True
Ever hear about the mexican train killer? i heard he had locomotives.,True
I made six figures last year. - extremely lazy g.i. joe employee.,True
What should you do if you get an erection on the subway? get off at the next stop!,True
What do you get when you mix a shih tzu and a bull b.s.,True
"Hey, did you hear about that coldplay concert in china? it was all yellow.",True
What's the difference between a pregnant woman and a light bulb? you can unscrew the light bulb.,True
"What do you call a little mexican? a paragraph, because he's not quite an essay.",True
What did cinderella do when she got to the ball? she gagged a little,True
Whatever happened to robot jones? he got cancelled.,True
What did the blind man say when he walked into the fish market? good morniiiiiiing ladies!,True
What do you call four condoms who play music together? a rubber band.,True
I got my first ejaculation today... i did not see that comming...,True
Why are rivers lazy? because they never get off their beds.,True
What's al qaeda's favorite football team? the new york jets.,True
Why did the hotel refuse hospitality to the navy? they didn't want their rooms covered with seamen.,True
My friend had a failed suicide. i told him not to hang his head about it.,True
What did the maxi pad say to the fart? you are the wind beneath my wings.,True
What's the difference between a joke and two dicks? you can't take a joke.,True
What do you call a guy with a rabbit up his arse? warren,True
What's worst than finding a worm in your apple? the holocaust worse*,True
"Should i have a baby after 25? no, 25 is enough",True
"I want to buy a tesla coil. shocking, i know... but i feel really energetic around them.",True
Where did jimmy go after the explosion? everywhere.,True
What did the jew post to the nazi subreddit? r/roastme,True
Are you guys all right? or are you all left?,True
What was osama bin laden's favorite drink? jager bombs,True
Dude: first of all me: oh shit this dude's about to make more than one point,True
What do you call someone who breaks a plate and then apologizes? dishrespectful...,True
What do gay people call each other on? homophones.,True
They figured out where the terrorists have been hiding their armies. in their sleevies.,True
What's father christmas called when he takes a rest while delivering presents ? santa pause !,True
What do you call a laptop that sings? a dell,True
What's the hardest part about fucking a cripple? paralyzing her.,True
When does 1+1=3? when you don't use a condom.,True
"What starts with p, ends with s, and is really long? pneumonoultramicroscopicsilicovolcanoconiosis",True
"I knew she was about to say something intelligent because she began with, you once told me...",True
Til 5 out of 4 people have a problem with fractions.,True
How are wives like cholesterol? if you ignore them for too long they'll probably end up killing you,True
Mos def (most definitely.) hi def (high. definitely.),True
Any girl can give you pics i can give you a headache,True
How did hans solo not catch on as an euphemism for masturbation?,True
Did you hear about the guy in the islamic state who was caught smoking weed? he was stoned.,True
How do you kill a troll? take away its internet access.,True
Last i dreamed.... i was a muffler. when i woke up i was exhausted.,True
How do australians ask their friends to pass the coffee mate :(,True
You hear steve sarkisian actually wanted to be a lawyer? he couldn't pass the bar,True
Cloudy with a chance of meatballs could also describe every menu item at olive garden.,True
The softest type of toilet paper is cats.,True
What do you call a proud danish countryman? a pastriot.,True
Did you hear about the man who hit my ex? he gold arrested for animal abuse,True
Your mom is so fat... that when she sat on a iphone it turned into a ipad.,True
How do you know you're in a redneck family? when your sister's pussy tastes like your dad's dick.,True
Why was the young snowflake so upset? because he just watched his mom get plowed.,True
Atoms are the biggest liars in the universe... they make up everything.,True
Why are all german cats dead? they have nein lives.,True
"Scandium, iodine, neon, corium. what is it? it's science. update: i'm an idiot",True
Why do you always see santa with a full sack? because he only comes once a year!,True
"Why did microsoft skip straight to 10? because windows 7, 8, 9. i'll see myself out.",True
For every action there is an unequal and opposite overreaction. - newton's law of the internet,True
Knock knock who's there ! aldo ! aldo who ? aldo anywhere with you !,True
My mailman got a sex change. i guess you'd call him a post man now.,True
Why does a milking stool have only three legs? because the cow has the udder,True
What did the ghost give his girlfriend on halloween? a booquet of flower.,True
In soviet russia a bar walks into men. the case of the man-killing-bar remains unsolved.,True
Why did the console player get sick in the art gallery? there were too many frames.,True
