text,humor
"After reviewing my life, god may very well issue another 5 to 10 commandments. sorry, guys.",True
Blind prostitutes. you gotta hand it to 'em.,True
"What did the ocean say to the shore? nothing, it just waved.",True
Why do bears have fur coats ?  because they'd look stupid in anoraks !,True
Why gordon ramsey hates wwe because it's f*cking raw,True
Aquaman: come on in the water is great. ironman: sorry dude i have rust issues.,True
If isis would really like the world to know their intentions.. they should kill a lion,True
Did you hear about the worlds largest broom? it's really sweeping the nation,True
Why don't blind men go skydiving? because it scares the shit out of the dog!,True
What do you call a swashbuckler when he noticed you? a senpairate.,True
"I sing like an amputee i can't hold a note, can't carry a tune...",True
How did captain hook die ? he wiped his ass with the wrong hand.,True
Why did paul walker cross the road? because he wasn't wearing his seat belt. (i'm sorry),True
How much money do gay bars make? a buttload.,True
What do you get if you cross a skunk  and a wasp? something that stinks and stings!,True
A barber applied for a scholarship at the barber's academy he didn't make the cut,True
How many it techs does it take to change a lightbulb? ticket closed: forwarded to facilities.,True
Why nuns don't wear bras? god supports everything.,True
I wondered why the baseball was getting bigger. then it hit me.,True
Has anyone seen my jacket? it's white with sleeves that make you hug yourself and a cute belt.,True
What does a vampire take for a cold?  coffin syrup!,True
Eli5: with the recent outbreak of ebola why hasn't madagascar sealed it's borders yet?,True
The outsiders: why is ponyboy lactose intolerant? he hates dairy but likes sodapop.,True
How did the blind kid burn the side of his face? he answered the iron,True
11: he shoots for her coffee. he scores! he's... me: grounded.,True
Whats lil' waynes favorite pizza place? little seizures,True
Why did the cow jump over the moon? because the farmer had cold hands,True
"What did one butt cheek say to the other butt cheek? together, we can stop this shit.",True
A conscience is what hurts when all your other parts feels so good.,True
Why do farmers have potential to become great judges? they recognize bullshit from miles.,True
What do you call the mean and dusty winds of the desert? darude sandstorm,True
When i die i want to be cremated and blown in the faces of my enemies,True
On anne frankly and i did nazi that coming... those *panzer* gettin`old,True
It sucks being a wiener. your best friends are a couple of nuts and you neighbor's an asshole.,True
What do you call a gay dentist? a tooth fairy,True
A religious american just went on a killing spree with out killing anyone. talk about a bad aimish,True
What's the difference between jam and marmalade? i can't marmalade my dick up your ass.,True
Instagram now has video! i'm going to film the hell out of this salad!,True
The phrase silence is golden doesn't make any sense because duct tape is silver.,True
Why can't a t-rex clap? because they're all dead,True
What are the pigs warned to look out for in new  york? pigpockets.,True
Is your ass a computer? because i want to back it up to a 3 inch floppy.,True
"My girlfriend called me a pedophile i said, that's a pretty big word for a six year old.",True
"I'm absolutely incredible in bed. in fact, yesterday i slept 15 hours.",True
What do you get from a dollar-an-hour hooker? a lot of bang for your buck.,True
A bar walks upto a bar... hows that even possible,True
What do you get when you cross an owl with a bungee cord? my ass! hahahaha!,True
"A homeless man told me to get home safely i smiled and said, you too!",True
What do you call a good joke on reddit? unoriginal,True
"If h20 is on the inside of fire hydrants, what is on the outside? k9p.",True
Why do asians prefer sony? because it's a stereo type,True
What's the best kind of vegetable to bring to a party? a turn up,True
"Disabled toilets. ironically, the only toilet stalls big enough to run around in.",True
Why don't you ever see elephants hiding in trees? because they're really good at it.,True
I used to have a terrible addiction to soap... ...but i'm clean now.,True
How do you make a sandwich legendary? make it on dark rye,True
Why did the computer science student drop out? he just couldn't hack it.,True
Where does a digital photographer hang his work? on a jpeg.,True
How do you wake up lady gaga? poker face.,True
I feel sorry for santa..... i hear he only cums once a year....maybe it's his age.....,True
"What do you call fans who take a trilogy way too seriously? christians, muslims, and jews.",True
Why can't a feminist shoot a gun? they can't handle the triggers.,True
Helen keller walks into a bar.... and a table.....then some chairs...,True
"Wanna hear a pizza joke? i can't tell it to ya, it's too cheesy",True
What's the different between england and a tea bag? a tea bag last longer in the cup,True
I had sex with a terrorist once. she said i was the best jihad.,True
What happened when jesus went to mount olive? popeye fucking smacked him one.,True
"What is the difference between 2 dicks, and a joke? your mom can't take a joke.",True
I know a great us postal service joke... ...but you'll never get it.,True
What do you call it when trash pandas pleasure each other orally? coonilingus,True
2 hunters walk into a bar... ...that was the worst time to misinterpret the word 'duck',True
"Dandelions are just like regular lions, except they wear ascots.",True
How can you tell when your drowning in milk? when it gets pasteurise.,True
What did the seaweed say when it was in trouble? kelp me!,True
Sarcasm is just one more service we offer.,True
A gaggle of geese. a murder of crows. a nope of laundry.,True
I wonder if china has fancy plates called america,True
I made an appointment but it was cancelled. it was ... disappointing.,True
"A vegan, cross fitters, and yoga person sit down for dinner and nobody says a word.",True
What do you call a group of euphorics? a fedoration.,True
Why don't prison inmates just use liquid soap?,True
"My god, i whisper as the food arrives. just as the prophecy foretold.",True
Why did the obtuse triangle go to the beach? because it was more than 90 degrees.,True
A cat eats a slice of swiss cheese... and sits by the mousetrap with baited breath.,True
"A bartender walks into a barn... the horse says, hey, why the wrong place?",True
What did the tin man say after he was ran over by a steamroller? curses! foil again!,True
"If april showers bring mayflowers, what do mayflowers bring? pilgrims",True
Have you ever traveled in time? how about now?,True
What do cows like to do at amoosement parks?  ride on the roller cowster.,True
"Nobody has 3 cats. you either have 1 or 2, but from there you leap directly to 17.",True
Where do ants keep their armies? in their sleevies,True
I would tell you a joke about anal sex... butt fuck it.,True
*feels the chill* chill: i have a boyfriend,True
What do you call it when a baby tells you off? a fedis.,True
There will be only 7 planets left after i destroy uranus,True
I have a great ebola joke! you probably won't get it,True
Will i live to see 90? you just did.,True
Why was the motorcycle going so slow? because it was two tired!,True
Regular sex makes your day. butt sex makes your hole weak.,True
"My guitar e string broke... on another note, the d string is fine!",True
