text,humor
"My apartment smells like someone just took a dump, but nobody is home... that's some spooky shit.",True
"What do you call a part gopher, part duck, and part you? a gophuckyourself.",True
Why did the man's kidneys fail? they didn't study.,True
"What do you call a russian, homophobic, golfer? vladimir putting",True
I have the heart of a lion... and a lifelong ban from the zoo.,True
My computer isn't that nervous. it's just a bit ansi.,True
"My grandfather always said, be envied, not envious. i wish i'd thought of that quote.",True
What do you call a comedian who couldn't make it? pun intended.,True
I'm on a whiskey diet. i've lost three days already.,True
Who is bigger - mrs bigger or mrs bigger's baby? mrs bigger's baby because he's a little bigger.,True
What is it called when a reptile loses its tail? ereptile dysfunction,True
How can a redneck tell his twin sisters apart? by taste.,True
A squiggly red line should appear under people who are wrong for you,True
Thinking about going to 50 shades and eating loudly the whole time.,True
I saw a really funny joke on /r/jokes a while back quite a while back actually.,True
Merry christmas!!!!!!!!! maby a cross-post to math is in order.,True
"Besides watermelon, there should be windmelon, firemelon and earthmelon. the four elemelons.",True
Which hotel chain was nikita khrushchev's favourite? premier inn.,True
How much does a pirate pay for an ear piercing? a buck an ear,True
Where do dock workers like to shop? crate and barrel.,True
Drew barrymore now i just need to colour him in,True
Knock knock who's there cd cd who? c deez nuts *ha* ^^*got* ^^^*em*,True
What is it called when albert einstein masturbates? a stroke of genius.,True
What do you call a child who doesn't believe in santa? ...an eggnogstic,True
I'm really good mates with 25 letters out of the alphabet i don't know why,True
How do u confuse a blonde tell them to pee in the corner of a silo,True
Why did the angel lose her job?  she had harp failure.,True
I've never had angry sex. i'm always happy and quite surprised that it is actually happening.,True
Knock knock who's there ! apple ! apple who ? apple the door myself!,True
"Why do trees seem suspicious on sunny days? i dunno, they just seem a bit shady.",True
"I own a very profitable bakery i guess you could say, i'm rolling in the dough",True
"What do you call a black man selling drugs? a pharmacist, you racist.",True
Doctor doctor i feel dead from the waist down. i'll arrange for you to be halfburied.,True
I could lose weight simply by not eating the food i drop onto my shirt.,True
What do you call a female redneck who is faster than her brothers? a virgin,True
I read a book today about the dangers of alcohol. and that's when i decided to quit. reading.,True
Steps to being cool a) use the sunglasses face b),True
What's a terrorists favorite sex toy? a blow up doll!,True
You know what most people hate about ambiguity? stuff.,True
Customer: do you have bacon and eggs on the menu: waiter: no we clean our menus regularly.,True
I laughed at a lot of the posts here on reddit. they /r/jokes.,True
Why did the model pee herself? she was all dressed up with no place to go!,True
I live a sinatra lifestyle. i'm just being frank with you.,True
Lets all start wearing weird '90s mom jeans! - girls now,True
50% of all trending topic tweets are people asking what the trending topic means.,True
I'm half asian. all white people are. but my cauc part is bigger.,True
Do you know why the cybermen are the best doctor who characters?,True
Disappointment usually stems from expecting too much from strangers on facebook.,True
Soo... i guess when he asked for my number he didn't mean how many lovers i've had?,True
So this ray of light broke bad. it was put in prism.,True
"I always wanted a trophy wife, but instead i got a participation medal girlfriend.",True
"What do you call people with big ears? nothing, they might hear you",True
Beer gardens are great because who wouldn't want to grow beer,True
Why did the hipster burn its tongue? beacuse he drank the coffee before it was cool,True
What is the name of mark zuckerbergs mother? motherzucker,True
What did the calf say to the silo? is my fodder in there?,True
Whats a bros favorite mexican food. carne asuhdude,True
I have beautiful children thank god my wife is having affairs,True
Hey osama i found your 72 virgins they are all on my timeline talking about star wars,True
A white guy walks into a bar... exam. he passes and becomes a well respected lawyer.,True
What do you call a depressed cow? a mooooope,True
Only trust people that like big butts. they cannot lie.,True
Instagram: look at my sushi! vine: look at my sushi for six seconds!,True
"My grandma started dying in the living room well, i guess it isn't the living room anymore.",True
What do cows do in traffic? they moove,True
I think roastme should be renamed... to daisexmachina.,True
"There's two types of people in this world: those who finish their sentences,",True
"Don't try to understand women. women understand women, and they hate each-other.",True
What does a cow call his girlfriend? his significant udder.,True
I find hanging around in coffee shops a great way to espresso yourself,True
Why is it called tourist season if we can't shoot them?,True
Why did the hipster burn his tongue? because he drank coffee before it was cool,True
1. the truth will set you free. 2. the truth hurts. 3. being set free hurts.,True
Everyone keeps saying i'm paranoid... this must be some sort of conspiracy...,True
Q: how do ghosts fly from one place to another? a: by scareplane.,True
Three straight men walk in to a bar... and come out.,True
What do you call a condensed version of the history of isis? caliphnotes!,True
My friend said my mum was hot. i then punched him and reminded him that we were americans.,True
My roommate said i might be schizophrenic. but what does he know i don't even have a roommate.,True
I like my women how i like my government: open and unprotected.,True
Jimmy kimmel should have floyd mayweather read mean tweets after the fight oh wait,True
Doctor doctor people tell me i'm a  wheelbarrow. don't let people push you around.,True
Pro tip: never take a laxative and a sleeping pill at the same time.,True
Why is there no pain relief in the jungle? cos the parrots-eat-em-all,True
I'm still pissed that testicle tuesday never took off.,True
Accidentally swallowed some scrabble tiles last night. going for a crap could spell trouble.,True
How do you know if someone is a vegan or has run a marathon? they'll tell you,True
He says i'm cute when i'm mad. well he has no idea of how gorgeous i can be.,True
"I threw out a sheep, a drum and a snake from an airplane ba-dum-tss",True
I have just filmed my girlfriend using her toes to wank me off. nice bit of footage.,True
Life is like a box of chocolates... it runs out faster for fat people.,True
"Gf asked can you hand me my shoes? me: no, but i can feet them to you",True
"Reddit, you are too cool... ...you give me frostbite.",True
What do you call it when you hire your relatives to play with your nipples? nippletism,True
Why was the lady's hair angry? because she was always teasing it.,True
Why is an executioner a terrible high-fiver? he always leaves you hanging,True
At first i didn't like having a beard but then it grew on me.,True
So john travolta's career has been dwindling recently... i guess you could say he fell from grease.,True
"A feminist once asked me, what's your view on lesbians? i said 1080p",True
What do you call beef that's been burned? a mis-steak.,True
