text,humor
"Hey girl, are you a 10? because you're basic...",True
I used to work at a fire hydrant factory. i couldn't park anywhere near the place. -steven wright,True
What do you call an alien in a swamp? a marshian,True
What's the stupidest animal in the jungle? the polar bear,True
What did orville say when keith harris died? nothing.,True
Jokes about unemployed people aren't funny. they just don't work.,True
I just got a great deal on a flesh light... craigslist is the best!,True
What so you call a white guy with a small penis? cockasian,True
Why is george michaels never gonna dance again? his ekg ain't got no rythym,True
What's gordon ramsay's least favorite movie? it's frooooooozzzzeeen,True
What do you call a fat asian? a chunk,True
"If this tweet gets 5 retweets, i will threaten a public official on facebook.",True
What do bostonians call dogs that protect heaven's gates? god dogs,True
"Riding a car... a man, in *curve*, skids.",True
"I like my men like i like my coffee black, ground up and in the freezer.",True
I want a lady in a sheet and a creak in the bed -haunted house designer,True
"I'm hooked on abortion jokes, gladly, they'll never get old.",True
It's funny when my wife gives me the silent treatment'. because she thinks it's a punishmen,True
What would you call two bananas? a pair of slippers.,True
It's so hot outside that i just saw two hobbits throw a ring off my roof.,True
"Hp lovecraft walks into a barn... ...a horse looks at him and says, why the long face?",True
I look forward to hearing michelle obama's speech again. at the 2020 rnc.,True
Why are peter pan's jokes not funny? because they neverland,True
What does santa say to the elves after they make the toys? leave my presents,True
Adele joke why the chicken cross the road? to say hello from the other side,True
What did they call hitler when he swam? adolfin,True
My autocorrect changes c**ts to china. hey don't blame me. i'm not the racist code programmer.,True
What do you call a make-believe country for wizards? a magi nation,True
What do you call it when a midget realizes he's gay? coming out of the cupboard.,True
Somehow i missed my turn into my driveway and ended up at the pub few blocks over,True
What did orion receive when he won second place in the archery contest? the constellation prize.,True
How do you know you're leading a sad life? when a nymphomaniac tells you let's just be friends.,True
Why do people choose to become bakers? because they knead the dough.,True
Anyone ever seen stevie wonders house? neither has he!,True
"Today, i had sex for 1 hour and 30 seconds thank you daylight savings time!",True
Thanks for being here right on time. we'll see you in a few hours. - doctors,True
What is the wettest animal in the forest? the raindeer.,True
What's the worst thing about having sex with a bulimic? she won't swallow,True
All the women moaning about finding a husband obviously never had one.,True
I identify as a creeper from minecraft because i become unstable when people get to close to me,True
Why did the hillbilly cross the road? because he couldn't get his dick out the chicken,True
Yo mama head so small that she got her ear  pierced and died.,True
I'm starting to regret my 2015 forever tattoo.,True
I think i'll tivo my kids and watch them later.,True
Police say oscar pistorius is a flight risk. how? does he also have a pair of propeller feet?,True
"70% of our planet is covered in water, the other 30% is covered in idiots.",True
What app do you use to browse reddit on your phone? 9gag,True
"If you combined all the female rap artists, what would you get? nicki melange",True
Why is an irish funeral cheaper than an irish wedding? there's one less drunk.,True
Packs 2 hours before leaving for a trip unpacks 3 months after coming home,True
It's hurts for me to say this... but i have a sore throat.,True
Why was the cook sad when all the water in his pot boiled away? because he mist it.,True
What did the black guy get on his sats? bbq sauce.,True
I'm the jason bourne of avoiding people i know at starbucks.,True
Why did bill cosby make his own jell-o? because his girlfriend was in a roofie induced coma.,True
What do you call a stick that's good at algebra..? an arithmestick.,True
Why did a physician go to prison? his medical license was doctored.,True
What is a guy with ed favorite saying? i'm going to pump you up!,True
What does an egg say when its turnt up? omlet!,True
What do you call a one night stand with a robot? nut and bolt,True
How do you turn a fruit into a vegetable? you break his neck.,True
"Get hoarders addicted to crack, they will sell all their s*it..problem solved.",True
Ever had sex so good... that you told your wife when you got home?,True
What did the farmer say when he lost his tractor ? wheres my tractor!,True
What's the best city to search the world wide web in? rome.,True
What does a triceratops sit on? his tricerabottom,True
Why was eric clapton arrested? he was fingering a minor.,True
There are 10 types of people: those who understand binary code and those who don`t.,True
Has anyone's leg ever become pregnant with puppies?,True
How did jared lose 40lbs? he dumped his girlfriend.,True
Why did the sperm cross the road? because i put the wrong socks on this morning.,True
My wife does a hilarious john goodman impression. doesn't hurt that she looks exactly like him.,True
Just once would i love to see a girl i know in a porno,True
The realization that netflix knows me better than my closest friends....,True
I caught a mosquito in my hand.. it sucked.,True
"What are the three rings of marriage? the engagement ring, the wedding ring, and then the suffering",True
"What do you do to an elephant with three balls? walk him, and pitch to the giraffe!",True
What do apple and blackberry have in common? neither one has jobs.,True
The first step to admitting you have a problem is having a problem.,True
Why non-smokers don't take bubble blowing breaks is beyond me,True
"The universe is made of electrons, protons, neutrons and.. morons.",True
What's a neckbeard's favourite curry? chicken tikka m'sala,True
Do you know the punishment for bigamy? two  mothers-in-law.,True
What is the core of uranus called urectum,True
What do you call really good tea? qualitea.,True
Who will stop donald trump? the first amendment people.,True
One thing that sean connery asked his wife only once and never again. to sit on his face.,True
A trump supporter and a squirrel humping an acorn... are both fucking nuts.,True
A battery's life sucks. you're either working or you're dead.,True
"I saw two tramps passionately making out in public. so i shouted, get a box.",True
So russia has been running out of resources lately... i guess you can call them the red scarce.,True
How do you stop an ethiopian tank with a gun? shoot the people pushing it.,True
I was arrested yesterday for stealing eggs. i could've sworn they were free range.,True
You become fat and lazy and-whoa mortal kombat 2 scoot over,True
What do you call a group of paralyzed hippies? organic vegetables.,True
It seems a little insensitive for batman movies to be rated pg,True
How do you save a drowning mouse ? use mouse to mouse resuscitation !,True
There are two sides to every story. my side and the right side.,True
"I saw this incredible color in a dream, but it was just a pigment of my imagination.",True
Is it true that cannibals don't eat clowns because they taste funny?,True
