text,humor
What sex position makes an ugly baby? go ask your mom,True
Dna what do you get when you mix human and goat dna? (/spoiler),True
Harry potter pickup line. hey babe are you parseltongued cause my snake wants to communicate!,True
Ever had sex while camping? it's fucking intents,True
What did the man say who couldn't add the same number to itself? i can't even...,True
"Wife: where did all this glitter come from? me: jake, at state farm.",True
What do you call a group of women with small breasts an itty bitty titty committee,True
I once had sex for an hour and 45 seconds. thanks daylight savings.,True
Be careful! someone's using this sub to target victims he's a real predditor,True
Three stages of life. * birth * what the hell is going on?!? * death,True
Why do sharks live in saltwater? because pepperwater makes them sneeze.,True
Hard work is simply the refuge of people who have nothing whatever to do.,True
"Ok brazil, this would be a time when it's ok to bite an opponent.",True
A man finishes a tube of chapstick... ...just kidding.,True
"Him: your so funny, smart & beautiful how are you still single me: *you're",True
What is big hairy and can fly faster than sound? king koncord.,True
Sorry i dressed up like captain caveman when you asked me if i wanted to go clubbing.,True
I'd love to get myself a job inspecting mirrors! i could really see myself doing that.,True
The victoria's secret models should use their wings to fly to a food source.,True
"I don't mean to denigrate women. (ladies, denigrate means to put-down or patronize.)",True
"Pregnancy tests should have three results: pregnant, not pregnant, and reality show.",True
What's the difference between a duck? one of it's legs is both the same.,True
"My christian mingle username is: gay4god hit me up, looking for love",True
"What did the digital clock say to the grandfather clock? look grandpa, no hands!",True
"I know the word diputserom sounds bad, but its more stupid backwards",True
I like to observe people in lines. i'm in wait watchers.,True
What's a horny pirates worst nightmare? nsfw a sunken chest with no booty!,True
I'm not gay i've just got an alternative sexuality.,True
Why do bears poop in the woods? so nobody will see their bare (bear) bottom!,True
Just want to be bitten by a spider without the obligation of becoming a superhero.,True
I don't trust those trees they seem kind of shady,True
How do you have sex with a male corpse you cant. his penis wont get hard.,True
Q: what do ghosts like to chew? a: boobble gum.,True
Say what you want about pedophiles! at least they slow down in school zones.,True
A midget psychic broke out of prison. now there's a small medium at large.,True
Two handicapped men walk into a bar... praise the lord!!,True
What do monkeys sing at christmas ? jungle bells jungle bells.. !,True
Why was the 3 year old ethiopian kid crying he was having a mid life crisis,True
What is a mafia enforcer's favorite game? whack-a-mole,True
I do my women like i do my homework i don't,True
Why do emo kids always have the latest technologies?,True
What's the smallest drink you can order at a bar? a mar tiny.,True
Egotist: a person who is usually me-deep in conversation.,True
Your voicemail will be ignored in the order in which it was received. beep.,True
"Chicken walks in to a bar... it's full of roosters. chicken says, i crossed the road for this?",True
What does darth vader identify as on tumblr? ana-kin,True
What's a barista in france's favorite workout? a french press,True
"A leper man has sex with a hooker. keep the tip, he says afterwards.",True
"I overheard my daughter asking the little boy next door, are you the opposite sex, or am i.",True
What did the dog say when it sat on a piece of sandpaper? ruff!,True
"Why did the hipster burn his tongue? because, he ate the pizza before it was cool.",True
I'm filming a documentary on the serious subject of circumcision. it's called robbin' hood.,True
What do you call a jamaican proctologist? dr. pokemon.,True
What did adele say when the chicken crossed the road? hello from the other side...,True
My jumper cables stopped working the other day so i called triple a to bounce up my trampoline,True
A fart is just a turd honking for the right of way. yep,True
How do you congratulate a fighter after winning a match? good jab.,True
What was the sale in jewish circumsicions? buy one get one half off,True
Why is gandalf's cupcake shop so successful? because he has a magical staff.,True
I'm giving up spray deodorants for the new year. roll on 2016.,True
I started a band called 999 megabytes. we haven't gone to a gig yet.,True
I was gonna tell a holocaust joke but i ran out of gas.,True
A frog decided to trace his genealogy one day... he discovered he was a tad polish.,True
How did the butcher introduce his wife? meet patty!,True
"'let's just agree to disagree.' -me, saying grace at the dinner table.",True
What kind of lettuce do serve on the titanic? iceberg lettuce! :d,True
"What is your least favorite type of sandwich? whoops, wrong sub.",True
Want to hear a good pee joke? well urine luck.,True
Do you raise chickens? because you raise my cock.,True
9/10 men said they like women with curves the tenth one liked the other 9 guys.,True
Whats blue and bangs old ladies? me in my lucky blue coat.,True
What is the hardest part of eating a vegetable? the wheelchair.,True
Whats the german version of silent night? kristall nacht,True
What do you call a smart blond? a golden retriever.,True
What do mathematicians do when they are constipated? they get a pencil and work it out.,True
I love americans. you guys have the best serial killers.,True
What do you call an environmental bicyclist? a recyclist.,True
Whoever invented the knock-knock jokes... should get a no-bell prize,True
My church says to treat my body like a temple. and let all the priests inside.,True
What type of candy bar does snake eat? snake-kers (snickers),True
What is black and has two broken arms? muammar gaddafi's sunglasses,True
I wonder if bruce jenner got wished a happy mother's day. title,True
Why did the bear eat his phone? it was a black berry...,True
How do you make a starfish shine? drop it in sparkling water.,True
Whoever has my voodoo doll out there ... please scratch between my shoulder blades.,True
How can you tell when a lawyer is lying? his lips are moving.,True
Why did the woman's visit to wall street land her in the hospital? because the stock broker!,True
What do people do in greece? slip and slide around.,True
What is a cow's favourite tv show ? dr moo !,True
Lifeguards wouldn't let obama in the pool because he had weeping *legions*,True
My stats teacher told me i was average. i thought that was mean.,True
Thank god for that one person who gets on the elevator and takes charge.,True
Someone told me canada had no territories... i was having nunavut.,True
What do you call a group of animals who decides to kill themselves? mass zooicide.,True
Q: what do you call the folks who hang around the musicians at conservatories? a: violists.,True
One fist-bump from a cool black dude is worth 5 years of my parents loving me.,True
The us government is taking samsung to court. they're being charged with a fault in battery.,True
Why did the scarecrow win the award? because he was outstanding in his field,True
Why couldn't bill gates get a girl friend? because his penis was microsoft.,True
Bill gates how does bill gates fix a broken lightbulb? he buys a new house.,True
