text,humor
A good date ends with dinner. an excellent date ends with breakfast.,True
"Buy one annoying person, get two free! - in-laws",True
You got a friend in me - your friend's girlfriend,True
If you are reading this you are probably not blind.,True
I always order my burgers from sonic he always gets them to me the fastest,True
A girl's tinder bio said i would die without food uh okay me too,True
What happens when the smog lifts over los angeles? ucla,True
Why indian restaurants are so good at javascript? because they do curry so well,True
"To whom it may concern, the inventor of thirsty thursday obviously never had to work on friday...",True
Progress is made by lazy men looking for an easier way to do things.,True
What unit of measurement did the ancient greeks use to measure their crops? demeter.,True
"A muslim suicide bomber joins reddit **edit: wow, this blew up!",True
I follow ripped guys around the grocery store and just buy what they buy,True
"This year for kwanzaa, i'm getting my roommate the traditional kwanzaa toy. a dr. dreidel",True
I wonder what i'll order from amazon prime today - me every morning kinda,True
Selling darwinian birds: 5 for $5 buck finches; get money.,True
Me: eat your lemon pirate: no me: it stops scurvy pirate:,True
"Who do you see winning the presidency in 4 years? i don't know, i don't have 2020 vision.",True
Some people are like clouds... ... once they fuck off its a nice day.,True
Why don't chickens wear underwear? because their peckers are on their faces.,True
"Sometimes it's funny being lgbt because, in that case, op is always a faggot!",True
What's 18 inches and makes women scream? a stillborn.,True
How many vegetables should you pull out of the ground in one day? none,True
"Here's an offensive joke, what's black and white and eats like a horse? a zebra, you bastard.",True
What does a man with two left feet wear to the beach? flip-flips.,True
Why did the h kill itself? because the g had,True
I could never marry a tennis line judge... they always point out your faults.,True
"What is the holdup on square fruit, scientists?",True
The disney channel should be renamed 'celebrity prehab.',True
The entire dutch air force was disabled this week. the pilot was sick.,True
What do you call a hispanic man who spilled his nachos? a messycan,True
What do lesbian couples do once a month? finger paint.,True
I haven't shaved my beard in a couple days it's starting to grow on me,True
Why did hitler really commit suicide? he got his gas bill.,True
Did ilean ever get in touch with you? ilean who? i lean over and you kiss my ass!,True
Just landed my dream job of before picture,True
"Why didn't the proctologist show up for work? he had two cars, but he rectum both.",True
Why can't you cross the mexican border in groups of three? there's no tres-passing!,True
What did the scientist see when he looked up his family tree? a gorilla pooped on his face.,True
Q: when is a bad time to cross a black cat? a: when you are a mouse!,True
What if google was a lesbian there will be more women empowerment :),True
Today should be called bridge day.. 'cause i'm over it,True
What was osama bin laden's favorite drink? a double manhattan on the rocks.,True
You know why it's called black friday? because everything is 3/5ths the original price!,True
If you want a woman to settle down with you be a cat,True
I dislike the term haterade. i say hater-juicebox instead.,True
"How did king wenceslas like his pizza? deep pan, crisp and even.",True
Where would be a good place to find 25 million north korean jokes? in north korea itself.,True
If michael vick was a pokemon trainer.... ..he would be a gym leader,True
"A bartender walks into... ...a church, a temple and a mosque. he has no idea how jokes work.",True
What did cinderella say when she got to the ball? *(choking sounds)*,True
What do you call an asian man with one leg? tai-wan-shu,True
Knock knock who's there ! abyssinia ! abyssinia who ? abyssinia when i get back !,True
Where do milk shakes come from? nervous cows!,True
Why is the topmost floor the best place to drink in? that's how you set the bar high.,True
How many people with alzheimer's did it take to change a lightbulb? to get to the other side.,True
What did the first airplane engine say to the second airplane engine? are we there soon? not jet.,True
"Spent over an hour at the wife's grave this morning bless her, she thinks i'm digging a pond.",True
"Taco bell doesn't have a playground, because kids that eat taco bell can't climb, or run.",True
Hotel beds are often all the proof i need that satan owns a mattress factory.,True
Losing weight is so easy now. i'm just chasing the kids around all day - jared fogle,True
What's the capital of greece? about 15 cents.,True
Why did the rapper go to whole foods? he heard they had fresh beets.,True
Why did princess diana divorce prince charles? she was always told a ruler was 12 inches!,True
I lost two things today: my virginity and my job as a morgue assistant.,True
What did the man say when he saw the jewish man stealing his water? water jew doing?,True
What do you call a fear of horned bovines? aurochnophobia.,True
What does donald trump play most of the time? president evil.,True
I found out my vacation to greece is tax deductible apparently it falls under charity work,True
I bet martha stewart knits a really festive sock to wear on her wiener for the holiday season.,True
What's the hardest thing about having a colostomy bag? finding shoes to go with it.,True
What do you call a mexican carpet fitter? underlay underlay,True
"How long is a chinese mans name. yes, yes it is. old joke my grandpa like to tell.",True
What's the difference between a german and a virgin? one one appreciates good head,True
Why is the sea so strong? it has a lot of mussels.,True
I never knew the word mom could even have 7 syllables until i had kids.,True
Life is meaningless and we all die in the end xd,True
What is the hardest part to eat on a vegetable? the wheelchair.,True
What is a gay dinosaur called? nsfw megasorass,True
Mirror inspector now that's a job i could really see myself doing,True
What do your girlfriends personality and breasts have in common? they're both flat.,True
What's the proper salutation to use when writing a resignation letter to your children?,True
My mate dave's just got back from his third tour of afghanistan. hardest bloody bus driver i know.,True
Who was the person who passed up the chance to call german currency germoney,True
Why do black people only have nightmares? because the last one that had a dream got assassinated,True
What do you call it when a car full of mexicans catches fire? baked beans,True
Plot twist nigerian prince won the powerball jackpot and he's emailing everyone now.,True
What did the fireman say when the church  caught on fire? holy smoke!,True
What's the worst part of being a hooker? every day is the week is a moanday.,True
Why did the chemist die? he ate a pb and j sandwich.,True
I'm more hampster than gangster according to autocorrect,True
"Elder master! someone took a crap in the village's water supply! well, shit!",True
I had such a bad allergic reaction to a peanut today... ... that i got sued by thefinebros.,True
I call my car 'the forest whitaker' because the left light barely works.,True
A feminist one asked me what's your view on lesbians? i said 1080p,True
How do you know your sister's on her period? your dad's dick tastes like blood,True
What is a jedi's favorite car company? toyoda,True
"How many feminists does it take to change a lightbulb? none, feminists cant change anything",True
So a jew walked out of a bank... lol no he didn't,True
Whats a rednecks favorite thing to do on halloween? pump kin,True
