text,humor
My mexican friend was babbling hysterically but i just couldn't understand his panic.,True
Why couldn't helen keller drive because she was a woman,True
"Do unto others and stuff. (lesser-known brother, josh christ)",True
Whoever spelled the word receipt was a friggin idiopt,True
"I thought i had swag once, turned out it was just a mosquito bite.",True
When i get naked in the bathroom... the shower gets turned on.,True
What do you call an atheist who no longer worships the flying spaghetti monster? a-pasta-ate.,True
There's a fine line between a numerator and a denominator only a fraction of you will get this,True
What is the only type of folder that can make you sick? salmon manilla,True
Wanna hear a corny joke? no??? awww shucks,True
I like my coffee how i like my women... cold and bitter,True
"Some say youth is wasted on the young, i say wealth is wasted on the old. also oxycontin.",True
What would you get if you crossed a skunk with a type of easter candy? smelly beans!,True
You know you are a bad driver when............. you see more middle fingers than a manicurist.,True
What's the difference between a horny girl and a hungry girl? where she puts the cucumber..,True
If a pilot can't get it up during takeoff is it called projectile dysfunction?,True
What do motors and the soviet union have in common? commutators,True
What do you call 2 horses side by side in a stable? neigh-bours.,True
Bridge is like sex. if you don't have a partner you better have a good hand,True
How can you spot a bad stripper? because they half-ass it.,True
"What does bill clinton say to hilary after sex? honey, i'll be home in twenty minutes",True
Please please tell me that benedict cumberbatch's middle initial is q,True
Why can't canada win wars? because they'll blow you up and then apologize.,True
I walked into the reddit restaurant. all the servers were busy.,True
Yo mama so fat when she plays hopscotch she goes new york l.a. chicago,True
Why are there no jews on jupiter? because it's a gas planet.,True
Two guys walk into a bar they both had a concussion,True
Knock knock who's there ! b-2 ! b-2 who ? b-2 school on time !,True
"Snow ice or cold puns i wanted to see everybody's best ice snow or cold puns,",True
It's like my teeth got in trouble in school & aren't allowed to sit together.,True
The first rule of parenting is: never negotiate with terrorists.,True
What's worse than six babies in one refrigerator.. one baby in six refrigerators!,True
I broke my finger today - but on the other hand i am completely fine.,True
Looks like my milk is expiring tomorrow... just like america.,True
What does the nfl and broke back mountain have in common? cowboys that suck.,True
Did you hear about the robbery at the flower shop? it was a violet crime.,True
Why did the rabbit cross the road? because the chicken had his easter eggs!,True
I really should learn to say congratulations instead of are you keeping it?,True
Why is porn not a standard button on keyboards yet?,True
What do you call an alabama woman who can run faster than her brother? virgin,True
A seven year old walks into a bar nes and noble.,True
What do the washington metro system and the little mermaid have in common? they're both under dc.,True
Which country has the nicest children? germany. german children are kinder.,True
Why are condoms and bungee-jumping similar? you're screwed if the rubber breaks.,True
How many surrealists does it take to change a light bulb? *fish*,True
What did cinderella say while waiting for her photos? someday my prints will come,True
What do you call an aminoacid glued to an australian? a glutamate.,True
"1 year ago today, the world ended. rip everyone.",True
You didn't even notice that i had 1/8 of an inch cut off of my hair! - women,True
What does a gay horse eat for dinner? haaaayyyyyyy,True
You're a unit of power joe. i'm a watt?,True
Why did the chicken cross the road? just kidding i'm not going to be that guy,True
Where can i fit 40 jews in my car the ashtray.,True
What do you call a potato shaped like a penis? a dictator.,True
Black people ash wednesday doesn't have anything to do with. your dry cracked skin.,True
Which 2 birthdays go by the quickest? the twenty second ones and the thirty second ones,True
So microsoft bought skype for millions of dollars idiots didn't know skype's free.,True
A stallion with a smoking habit kidnaps hookers. so basically a hoarse horse hoards whores.,True
Do you want to hear a joke about a psychologist? - yes. - why?,True
What do you get if you cross a beatle and an  australian dog ? dingo starr !,True
How much for the mirror? ma'am that's the cover of vogue,True
How does isis turn on their water heater? they light the pilot on fire.,True
What's the difference of batman and a black-man? batman can go to shop without robin.,True
Why is it weird that the jews killed jesus? they love prophets,True
What did your last slave die of? a perforated colon.,True
Why are farmers so afraid of aliens? tractor beams.,True
My body is 99 degrees and the flu might add a few more (i fuckin suck at jokes),True
What do you call a girl who hunts owls? a hooters shooter girl,True
Stop hitting on my twitter crush you... you... equally unknown internet dude!,True
My 10 year old just told his friend i'm cranky cus i have my pyramid.,True
I've added paul walker on xbox live but he's always stuck on the dashboard.,True
What is a mouse's favorite record ?  'please cheese me' !,True
"If you're such a powerful warlock, why do you have diabetes.",True
Potatoes are high in carbs. 'baked' potatoes are just high.,True
Why don't you undress in front of pokemon? because they might pikachu!,True
"To anyone who might want to try homebrewing: trust me, it's wort your while.",True
"Which u.s. state abbreviation is the best? i'm not sure, but oklahoma's is ok.",True
I used to be the internet! - the library,True
How do they fit so many islands into such a small bottle of dressing??!!,True
Why won't pigs take up jogging? they don't like to get that far from the table.,True
"Women who bleach their mustaches, clearly don't understand the problem with mustaches.",True
"Recent evidence indicates that earth is indeed bi-polar, as we've always suspected.",True
My girl friend enjoys s&amp;m comedies. usually slapsdick.,True
Knock knock who's there ! baby ! baby who ? baby love my baby love.... !,True
What does a german soccer player call his cleats? das boots,True
Why did henry viii have so many wives ? he liked to chop and change !,True
Why was epsilon afraid of zeta? because zeta ate a theta,True
How to keep idiot waiting? i'll tell tomorrow.,True
I bet all the cool math nerds call each other algebros.,True
Sorry for loudly singing whoomp there it is! when you took your pants off. it's been a while.,True
What does a bug say when it accidentally breaks its exoskeleton? you gotta be chitin me!,True
Seen on a prison wall: virginity  who says you can only lose it once?,True
What do crazy girlfriends and chocolate have in common? they both kill your dog,True
What did dr. frankenstein say when his monster spit? it's saliva! it's saliiiva!!!,True
"At the end of the day, life should ask us, do you want to save the changes?'",True
What kind of fish is made of two sodium atoms? 2 na,True
"Just once, wouldn't it be good to hear an athlete thank natural selection for his team's victory?",True
Fortune teller recruitment come if you are accepted for the job,True
It matters not whether you win or lose: what matters is whether i win or lose.,True
My girlfriend is like -100. she's a 10 but she is also imaginary,True
