text,humor
What's beethoven's favorite fruit? ba na na naaa,True
Can you guys believe it's already lexus december to remember sales event time again?,True
Knock knock who's there ! bonnie ! bonnie who ? bonnie by soloflex !,True
What do you call a jewish man's scrotum? goldman sachs,True
Why don't jewish cannibals eat germans? because they give them gas.,True
Why are pirates always angry when they go to the restroom? because they p-irate.,True
Why arent the americans playing chess? ...they are missing two towers.,True
"If you ever want to watch a women feel herself up for ten minutes, hide her cellphone.",True
I did it reddit! i finally did it! i finally made it to the front page!,True
If porn is so bad... why are there so many nuns in it?,True
"You know what the first sign of aids is, right? a severe pounding in the ass...",True
"If i work security at the samsung store, does that make me a guardian of the galaxy?",True
What monsters are all the tools in the toolbox afraid of? vampliers,True
Q: where does an irish person go on a vacation?  a: a new bar,True
Why is african education so behind? because instead of learning their abcs they learn their stds,True
What's the difference between pizza and your opinion? i asked for pizza.,True
Your mama's so fat... she broke the branch off the family tree,True
What do you call a cow with parkinson's beef jerky,True
What's the squeakiest ride at the fair? the haunted mouse,True
Q: what is the definition of a major seventh? a: a violist playing octaves.,True
What does justin timberlake say when he's going to the bathroom? it's gonna be pee,True
"Chuck norris once shot down a german fighter plane with his finger, by yelling, bang!",True
A local plastic surgeon started giving away free breast implants... they're up for grabs.,True
What do you feel when there's no more coffee? depresso.,True
What do you call a man with his arm up a horses butt? an amish mechanic.,True
What do you call a cow that got hit by a car? moo-tilated.,True
A guy accidentally took sleeping pills instead of viagra... he couldn't get up.,True
Roses are red violets are blue i have a gun get in the van,True
Who do grammar nazis hang out with now? the alt-write.,True
So many people have a messiah complex these days.... i'm like jesus christ!,True
Why don't seagulls fly over the bay? because then you'd have to call them bagels.,True
A toilet seat left up in the ladies room can only mean one thing. lady cocks.,True
"I did it again, i put way too much hairspray on my back hair, now i can't sleep.",True
What's the only disease a potato can get? tuber-culosis,True
The problem with political jokes is that they get elected.,True
"I have just completed knitting a tiny sweater for my one true friend, who is a grape.",True
Why are diapers like $10 bills? because you have to change them.,True
Why do lawyer's suits never have pants pockets? because their hands are always in someone else's!,True
Whats brown and rhymes with snoop? dr dre,True
Nurse: would you like an appointment for next week? patient: no i'm sick now.,True
"I don't always have sex with star trek fans... but when i do, i prefer dos trekkies.",True
Why did the climate change denier oversleep? he wasn't worried about all that alarmism.,True
What's the difference between a black person and a jewish person? how they steal your money,True
Did you here what the waiter did at the restaurant? he waited,True
What's better than being up to your knees in beer? being up to your nuts in cider.,True
Does running out of a burning barn make a cow unusual? no only medium rare!,True
What did one ball say to the other? who's the dick in the middle?,True
Did you hear about the italian chef who died? he pasta way last night.,True
I fart in church so i can sit in my own pew.,True
If you don't know a lot of creatures in greek mythology... i'll give you a mini-tour,True
"I always knew you'd come for me, my darling. where are you going",True
Why are terrorists so mean? because they don't like nice people.,True
Whats a frogs favourite game ? it's croak-et !,True
I just hate elevator jokes. they're wrong on so many levels.,True
I needed to burn some calories... so i set a fat kid on fire,True
What did the vegan neanderthal say when walking in to the woman's bathroom? chickpea,True
What does oral sex in a nursing home taste like? (shrugs shoulders) depends.,True
What is a good title for a movie about bacon? babe: the final chapter,True
I saw a porn starring tila tequila today the nice man even salted her rim.,True
I love al pacino. but it's his brother cap that really gets me going.,True
Life is like a box of chocolates it sucks if you have diabetes,True
It's crazy they couldn't shut bob marleys coffin when he died it kept jammin,True
How do you get a million dollars with a girlfriend you start with 4 million,True
"If you ever feel like you're bad at your job, remember at least you don't work in polling",True
What's the slogan of jewish proselytizers? yahweh or the highway.,True
What does a cannibal do after dumping his girlfriend? wipes his butt,True
What do you call an evil physicist? sinner of gravity,True
I watched my first porn the other day i looked so much younger back then!,True
What does a turkey eat when it's hungry? an armenian!,True
What do elves learn in school? the elf-abet.,True
Don't have a garage sale if i can't buy your garage idiot.,True
Isis is knocking on my door recruiting... cause i just bombed this physics test.,True
"I saw a shop called lasting impressions, they sell brass knuckles.",True
What is the the chicken's favorite composer? bach bach bach time to return to /r/til,True
Yo mama so bald that she took a shower and  got brain-washed.,True
When i get alzheimer's i'm going to watch the sixth sense like every day.,True
How to die with dignity. 1. grab your dignity with your right hand. 2. die,True
What do you call a web developer who enjoys finding bugs in the system? a spider,True
Why do penguins eat fish? because donuts get soggy before they can catch them.,True
"Which antivirus program does a pirate use? (http://www.avast.com/), ye mateys!",True
Biker mimes if a group of mimes forms a motorcycle gang.... do they have to drive electric bikes?,True
"Willie nelson, 81, found dead... he was playing 'on the road again'",True
I had a good fallout 4 pun in mind... but i forgot it radaway...,True
I couldn't figure out how my seatbelt worked. but then it clicked.,True
New thanksgiving trend forget black fiday how about black riot monday,True
Why are locomotive drivers so good at driving locomotives? because they were trained.,True
I saw two wnba tickets nailed to a fence today it's my lucky day! free nails.,True
Why did the doctor toss his patient down a well? he tried to kill them.,True
Yo mumma is so fat that when she sat on the ipod she made the ipad,True
Something came in the mail today... my taxes,True
What do you call a deep thinking pastry chef? a filosopher.,True
I like my whiskey as i like my women. 12 years old and mixed with coke,True
What did the pirate say when he turned 80? 'aye matey,True
How long did cain beat his brother? as long as he was abel.,True
What goes snap crackle and pop ? a firefly with a short circuit !,True
"A poem roses are grey. violets are grey. lol, i'm a dog.",True
What do you call a belt made of clocks? a waist of time,True
What do you call the sweat between two rednecks making love? relative humidity.,True
What makes teaching gender studies so great ? ready pool of girls with daddy issues,True
I used to play rock-paper-scissors professionally. i made money hand over fist.,True
