text,humor
What's the difference between a turtle and a tortoise? i don't know but your mother's a whore!,True
"Yo momma so fat... yo momma so fat, i crashed into her for 15 minutes",True
When is jesse jackson going to notice how segregated neopolitan ice cream is?,True
What is that famous raider saying? next season!!! hater nation!!!,True
"I just love that fragrance you're wearing, is that consent?",True
What is created when you rub two oranges together? pulp friction,True
An italian family is sitting quietly at a table in a restaurant,True
What's the difference between donald trump and a baby who just got hiv? i didn't rape donald trump,True
It's raining. i'm going to be late for work. i can't fit my hair in the car.,True
"When a homosexual man becomes brain dead, is he a fruit or a vegetable?",True
Your mother is like a christmas raffle. $1 a strip.,True
"I'm so lazy, if autocorrect doesn't know the word after 3 letters i put my phone down.",True
Why did the girl fall off the swing? because she had no arms.,True
I turned into a cat earlier. don't ask meow.,True
There are two things i hate in every politician: their face.,True
"My dad said do your chemistry homework, okay? potassium",True
Why did the blonde cross the road? i don't  know. neither did she!,True
Jews spell their god's name yhwh ... ... because they're too cheap to 'buy a vowel'.,True
A paraplegic went down a runway... she made for a great roll-model.,True
How did charlie sheen contract hiv? he blew a piston in his car.,True
Losing your phone makes dying in a car accident less likely but more appealing.,True
How can you tell luke is uncircumcised? because he has force kin.,True
What do you call a bunch of white guys on a bench? the nba,True
Why do the kurds have no state of their own? they didn't get their whey.,True
What does a door and a jar have in common? they both are ajar.,True
What's the cruelest curse to wish upon a single guy? i wish his hands were made of stone.,True
Why don't parrot's like black people? because polly wants a cracker.,True
What type of wind is named after a young deer?  foehn,True
There's a new 12 step program for people who can't stop talking. on-and-on-anon.,True
Why did the tomato blush? it saw the salad dressing,True
What do you call a blood-thirsty optometrist? macula.,True
Whats the difference between jam and jelly? cant jelly my dick in your ass...,True
*swallows pride* *reads the label* 'this pride may contain nuts* oh no *swells with pride*,True
Why did the chicken cross the road to see the ugly man. knock knock who's there? the chicken.,True
We're gonna party like its 1999. //breaks out nokia flip phone and starts to panick about y2k//,True
What do you call a mad lunch? hater-tots,True
What do you do if you're attacked by a bunch of carnies? go for the jugular (juggler)!,True
Which religion faces the most resistance? hinduism... om......,True
I like my slaves how i like my coffee. free.,True
I heard girls like guys that are mysterious so i just put a fog machine under my bed,True
What do you call a stoner dinosaur? a smokealottapottapus.,True
I doubt vodka has all the answers but it's worth a shot.,True
What is an italian's favorite type of breakfast? *serie-a*l,True
Why do you never see an elephant hiding in trees? because they are really good at it.,True
What happens when a lawyer takes viagra? he gets taller.,True
I think my roommate might be gay his dick tastes like shit!,True
"My friend called me cheesy i said don't brie so mad, its all goud-a",True
When life gives you lemons just be thankful it wasn't herpes .,True
Non-native english speakers are the number one victim... ...of getting punched in the mouse.,True
"Roses are red.... violets are blue-ish, if it weren't for christmas, we'd all be jewish!",True
What do you call chocolate eggnog? nignog. eh? i laughed.,True
What do you call 1000 soldiers with no legs? an army.,True
So you think you can dance. should be the title of a lifetime movie about strippers.,True
The worst marketing blunder in history was not putting cassette decks in cell phones.,True
There's a cure for kleptomania! they make a pilfer that.,True
"I saw a sign that said watch for children and thought to myself, sounds like a fair trade.",True
A beautiful girl looks good in the background of her smart friend.,True
What do you call an arab man who drives a bus? a bus driver.,True
Ghost joke how could a ghost have two moms one of them has to be a transparent,True
Q: what happened when the dog went to the flea circus? - a: it stole the show!,True
I am practicing how to die in photogenic positions,True
You'll never hear the phrase it's time to separate the men from the boys in a catholic church.,True
Somewhere there's a dj tanner spinning to a full house and that's what keeps me going you guys.,True
I'm actually not funny. i'm just really mean and people think i'm joking.,True
"In olden times, sacrifices were made at the altar. a practice that still continues",True
"How do '90s kids count to 6? uno, dos, tres, cuatro, cinco, cinco, seis.",True
What did one lesbian frog say to the other lesbian frog? we really do taste like chicken!,True
"Reddit is really a green community, considering all the recycled content on here.",True
Just started a new job and apparently they use the word work less figuratively than i do.,True
3 things i hate: 1. lists 2. irony 3. shitposts on /r/jokes,True
"Never give up, for that is just the place and time that the tide will turn.",True
"Roses are red, voilets are blue, where is my foreskin? oh wait im a jew.",True
Willie nelson died today.. yeah he was playing on the road again..,True
How do mexicans cut their pizzas? with little caesars,True
What do you call a nun in a wheelchair virgin mobile stolen from r/christianity,True
"Why is marriage is like an alarm clock? after the ring, you wake up!",True
Sleepy pilot what did the tired pilot say to his crew? i think i'm gonna crash,True
What do you call a mexican with no legs? cuntswaylow.,True
Samoa is in 2 time zones some of those people are living in the past,True
"If our body is made of cells, what's a picture made of? pixels.",True
What's the worst punchline on /r/jokes? i haven't got the faintest idea.,True
What is the shit you didn't see? the shit you stepped on,True
Did you hear about the contortionist that fell in love? she was heels over head for him!,True
Why couldn't they execute the railway worker with the electric chair? he was too good a conductor,True
Why did they pull a lawsuit against the spa for their wax treatment? it was a ripoff.,True
What do you call a fox with one leg? terry :d,True
It's 364 days until christmas. and people already have their lights up!,True
What do you call a gay guy who gives blowjobs? a butt-head,True
What's a 6.9? another good thing spoiled by a tampon.,True
"One tectonic plate bumped into another and said..... sorry, my fault.",True
Question in a soviet radio. what is your favorite historic figure and why lenin?,True
Life in short life is like a fart if you force it's probably shit.,True
This christmas i got a new car for my wife. i thought it was a great trade.,True
I always ware my seahawks jersey on test day... because i know ill pass even if i shouldn't,True
I wish my x was raised in the power of 2. then she'd always be positive.,True
I heard women love a man in uniform.. can't wait to start working at mcdonalds.,True
I fucked myself last night. i wanted to get first-hand experience.,True
What do you call the runs in space? the floats,True
Anyone have a lot of unused pregnancy tests? hate to see all this pee go to waste.,True
What do italians do when they're waiting for somthing? they pasta time.,True
