text,humor
Why was the sprout farmer so assertive? he was an alfalfa male.,True
What do women and google have in common?  (#s),True
"The worst part of taking calc class every day, i deal with my e^x",True
"I bought a 400 year-old chair from italy... ...but as soon as i sat on it, it baroque.",True
So i let a homosexual man fuck my ear today... now i have hearing aids,True
But how do i know if a guy hates me for me,True
What do you call four mexicans stuck in quicksand? quattro sink-o,True
*sees lawn gnome cartwheel into room* *calls to renew prescription*,True
People out there are trying to contact the dead and you're telling me you can't text back?,True
What does a scotsman wear under his kilt? the codpiece he made out of his girlfriend's face.,True
"Where did the coffee bean find his soul mate? grinder (thanks, ellen)",True
What did the dog say before he died? well i'll be dog-gone.,True
Why did the white girl die of alkalosis? because she was too basic,True
What would you guys like to ask an american? nevermind they'll just tell you anyway,True
What name is given to the most chickens ? peggy,True
You can extend the olive branch.. but you can't beat them over the head with it,True
What did the lumberjack see? he saw a tree.,True
The fastest land animal is a guy that sees a woman about to go through his phone,True
What do you call an owl escapologist? the great hootini,True
How do you kill a fox? give it one leg and make it run across canada,True
Why is reddit tired of the broken arms joke? because it appears in every mother fucking thread,True
Why did the skeleton cross the road? because fuck you thats why.,True
A girl picking up the phone in the middle of sex is a free pass to get weird.,True
What has eight arms and an iq of 80? four girlfriends drinking on st patricks day!,True
What does an american call a canadian dollar? a quarter.,True
Saying you wanted to know where i came from is no excuse for banging my mom.,True
To a guy who said that my jokes about animals are bad i can't bear with it.,True
Mexican and black jokes are all the same.. once you've heard juan you've heard jamal.,True
What sort of activity is eagle hunting classified as these days? illeagle activity.,True
2 drums and a cymbal fall off a cliff. ba dum tss edit: spelling,True
Why don't the blind bungee jump? because it scares the fuck out of the dogs.,True
The only thing standing between you and your dreams is insomnia.,True
What does a battery have that a women hasn't? a positive side....,True
First michael jackson and now neil armstrong. i see god is no fan of moon-walkers.,True
What has 90 balls and screws old women? bingo!,True
What's better than having a 'brexit' vote about britain leaving the eu? not being british.,True
Why does pinocchio lie? because he's a fucking liar.,True
"Behind closed doors, rachael ray prefers the sluttier olive oils.",True
A fire broke out at a gay club last night. police think it was started by a fag.,True
"I bought a new boomerang but it sucks, because i cannot throw my old one away.",True
What do you call a stupid ant? antwerp.,True
"You guys hear about the gay midget? ya, he finally came out of the cupboard.",True
"According to the second law of thermodynamics, you're supposed to share your hotness with me.",True
I hate being a prominent political figure. no-one wants to date a guy with aides.,True
You can learn a lot about a person if you install a camera in their bedroom.,True
"A vagina is like the weather. once its wet, it's time to go inside.",True
To celebrate independence day i'm finding englishmen and then walking angrily away from them!,True
So a cannibal is walking through the jungle... and he passes his neighbor.,True
Why aren't there any walmarts in afganistan? because there's a target on every corner.,True
Why can't isis members go fuck themselves? because sex with animals is haram.,True
Knock knock who's there ! ben ! ben who ? ben knocking on this door all morning !,True
You find out who your real friends are when all you have left to offer is friendship.,True
What do lawyers wear to court? law suits!,True
What do you call a three-humped camel? pregnant,True
I'm having one of those days where nothing seems to be going write.,True
Til... tomorrow i learned that steve buscemi was a volunteer firefighter on sep....,True
What's 18 inches long and hangs in front of an asshole? donald trump's tie,True
How does a vampire clean his house? with a victim cleaner.,True
What's a 6.9? another great thing screwed up by a period.,True
What did the mushroom put in his bio for the online dating service? im a fungi,True
What's a pirate's worst nightmare? a sunken chest with no booty,True
"I used to do drugs... i still do. but i used to, too.",True
I saw a chameleon today so i guess it was a pretty shitty chameleon,True
This dishwasher sucks. it's already ruined three of my paper plates.,True
What do you call a man who expects to have sex on the second date? patient.,True
What's black and screams like fuck? stevie wonder answering the iron.,True
If you are having trouble getting your posts banned from r/science deal with it,True
"What's the longest word in the dictionary? smiles, because there is a mile between each s.",True
How do you make a woman blind? put a windshield in front of her.,True
"When i found out the murderer dismembered the victim, it really tore me into pieces.",True
Love me do was written by john lennon... after he got a really nice haircut,True
"You had me at, we'll make it look like an accident.",True
Why did the blind student get an f on his paper? he didn't sight sources.,True
"I doubt vodka is the answer, but it's worth a shot",True
Million dollar idea: a bathroom mirror that takes pictures.,True
Do 90-year-old men wear boxers or briefs? depends.,True
What do you get when you cross an elephant with a rhino? hellifiknow!,True
Immigrants are like sperm millions get in but only one works.,True
"I'd tell you a joke about fellatio, but it sucks.",True
My wife called me a pedophile... i said that's a pretty big word for an 8 year old,True
What did little hitler get for his birthday? his third treich.,True
Why was michael jackson always late for meetings? because he was always coming in a little behind.,True
Did you hear about the man who painted his wife with cheese? he double gloucester.,True
"I witnessed an attempted murder yesterday. luckily, only one crow showed up.",True
What does an elephant use for a tampon? a sheep.,True
What's the best thing about a hooker dying on you? second hour is free.,True
What type of shoes do pedophiles wear? white vans.,True
What do you call the one white person on a bus full of black people? coach,True
Why was cinderella able to surf the web? because he footman turned into a mouse.,True
What do your call a fish who starts a drug empire? a scarfish,True
Why was the skeleton missing a funny bone because this joke ain't funny,True
How do you make a hormone? don't pay the b!tch.,True
Birthdays were invented by big wax corporations to sell more candles with numbers on them.,True
"In jamaica, how do you know if a mango is ripe? pokemon go!",True
Did you hear about the scientist who discovered the g-spot? he found it while studying abroad.,True
What has four wheels and flies ? a rubbish bin !,True
Sometimes i go on webmd to see what i'm currently dying of.,True
What do you call dirty white underwear? stained glass.,True
How do you know when your gf is getting fat? when she fits into your wifes clothes,True
How do you make an idiot easily wait ? i tell you tomorrow.,True
