text,humor
Hard work pays off in the future but laziness pays off now,True
Your mom is like a shotgun two cocks and she's ready to blow,True
Why did chewbacca fail his driving test? he made a few wookiee errors.,True
What do you call a horny catholic? a firm believer.,True
A redditor walks into a bar... all of our servers are busy right now. try again later.,True
What do you call a group of unorganized cats? a cat-astrophe!,True
"A friend told me that all apples were yellow... i was like, that's bananas",True
What do a hand rolled cigarette and hippy sex have in common? (http://i.imgur.com/krurgf9.gif),True
Why did the spy cross the border? because he never really was on your side.,True
What's obama's favorite thing to do on the weekend? socialize,True
"What do you call an old, dead, bloodsucking leech? margaret thatcher",True
Why did the frog cross the road? he was stapled to the chicken,True
What do you call a lock with low self-confidence? insecure.,True
How do you turn a fox into a cow? marry it,True
Everyone's always talking about our forefathers... i'm pretty sure there were more than that.,True
What do you get when you cross a cartoon character and a communist? mickey mao.,True
Can't trust cnn? next thing ya know nigerian royalty sending me emails will be fake.,True
"Why doesn't the sun go to college? it's extremely bright, it already has 28 million degrees.",True
If george bush had affordable healhcare act would it have been called bushcare?,True
Why do men like smart women? opposites attract.,True
How do you keep someone curious? i'll tell you on my next post,True
What did gandalf say to the guy with a shy bladder? you shall not piss.,True
There was a depressed sausage... he thought his life was the wurst.,True
What do you call a chinese baby in the oven? a 2nd born.,True
"My truck is a lot like tony romo. it will turn over, but the clutch doesn't work.",True
Can we just call it zealand now? how long has it been? move on people,True
A gymnast walks into a bar. he gets a two-point deduction and ruins his chances of a medal.,True
My new girlfriend is a sandwich artist and she's really into roll play,True
"It was christmastime, and everybody was feeling merry. so she went home.",True
Two drums and a cymbal fall off a cliff... ba-dum tss,True
National no bra day? i say pics or it didn't happen day.,True
Newt gingrich sounds like the name of a villain that jk rowling made up.,True
"If you love christmas so much, why don't you merry it?",True
What is it called when you ride around on a horse asking people questions? a gallop poll.,True
What did the soviet man have to say about the nazis? u ss r the worst,True
"If taylor swift wasn't a famous singer, i bet she'd be crazy fucking annoying on facebook.",True
How many babies does it take to paint a wall? depends how hard you throw them,True
God making man in his image was the original selfie,True
Me: *eating a mars bar* martian: good grief where will i obtain alcohol now,True
Did you know that iceland has the death penalty! it's called ramadan,True
Patron 1: i eat at a different restaurant every day. patron 2: i don't tip either.,True
When the river runs red... take the dirt road.,True
I was dating a hot air balloonist at least she let me down gently,True
Why was the 6 month old african baby crying? (updated) cuz he just got dunked on!,True
What is the most famous shark? william sharkspeare!,True
I had sex with my girlfriend while camping once... it was really fucking in tents!,True
What do you call a depressed clementine on a late night walk? a meanderin' orange.,True
Why was slave leia covered in cum and picking hair out of her mouth? she's into chewkaki.,True
My wife and i were happy for twenty years. then we met.,True
Wives are like boats. happy the day you get one. happier the day you get rid of it.,True
Your momma is so fat... but i still fucked her.,True
I have found that a positive pregnancy test will cure hiccups.,True
What does a pirate from boston say? aaahhh.,True
My doctor told me not to eat anything fatty... ...my wife is going to be disappointed.,True
What's the difference between a girl and a woman? prison,True
"I've always heard that karma's a bitch... ...not like i'd know. thanks, reddit.",True
I fucked an asian in an elevator. it was wong on so many levels.,True
"Some guys think sweaters are sexy, but i don't like girls who sweat more than the usual amount.",True
You look like my asian friend from school. yeah his name was ug-lee!,True
"Lets give each other cute nicknames like, 'plaintiff' and 'defendant'",True
What type of underwear does a fetus wear? fruit of the womb.,True
"Matt, you just need to date the type of person that will always be there for you!",True
How do the kardashians tell a joke? they get kim to talk slowly to him.,True
What is michal jackson a chocolate cracker (if they exist),True
Money is the root of all larger amounts of money.,True
"If booze isn't the answer, then your question sucks.",True
I discovered a star wars themed sex technique... i call it the hands solo,True
What's the difference between a cow and 9/11? americans can't milk a cow for 15 years.,True
Why do so many girls do archaeology degrees? because they love digging up the past.,True
My girlfriend is like my bank account only there for the money,True
How do you make a milkshake? give a cow a pogo stick.,True
"What did the sea say to the shore? nothing, he just waved. christmas crackers are the worst.",True
How does kim kardashian like her eggs? over-yeezy. ^forgive ^me,True
"The real reason david beat goliath is that when david threw a rock, goliath threw scissors.",True
These two blondes walk into a building. you'd think one of them would have seen it.,True
Why do they play this music on the elevators if we're not suppose to slow dance:),True
What do you call a seizure you have while mining? an ore spasm.,True
Have you seen the inside of stevie wonder's house? neither has he.,True
Not in a hurry - alcoholism is a slow death! - and we are not in a hurry!,True
I got offered a job at mccormick... ...but it was just seasonal work.,True
Why was the broom late for work? because it overswept.,True
"Please, lady, come home with me. you never know what i'll turn into, at midnight!",True
"Hey, old people! less driving, more dying. thanks!",True
Sometimes i tell my then i laugh at them.,True
I've made myself a girlfriend out of plastic food wrap. she's a bit clingy.,True
What do you call it when water is poured over a clock? time dilution.,True
Oh great. another puppy. - sarah mclachlan's friends at christmas,True
What's the difference between a ladder and a truck? it's no bad luck to walk under a truck.,True
What's 6.9? a good thing ruined by a period.,True
Q. how did a blind woman drive herself  crazy? a. trying to read a stucco wall.,True
"I texted someone hell yeah, but autocorrect changed it to hell year because even our phones know.",True
Why do lesbians shop at dunham's? because they don't like dick's.,True
Why didn't the bike go to the car show? because he was two tired.,True
"In order to catch a cab, one must think like a cab first.",True
What do you call a 6 year old with no friends? a sandy hook survivor,True
What is the best spanish joke you've ever heard? i couldnt find the spanish section of reddit,True
Want to hear a joke?! want to hear a joke? my life :),True
I need some space. - astronaut breaking up with his girlfriend,True
What symbol dispels a hex? a hexagon! -in collaboration with my kid sister.,True
Never commit a crime while working out lest you get ill gotten gainz.,True
