text,humor
How did jared lose all that weight eating at subway? he just ordered off the children's menu.,True
"How long does it take to for mexicans to do a job? oh, wait... they're done.",True
"Which country has the highest number of foolish people? hungary. stay hungary, stay foolish",True
Why did the laptop memory have such a hard time in school? because he was so-dimm!,True
"Imma be, i'm a be, i'm a be, imma, imma, imma be... just kidding, imma wasp.",True
What do you call a cross between two kkk members? burning,True
I saw a man drinking brake fluid. but then he stopped.,True
I was so broke that rahul gandhi came in to eat at my house indian reference,True
"I eat pudding with a fork, so no, crossword puzzles aren't really my 'thing'.",True
How would you describe your past work?  -change management.,True
"If i say i'm going to meet my maker, it's just me having lunch with my parents.",True
What is the difference between oooooohand aaaaaaah? about three inches.,True
A man posts a joke on reddit it is not a repost.,True
Why was the doctor forced to leave work early? the hospital ran all out of patience,True
"What looks like grass but is red? grass, i lied about the red part",True
"Why didn't the chicken cross the road? becoz, its a chicken ... bok bok bawwkkk",True
Q: what did the leopard say when it ate the man? a: that hit the spot.,True
I'm sure everything will be fine. i'm sure of lots of things that are wrong. i'm highly fallible.,True
Pregnant - beyonce pregnant with twins - beytwice,True
How do you clear out an afghani bingo game..? call b52!!,True
The civil war wasn't about slavery . . . . . . it was about ethics in journalism.,True
What do you call a floating penis? space junk,True
What do you get when you ask a proctologist for a second opinion? two fingers.,True
"This is the funniest joke you'll ever read, i promise!",True
Why couldnet anyone win at the bangkok olympics because its always a thai game.,True
Why did kanye west blow up the bakery? because no one man should have all that flour.,True
What do you call a man with a penis and a vagina? andy tohaveapenisandavagina,True
Is it against the law for postal workers to smile or was it my audacity to mail something?,True
"A duck walks into a bar and says get me some chapstick, and put it on my bill!",True
Did you hear about the explosion in the cheese factory? there was de-brie everywhere.,True
Pedophiles should be careful around farms farmers are known for burying seeds.,True
Who will win this super bowl's coin toss? hillary clinton,True
Coworker: do you ever think about work at home? me: i don't even think about work at work.,True
I taught my 1yo how to turn on my mother-in-law's dishwasher since she only uses it for storage.,True
What's bad about being a black jew? you have to sit in the back of the oven.,True
Father: why did you put a toad in your sister's bed? son: i couldn't find a spider.,True
What's the difference between heroin and the cast of the jersey shore? i wouldn't shoot heroin.,True
What do you call the guy you buy your weed from? your chron-tact.,True
"Was hitler really such a bad guy? after all, he did kill hitler.",True
A drug addict died in his sleep... i guess he overdozed.,True
So i got a piece of ass this morning... my finger slipped through the paper.,True
I bought an ipod from el chapo... but now i have to keep jailbreaking it.,True
"So much sh*t comes out your mouth, your ass is jealous.",True
How do you know accountants have no imagination? they named a firm pricewaterhousecoopers.,True
How do you wake up lady gaga? poker face,True
What is the difference between a teacher and a pizza? a pizza can feed a family of four...,True
Why are camels called the ships of the desert? they're full of iraqi semen.,True
I was talking to marcel marceau the other day. you know what he said? nothing he's dead,True
"Did you hear the joke about the pizza? nevermind, it's cheesy.",True
"A sheep, a drum and a snake fall down a cliff badum tss",True
My grandfather was an ace dog fighter he taught michael vick everything he knows!,True
Why do we never run out of math teachers? because they are always multiplying.,True
What's a pedophiles favorite piece of classical music? symphony in a minor,True
Why is gravity so weak? because it doesn't lift,True
So i picked up this girl the other night... and she was all like put me down!!!,True
What type of jeans do the mario brothers wear? denim denim denim,True
Mother: has your tooth stopped hurting yet?...son: i don't know. the dentist kept it,True
What does a cow like to do by a campfire? roast moosmallows!,True
What kind of pants do you buy for your pet chihuahua? shorts!,True
Another yo momma joke yo momma so fat she emits more gravity waves than colliding black holes,True
How did jared fogle lose 40 pounds? he dumped his girlfriend.,True
Why is obama pro gay marriage? because he is a cock sucker,True
"If you don't have hair, will your head skin turn gray when you get old",True
Best politically incorrect joke you have heard ?,True
What do you call a gay boxer? fruit punch. i'm sorry.,True
"Did you hear about the blackout? don't worry, i shot him.",True
Wife: look at it's little heart beating! isn't it amazing... me: it looks like a crossiant,True
What did the racist ghost say? wight power!,True
(xpost: showerthoughts) knock-knock jokes should win the no-bell prize,True
Why do lesbians always win against journalists? scissors beats paper.,True
Smoking kills. smoking panics. smoking tries to hide the body.,True
What do you call two black dudes on a motorcycle? an africa twin.,True
"In an alternate universe somewhere, all the ducks are making white girl faces.",True
70% of being married is just wondering which of us is going to benefit from the life insurance.,True
Q: why don't blonde's like audio-books? a: there aren't any pictures.,True
What did the banana say to the apple? nothing. fruits can't talk. idiot.,True
My girlfriend is on her period... she calls me dracula.,True
Why do they have fences around cemetaries? because people are dying to get in.,True
"Can somebody explain to me why we still use coins? really, it doesn't make cents.",True
I used to face my problems head on... ...now my forehead has bruises.,True
Whats the difference... between a hormone and and enzyme? you cant hear an enzyme.,True
Why do you keep going back to that fishing  website? i can't help it i'm hooked.,True
Why didn't you tell me we were going to a funeral,True
I've been on reddit for too long i've literally been browsing reddit since last year...,True
A marijuana plantation was set on fire witnesses claim a dragon is responsible.,True
"An elephant, a 500lb gorilla, and a naked emperor walk into a room nobody says a thing.",True
Did you hear about the crazy mexican train thief? he has loco motives.,True
I am really good friends with 25 letters of the alphabet. i don't know y. credit: chris turner,True
What do eskimos and tupperware have in common? they both like a tight seal!,True
I hate scrubbing the floor it's beneath me.,True
What kind of fish is made of just two atoms? 2 na,True
According to the bmi chart i am too short.,True
"If it's too cold in a room... go to the corner, it's 90 degrees!",True
What do a christmas tree and a priest have in common? their balls are just for decoration.,True
Why did the mathematician quit his job and join nascar? they told him he was good at deriving,True
I think i might be gay... ...every time i touch my dick i get hard,True
They took my mood ring... ...and i don't know how i feel about it.,True
My roommate says i have schizophrenia jokes on him! i don't have a roommate,True
I just told my wife i am getting her a monkey for her birthday. she went bananas.,True
What do you call a police officer that shoots black people? a police officer in america.,True
