text,humor
What game console do latinos use most? xbox juan,True
A high five is like a regular five that laughs at everything and gets the munchies.,True
What do you take before every meal? a seat.,True
I have to hand it to trump he's the only man to win an argument with a women,True
"What did the green grape say to the purple grape? - breathe, stupid!",True
My dog got into a bag of baking soda this morning ...and now she's a basic bitch,True
Sorry for my poor volume control regulation but this is a good cuddle,True
What do you call a snake that tells bad jokes? a corn snake,True
Where do david cameron and his party meet? in the conservatory!,True
What do you call a chicken with lettuce on its eyes? chicken caesar salad.,True
When your toddlers are teenagers don't forget to wake them at 5am because your sock came off,True
When does 1+1=3? ..... when you don't use a condom.,True
Eating a box of thin mints doesn't make you thin. apparently.,True
Did you hear about the pessimistic man who was missing a chromosome? he was a real downer.,True
What's that movie about the girl who forgets adam sandler every day? i want to know her secret,True
What do you get when you put a baby in a blender? nsfw an erection,True
What does donald trump say after sex? i'm **president**,True
Do you have space... for my peepee in your butt?,True
Crack-head's favorite rap song... i wanna rock right now!!!!,True
"What did the fruit say to the vegetable before dinner? lettuce, pray.",True
Its o.k. to laugh during sex ... just don't point !,True
Who was the 45th vice president of the united states?,True
What happens when a spoon and fork get into a fight? civilwar,True
What do you want for dinner? 4: a bucket.. *googles better school districts,True
Why did germany win so many battles in ww i? they had baron.,True
Why did sally fall off the swing? she had no arms. ~ knock knock. *who's there?* not sally,True
From a christmas cracker: what did the puppy say when it sat on sandpaper? ruff,True
My brakes failed the other day and i got a crash course on newton's first law,True
9 out of 10 men prefer large breasts. the other man prefers the 9 men.,True
Life is like a box of chocolates which doesn't quite fit in the username box,True
I don't want to make a spectacle... eye glass manufacturers last day on the job.,True
Why don't plumbers like to work on instant hot water heaters? it's a tankless job!,True
Milk toast was probably named by same lazy guy that named the fireplace and waterfall.,True
What do mexican parents and good reddit comments have in common? they have lots of children.,True
Why was the birthday cake as hard as a rock? because it was marble cake!,True
I basically have 3 hairstyles... straight. wavy. homeless.,True
True laziness is being excited when plans get canceled.,True
"Before chris brown did a concert with them,,, they were just known as the peas.",True
"Where you do see yourself in five years? i don't know, i don't have 2020 vision!",True
"Did you know, that pigeons die when they have sex? at least the one i fucked did.",True
I asked nurse joy if she could examine me. she said i'll take a pikachu.,True
Snail 1: are you male or female? snail 2: yes snail 1: me too!,True
"If love at first sight was really a thing, i would've been married to cheetara from thundercats",True
What's the difference between a porsche and a porcupine? a porcupine has the pricks on the outside,True
Cannibals don't drink coffee. they have a cup of joe instead.,True
It's hard to stop being depressed because gravity is always bringing me down.,True
A girl quit her job at the doughnut factory... she was fed up with the hole business.,True
What did sushi a say to sushi b? wasabi,True
Why was 9 afraid of 7? because 7 had some pcp and was going ape shit!,True
Why does missouri share borders with the most amount of states? because missouri loves company,True
I saw someone spill a protein shake in the gym today whey,True
Where does the dentist get his gas?...at the  filling station,True
What's the opposite of christopher walken? christopher walkout,True
"God: noah, i need an ark. noah: why don't you ask joseph, the carpenter? god: uh  up top?",True
Why are canadians atheist? because they are eh-theists.,True
"I remember when halloween was the scariest night of the year... now, it's election night.",True
If you speak japanese... why would you support trump? he's such a card.,True
Why was ke$ha arrested? tik tok on the clock,True
Police: everything you say can and will be held against you criminal: boobs,True
"What do pink floyd, dale earnhardt, and donald trump have in common? the wall.",True
What do you call a mexican baptism? bean dip!,True
It's a good thing aquaman isn't black shortest...comic book...ever!,True
What do you get when you cast michael j. fox as walter white? shaking bad.,True
Computer dating is fine... if you are a computer.,True
Looking for a friend with benefits. preferably dental.,True
"My stages of drunk: 1) everybody, watch this! 2) prison",True
Why did the scarecrow get promoted? he was outstanding in his field.,True
Why do girls wear makeup and perfume? 'cause they're ugly and they stink.,True
Nsfw: why would i not vote for bernie sanders because he is bs.,True
Why did the pirate go to ireland? he thought he was going to arrrland.,True
Turtle to turtle: don't ya just love the sound of rain on your roof?,True
What was the console gamer's new years resolution? 1280x720,True
What's the difference between your wife and your job? after five years your job will still suck.,True
How do you call the mexican who lost it car? carlos,True
There is nothing more enjoyable than watching a child being chased by a seagull.,True
I like horror movies because it's the only place insanely hot people are treated poorly,True
I wish more people were fluent in silence.,True
What do you call a pair of snakeskin trousers? serpants.,True
Why can't you trust a garbage man who loves his job? because he's always talking trash.,True
How did donald trump get his tonsils removed? vladimir putin wore a spiked condom.,True
What's black and white black and white black and white? a nun rolling down a hill.,True
I failed my spelling test i got an f for f-ort.,True
People say his actions move people to tears. well i wasn't aware he was rapist.,True
When the food packaging says serves 3 - 4 people the fat controller laughed you are wrong,True
What was wrong with genghis khan's new suit? there was a chink in his armor.,True
I wanted to have sex with uma thurman until i saw her toes in kill bill.,True
Why was hitler a pussy? because he had nein lives!,True
Why did the psych ward escapee never get married? he had a fear of commitment,True
What do you call a chav in a box? innit.,True
"Ahmed, you're parking too far away from the sidewalk. who cares, its gonna explode anyways.",True
Maybe i'm covered in chameleons right now. i'll never know for sure.,True
You never told me you were vegan! - no one ever,True
What blood type do people from taiwan have? taipei,True
"How many ears does spock have? three. the left ear, the right ear, and the final front ear.",True
You can run but you can't hide is a funny thing to say to children with asthma,True
"Woman : all men are dogs. me : which breed is your dad, bitch?",True
The leading cause of death in 1926 was being hit by a spinning newspaper graphic,True
What did the blonde say when her doctor told her that she was pregnant? is it mine?,True
Want to here a word i just made up? plagiarism.,True
What's the opposite of a somersault? a winter pepper.,True
