text,humor
Two guys walk into a bar.... you would think the first guy would've warned the other.,True
What makes a juice joke so funny? the punchline,True
Going to attempt a mexican joke. hope it's a good juan!,True
"What do jewish pedophiles say? hey kids, want to buy some candy?",True
How many seconds are in a year? only 12. one for every month.,True
Masturbation is like procasination in the end you're just fucking yourself,True
Why does waldo wear stripes? he doesn't want to be spotted,True
"Remember, it's not what you do... it's what you get away with.",True
I'm not paying any more child support. his posture hasn't improved at all.,True
What's donald trumps favorite pink floyd album the wall,True
Why was the cannibal fined by the judge?  he was caught poaching.,True
How did moses make his coffee? hebrewed it.,True
Knock knock. who's there? app app who? welcome to the quickee mart,True
A man walks into a zoo but there was only a dog in it. it was a shitzu.,True
So you're all obama fans now? name 3 of his albums.,True
What do you call a dadaist fabric? man rayon,True
The next person to make a gay joke is going to get their ass pounded,True
I'd make a political joke but it would just end up being elected.,True
What do you call a mexican in canada? accomplished. they crossed two borders!,True
What do you call that feeling when the bus finally arrives? a peasantfeeling,True
"Adhd in the streets naughty fr...so hey, does anyone want to play sonic the hedgehog?",True
"To the guy in the wheelchair who stole my camouflage jacket... you can hide, but you can't run",True
I bet you've already heard this it's a pretty common word.,True
"How many mexicans does it take to build a....... oh shit, they're done.",True
Did you know condoms had serial numbers? i guess you've never had to roll it down that far,True
I remember 2016 like it was just yesterday,True
Have you heard the gullible joke? me neither...,True
I tried to watch the paralympic games.. i couldn't though because the channel was disabled,True
Newt gingrich is the result of leaving a bobble head doll by a radioactive power plant.,True
Calculating the trajectory of an airborne booger is snot rocket science,True
Why did michael jackson love beethoven's 3rd symphony? it was done in a minor.,True
Wanna hear a joke about reddit and clickbait?,True
"Why is islam called the religion of peace? after you leave the religion, you rest in peace.",True
What does a nosey pepper do? get jalapeno business,True
"My girlfriend is like the square root of -100 a solid 10, but imaginary",True
"Face down, ass up. that's how i like to tie my shoes.",True
Have you heard of drooling jesus? he's offering salivation.,True
What do you call a turtle that sends pictures to everyone? a snapping turtle,True
I had a dream last night that i was a muffler... i woke up exhausted.,True
How do you sink a submarine full of blondes? knock on the door.,True
You are so sweet... ...is your zodiac sign caries?,True
Your mum should get tested for hiv it will be the only positive thing in her life,True
I slept with a supermodel last night alternative facts.,True
Don't try to tell me that hungry is not an emotion because i feel that in my soul.,True
Scientists have found... ...that people don't give a damn about apathy.,True
All i wanna do is  fix this broken synthesizer,True
What's the difference between bill clinton and santa? santa stops at 3 'ho's',True
Why'd the air resistance committed suicide? because he's always being neglected,True
Why don't drug addicts hang out at the beach? they don't like getting sand in their crack.,True
Did you hear about the award winning scarecrow? he was out standing in his field.,True
I hate street performers but then again i'm a mime artist so i can't really talk,True
What has 4 wheels and flies? a garbage truck.,True
Thought i saw a walking burrito but it was just a pug in a raincoat.,True
What are a clumsy person's favorite flowers? oopsie daisies.,True
What kind of computer says hello? a dell,True
Why don't cannibals like to eat clowns? because they taste funny.,True
The internet at my school went out today looks like kim kardashian finally achieved her goal,True
What does the l stand for in samuel l. jackson? motherfucking it stands for motherfucking,True
What do you call a gnome that muffs a fairy ? goblin....,True
What's a rabbits' favorite dance? the bunny hop.,True
How do you know which tree is the jew? it doesn't drop apples.,True
Did you hear about the cannibal who tried eating his clone? he was getting ahead of himself.,True
I wonder if mutes ever sign now that's what i'm talking about!,True
Man's march (on washington) can be observed every day at 8am. also known as going to work.,True
*drinking water without ice* this must be what it feels like to be in prison.,True
Did you know danny welbeck's dad was a bomb disposal expert. his name was stan welbeck.,True
Communist jokes are not funny... unless everyone gets them,True
Idea: a hat store called all caps where the salespeople yell at you the entire time.,True
There are 2 kinds of people in this world: 1. people who aren't good with numbers,True
I asked my pharmacist for advice on telling a rash joke.. he told me to make it topical.,True
I want to tell you guys a small joke it's very puny!,True
What did ahab yell out to moby dick as it swam away? catch you later!,True
What do you call a wizard holding a teacup? a saucer-er!,True
"Revenge is a dish best served with anchovies. seriously, it hides the taste of cyanide",True
What do you call a bunch of white guys in a burning building? fire crackers.,True
What do you do when a scientist dies? you barium! ba-dum-tss,True
"True friends don't judge each other.... they judge other people, together.",True
What did the ear of corn say when all of its clothes fell off? aw shucks!,True
Can you read chinese? yes but only when it's printed in english.,True
Judge: i sentence you to 2 consecutive life sentences  cop: this baby camel is under arrest,True
What did the rapper say when he couldn't find his pants? where my knickers at?,True
"Dear high school reunions, you are now obsolete. please contact facebook with any questions.",True
"Knock, knock... who's there? peas. peas who? *peas pass the butter*",True
How many prostitutes do you have to kill until someone notices? i'm not sure yet.,True
"So if they were called the mario bros., that means mario's last name was mario?",True
What dog do other dogs tell their problems to?  a complaint bernard!,True
Why are tamales a christmas tradition? so mexicans have something to open on christmas,True
Mario: you-a kill my father! wario: no. i am-a your father. mario: mama-mia!,True
Arcade fire: great band / nerd way to die,True
A cow went to war... but he didn't know what was at steak.,True
Where does dracula keep his valuables? in a blood bank.,True
"Why do librarians like the wind? it says, shhh! all day!",True
The least offensive joke ever. the french military.,True
What do you call three cars overtaking you in mexico? tres-passers.,True
I used to be in a band called missing cat' you've probably seen our posters.,True
Best vine with nigga - chocolate milk https://www.youtube.com/watch?v=6jzfr4pwibs,True
College doesn't prepare you for holding in farts in the workplace.,True
The purest love in the world exists between a rapper and his exotic fish tank.,True
What did the two tampons have in common? they were both stuck up bitches,True
You know the world is corrupted.... when people buy the 2015 macbook.,True
