text,humor
What was the vegan rock band's first hit? lettuce turnip the beet!,True
"Women like men with an accent, not an axe scent",True
Why won't americans switch to a dollar coin? they're afraid of change.,True
Why are there no jehovah's witnesses in italy? the mafia doesn't like witnesses.,True
I'm beginning to suspect i might have bad posture call it a hunch,True
What's the most important part of making a mexican joke ? making sure that no juan hears you.,True
What do you call a salty white person? a saltine.,True
What do you call an irish jew? a leprechaun!,True
What did the frog with internet addiction say? reddit,True
What are mario's overalls made of? **denim denim denim.**,True
How did skrillex get potassium hydroxide all over the floor? he dropped the base.,True
Just been sacked from my job as a chef for stealing i've always been a whisk taker.,True
Road painters are not the kind of friends you should be around... they do lines all day.,True
Why wasn't jesus born in the usa? because god couldn't find three wise men and a virgin.,True
Do you wanna here something ironic?? iron man is a fe-male!,True
How do you stop a gang-rape? throw a basketball in the middle,True
"Before an army officer can get married, they need to know the rules of engagement.",True
"There's only 7,100 cheetahs left in the wild. scientists say they are racing towards extinction.",True
The easiest way to create a feeling a suspense. ...,True
What do you call a horny square? erectangle,True
How many electrons does a negatively charged oxygen atom have? nion,True
Scorpin and subzero walk into a bar the bar gets hot from scorpin and cold from subzero!!,True
Why did trump call for a ban on all llamas entering the us? because he isllamaphobic,True
Is it racist if a guy with a small dick calls it his ding dong?,True
I was going to tell you a joke about infinity but there is no end to the joke....,True
What do a redneck and hippie have in common? they both hate the government.,True
"An electric field walks up to a dipole and asks, do you have a moment?",True
Knock knock who's there ! anthony ! anthony who ! anthony you want !,True
Office theft someone stole my microsoft office and they're gonna pay. you have my word,True
What's the difference between your boyfriend and whipped cream? the cream,True
Grandpa joke: what becomes shorter when you add 2 letters? short,True
The band europe is rereleasing their greatest hits on records. it's the vinyl countdown.,True
Did you hear about nursing home sports league everyone gets atrophy at the end of the season.,True
"Humans have 46 chromosomes, peas 6 and crayfish 200. you're clearly not that complicated.",True
"If you need help staying awake, subtract sheep in your head.",True
Have you heard about what happened to that biggest sausage party last weekend? nobody came.,True
I like my women like i like my wine... 12 years old and locked in a cellar,True
I was in a bad place when my girlfriend broke up with me. a brothel.,True
I tried to catch some fog the other day.. i mist.,True
What's worse than 5 dead babies in 1 trash can? 1 dead baby in 5 trash cans,True
"What did the handless box get for hristmas? gloves. just kidding, he hasn't opened it yet.",True
Fun prank make them study for 18 years then don't give them jobs,True
My favorite part of church is when they pass around free money.,True
Jesus: *resurrected* mary magdalene: i have a boyfriend.,True
Which wizard can help you tone up your arms and upper body? dumbbelldor.,True
"When i told the doctor about my loss of memory, he made me pay in advance.",True
Football gave me a traumatic brain injury and i was only watching.,True
"How do you confuse a blonde? hold up two shovels and say, take your pick.",True
Why is it never safe to tell a joke about corn? a corn has ears.,True
It's so cold outside i saw a politican with his hands in his own pockets.,True
"My dad was a huge feminist... what about your mom? no, no. dad wouldn't allow that.",True
What kind of asian dish takes away your freedoms? kung pao chicken,True
Remember to look both ways before crossing a woman.,True
"Dates are like golf strokes the fewer it takes for you to score, the better your game.",True
What do you call a guy in a lot of debt? owen.,True
How long does it take for a black woman to take the trash out? 9 months,True
What is an injured persons favorite movie? cast away,True
I'm kind of clueless about pop culture. i thought hogwarts was an std,True
Why did the cowboy get a miniature dachshund? he wanted to get a long little doggy.,True
"First guy (proudly): my wife's an angel!' second guy: you're lucky, mine's still alive.",True
"I don't think so, said rene descartes just then he vanished.",True
"We must be subatomic particles, because i feel strong force between us.",True
People who marry for money over love usually end up cheating for love over money!,True
"My girlfriend is quite pessimistic about our sex life, but i'm a vagina half full kind of guy.",True
A mexican and a black are in the car. who is driving? the cop.,True
Why did the cell phone need glasses? because it ran out of contacts.,True
Do girls imagine themselves sucking in a invisible spaghetti when they're about to take a picture?,True
Waiter waiter! there's a dead spider in my soup. yes ma'am they can't stand the boiling water.,True
I live in a glass house and my back door is a jar,True
What do you call 100 black people on a plane to africa? a good start.,True
Nsfw your dick's like mt. everest. .. it's hard to get up.,True
What do (does?) rihanna and onion rings have in common? they're both battered.,True
What do you call squidward's protest group in mexico? counter-esp*i*on*a*ge,True
1. denial 2. anger 3. bargaining 4. depression 5. acceptance ... the 5 stages of buying petrol.,True
Why does green think yellow is such a slut? because yellow blue red.,True
Trying to grab a stall after lunch as a male. it's a crap shoot.,True
My farts are so strong..... i can make bubbles in the shower!,True
I just learned avicii is a singer and not roman numerals for 1952.,True
"Whenever i'm bored, i call one of my parents and ask them to describe how the internet works.",True
Chuck norris once went through the wendy's drive thru and ordered a big mac .......and got one.,True
How do all racist jokes start? *looks around everywhere*,True
"Whats similar with a dick and a rubik cube? if you play with it, it gets harder...",True
"Let's eat, get drunk and watch people exercise  sports fans",True
What is your mom's favorite animal? an armadildo,True
Happiness is a relative thing. i finally have some extra money and suddenly my relatives are happy.,True
Why do baptists forbid premarital sex? because they're afraid it could lead to dancing.,True
"Operator: 911, what's your emergency. me: i'm 33 and i tried to do a cartwheel.",True
Them: you can't go wrong with this recipe. me: watch me.,True
What do you call it when a doctor has sex with a quarantined patient? sick fuck.,True
What is a simile? it's like a metaphor.,True
I thought i might be pregnant. it turns out i'm just three months fat.,True
Why did blackbeard cross the road? to indicate where the treasure is buried.,True
"Of course every kiss begins with k. that's how the english language works, stupid.",True
"Just a short joke you are probably pretty familiar with yep, it's your penis",True
There are three unwritten laws of life... 1. 2. 3.,True
What is the most up-voted comment of all time? repost,True
Bro what if soy milk is just regular milk introducing himself in spanish?,True
Why can't you run through a campsite? because you ran when it's past tents.,True
I'm in one of those weird marriages where we still have sex every day.. with each other!,True
What did all the creepy people do before the internet?,True
