text,humor
A vampire could've photobombed every picture you've ever been in and you will never know,True
I tried to get back to the drawing board but i can't draw.,True
What is the difference between harry potter and a jew harry potter escaped the chamber .,True
What the difference between reddit and other sites? on some of them you actually have a voat,True
"Don't worry, men. women can't tell women to calm down either.",True
Whats a yoga instructors favourite kind of coffee? pilatte,True
Sometimes i wrestle with my demons. sometimes we just snuggle.,True
The oscars so white i gotta wear shades.,True
Apple stock apple's stock surges on announcement of two-child policy change in china,True
Give me your best your mom... joke! like this: your mom is so fat she ate the internet!,True
How many gays does it take to change a lightbulb?,True
Trump made up his very own word for what he will be in less than 2 years unpresidented,True
My parents always said no drugs before marriage after that.... they just understood.,True
Did you hear about that geeky trigonometry expert? the only angle lacking in his life was secs.,True
What do you call 4 mexicans stuck in quicksand? quatro cinqo.,True
*gets stabbed omg that knife was clean right??,True
"*magneto flapping his wrist frantically, trying to shake loose a fork stuck to his hand*",True
I accidentally have two dates tomorrow night should i handle this like a sitcom or an adult,True
What do you call two turds getting intimate in heaven? holy fucking shit.,True
Expecto me to be there harry potter rsvping to a party,True
What's green and red and goes 100 mph? a frog in a blender.,True
What's the difference between jam and jelly? i don't jelly my cock down a bitches throat.,True
Why should we make gabe newell president? there won't be any world war 3. \#gaben2k16,True
Q: how do dogs order eggs at restaurants? a: pooched.,True
"What did one viking war paint say to the other? poly, you're a thane.",True
The kkk was a conservationist group. they just wanted to put the monkeys back in the trees.,True
Why couldn't the glue hold the walls together? because it wasn't ceiling.,True
If chopsticks were really better than a fork... ...wouldn't we be digging ditches with pool cues?,True
What did the pope say when a cougar crossed his path? oh my gosh i almost puma pants.,True
"I could be wearing a onesie right now, you don't know.",True
What do you call someone who spends all day masturbating in the restroom? pissing away your future.,True
What internet provider does satan use in hell? comcast,True
A midget clairvoyant just escaped from prison... ...police are looking for a small medium at large.,True
What do you call the japanese police force? kawaii five-0,True
Why is there no aspirin in the jungle? because the parrots eat them all,True
What does god call his nose? god knows.,True
What do jews throw when they riot? mozeltov cocktails,True
Babysitting is a way for teenagers to feel like adults while adults go out to feel like teenagers.,True
My psychiatrist said my exhibitionist disorder was incurable. i'll show her.,True
Having kids can really strengthen a marriage. my wife and i never had a common enemy before.,True
"In alcohol's defense, i've done some pretty dumb shit while completely sober too.",True
"Say what you want about skiing... ..but the sports going downhill, fast!",True
I hit a kid with my car last night then i realized it was only a goat.,True
What always stays hot in the refrigerator? horseradish,True
What do black people get when they die? nigger mortis,True
What do you get if you mix a rhetorical question and a joke?,True
You don't need a parachute to go sky diving you need a parachute to go sky diving twice,True
What do cats read in the morning ? mewspapers !,True
"Lpt: when cooking chicken, it needs a lot of support alone, it tastes absolutely fowl.",True
"We only cook with fresh, local ingredients so tonight we're grilling our neighbor's cat.",True
What do chickens serve at birthday parties ? coop-cakes !,True
What do you call a learned spider? a webdesigner,True
There are 10 types of people in this world... those who understand binary and those who don't.,True
"So, a snake walks into a bar.... and the bartender asks in surprise how'd you do that?!",True
Scientists have successfully grown vocal chords in a petri dish the results speak for themselves.,True
Why can't atheist solve exponential problems? because they don't believe in higher powers.,True
How many clickbait articles does it take to change a lightbulb? the answer may shock you.,True
"Okay, let's get this straight. there's no way everyone has the best boyfriend in the world.",True
What do ted cruz and an impotent japanese man have in common? neither can achieve an election,True
Which is the smartest tall mountain? mt. cleverest hue hue,True
Did you know that 50% of asian businessmen have cataracts? the other half have bmw's.,True
Knock knock who's there ! alexia ! alexia who ? alexia again to open this door !,True
How can you kill an idiot with half a dollar?  throw it under a bus.,True
How did feminism start? some guy forgot to lock the kitchen door,True
What do you call an exceptionally intelligent gay man? homogeneous,True
What's the difference between my bike and your mom? your dad doesn't watch when i ride my bike.,True
Donald trump will make america great again... ... he's already grating on me!,True
Describe yourself in 3 words i am a rebel,True
Rate kickass only this if your name isn't steve,True
3 rings in a man's life 1. engagement ring 2. wedding ring 3. suffering,True
What do you call a worthless priest? holy shit.,True
Fart joke why don't women fart? they don't get an arsehole until they get married!,True
"If betty white killed someone, i wouldn't turn her in.",True
My dog just got into a bottle of tums she is now a basic bitch.,True
"Breasts are like beer... men may state a preference, but we'll take whatever's on tap.",True
Have you heard about the new web md zodiac? all the signs say cancer.,True
The word nothing is a palindrome. nothing reversed is gnihton. which also means nothing.,True
How do you know it's midnight at the neverland ranch? the big hand's touching the little hand.,True
Did you hear about the lumberjack who worked overtime? he logged a lot of hours.,True
I thought more people would laugh at my candy joke... but all i heard was a few snickers.,True
A bicycle cannot stand alone; it's two tired!,True
If donald trump is elected president... there'll be hell toupee.,True
If you can read this please let me know  because it means i blocked the wrong person.,True
Everybody on earth must be ''literate''... because nobody ever uses the trash cans anymore :/,True
Why has america been abbreviated to usa because it has to capitalize everything,True
I'm still i'm still jenner from the block i really want a fanny but i have a cock.,True
How much does a pirate pay for corn? a buccaneer!,True
All i wanna do is  move to a safer neighborhood,True
"Why didn't the lifeguard save the hippie that was drowning? because he was too far out, man",True
What do you call a french pole vaulter? a leap frog,True
Why did the nazi refuse to drink lemonade? he hated acidic juice.,True
Why did god create man before woman? he didn't want any advice.,True
An orchestra went to the desert which member felt the warmest?  the conductor.,True
No power. mitt romney : 8 million americans still have no power. obama: 8 million and one.,True
Friend: try to relate to her. (later on date) me: *nervously* can i be your cousin?,True
Breaking: microsoft announces the monkees catalog now available on zune.,True
So.. this pickup line works knock knock. who's there? sex with. sex with who? sex with me!,True
"I won every fight in 1st grade. not because i was tough, because i was 13.",True
I hope this year they have the courage to legalize diarrhea.,True
Why was six afraid of seven? because seven was a well known six offender,True
